"Company","Parent Company","Penalty Amount","Subtraction From Penalty","Penalty Amount Adjusted For Eliminating Multiple Counting","Penalty Year","Penalty Date","Offense Group","Primary Offense","Secondary Offense","Description","Level of Government","Action Type","Agency","Civil/Criminal","Prosecution Agreement","Court","Case ID","Private Litigation Case Title","Lawsuit Resolution","Facility State","City","Address","Zip","NAICS Code","NAICS Translation","HQ Country of Parent","HQ State of Parent","Ownership Structure","Parent Company Stock Ticker","Major Industry of Parent","Specific Industry of Parent","Info Source","Notes"
"Asbury Automotive Group, Inc.","Asbury Automotive Group","$15,339","$0","$15,339","2012","20121023","employment-related offenses","wage and hour violation","Fair Labor Standards Act","","federal","agency action","Labor Department Wage and Hour Division","civil","","","1665664","","","Florida","Fort Pierce","","34982","44111","44111: New Car Dealers","USA","Georgia","publicly traded","ABG","retailing","retail-automotive","March 7, 2017 download of a dataset posted by the Wage and Hour Division at https://enforcedata.dol.gov/views/data_summary.php","Date and year are the Findings End Date in the dataset posted by the Wage and Hour Division, which does not provide case opening or closing dates. The company name is the Legal Name provided by the dataset unless that field is blank, in which case the Trade Name is used. The dataset provides only one address and does not indicate whether it is the company headquarters address or the establishment address. The penalty amount is the total of civil monetary penalties and mandated back wages. The original dataset provides a breakdown."
"Asbury Automotive Group, Oregon LLC","Asbury Automotive Group","$5,562","$0","$5,562","2004","20040501","employment-related offenses","wage and hour violation","Fair Labor Standards Act","","federal","agency action","Labor Department Wage and Hour Division","civil","","","1369838","","","Oregon","Gladstone","","97027","4411","4411: Automobile Dealers","USA","Georgia","publicly traded","ABG","retailing","retail-automotive","March 7, 2017 download of a dataset posted by the Wage and Hour Division at https://enforcedata.dol.gov/views/data_summary.php","Date and year are the Findings End Date in the dataset posted by the Wage and Hour Division, which does not provide case opening or closing dates. The company name is the Legal Name provided by the dataset unless that field is blank, in which case the Trade Name is used. The dataset provides only one address and does not indicate whether it is the company headquarters address or the establishment address. The penalty amount is the total of civil monetary penalties and mandated back wages. The original dataset provides a breakdown."
"Asbury Automotive St. Louis, LLC, d/b/a Plaza Motors","Asbury Automotive Group","$6,446","$0","$6,446","2016","20160829","employment-related offenses","labor relations violation","","back pay award in unfair labor practices case","federal","agency action","National Labor Relations Board","civil","","","14-CA-170495","","","Missouri","St. Louis","","","","","USA","Georgia","publicly traded","ABG","retailing","retail-automotive","Extracted from a spreadsheet obtained from the NLRB through a Freedom of Information Act request fulfilled on 5/16/2017.",""
"Asbury Automotive","Asbury Automotive Group","$300,000","$0","$300,000","2001","20010409","consumer-protection-related offenses","consumer protection violation","","","state","agency action","Oregon Attorney General","civil","","","","","","Oregon","","","","","","USA","Georgia","publicly traded","ABG","retailing","retail-automotive","https://web.archive.org/web/20111209130030/http://www.doj.state.or.us/releases/2001/rel040901.shtml",""
"ASBURY AUTOMOTIVE ST. LOUIS II, LLC","Asbury Automotive Group","$5,100","$0","$5,100","2015","20150508","safety-related offenses","workplace safety or health violation","","","federal","agency action","Occupational Safety & Health Administration","civil","","","","","","Missouri","MARYLAND HEIGHTS","11820 LACKLAND RD.","63043","811121","811121: Automotive Body, Paint, and Interior Repair and Maintenance","USA","Georgia","publicly traded","ABG","retailing","retail-automotive","Extracted from a download of OSHA's Enforcment Data downloaded on 3/02/2022, available at https://enforcedata.dol.gov/views/data_catalogs.php",""
"ASBURY AUTOMOTIVE","Asbury Automotive Group","$6,400","$0","$6,400","2016","20160418","safety-related offenses","workplace safety or health violation","","","federal","agency action","Occupational Safety & Health Administration","civil","","","","","","Missouri","CREVE COEUR","700 DECKER","63141","441110","441110: New Car Dealers","USA","Georgia","publicly traded","ABG","retailing","retail-automotive","Extracted from a download of OSHA's Enforcment Data downloaded on 3/02/2022, available at https://enforcedata.dol.gov/views/data_catalogs.php",""
