"Company","Parent Company","Penalty Amount","Subtraction From Penalty","Penalty Amount Adjusted For Eliminating Multiple Counting","Penalty Year","Penalty Date","Offense Group","Primary Offense","Secondary Offense","Description","Level of Government","Action Type","Agency","Civil/Criminal","Prosecution Agreement","Court","Case ID","Private Litigation Case Title","Lawsuit Resolution","Facility State","City","Address","Zip","NAICS Code","NAICS Translation","HQ Country of Parent","HQ State of Parent","Ownership Structure","Parent Company Stock Ticker","Major Industry of Parent","Specific Industry of Parent","Info Source","Notes"
"Austin Industrial Inc","Austin Industries","$44,183","$0","$44,183","2012","20120619","employment-related offenses","wage and hour violation","Fair Labor Standards Act","","federal","agency action","Labor Department Wage and Hour Division","civil","","","1686424","","","Texas","Borger","","79007","236210","236210: Industrial Building Construction","USA","Texas","employee-owned","","construction and engineering","construction & engineering","March 7, 2017 download of a dataset posted by the Wage and Hour Division at https://enforcedata.dol.gov/views/data_summary.php","Date and year are the Findings End Date in the dataset posted by the Wage and Hour Division, which does not provide case opening or closing dates. The company name is the Legal Name provided by the dataset unless that field is blank, in which case the Trade Name is used. The dataset provides only one address and does not indicate whether it is the company headquarters address or the establishment address. The penalty amount is the total of civil monetary penalties and mandated back wages. The original dataset provides a breakdown."
"Austin Industrial, Inc","Austin Industries","$214,398","$0","$214,398","2012","20120619","employment-related offenses","wage and hour violation","Fair Labor Standards Act","","federal","agency action","Labor Department Wage and Hour Division","civil","","","1656845","","","Texas","Borger","","79007","236210","236210: Industrial Building Construction","USA","Texas","employee-owned","","construction and engineering","construction & engineering","March 7, 2017 download of a dataset posted by the Wage and Hour Division at https://enforcedata.dol.gov/views/data_summary.php","Date and year are the Findings End Date in the dataset posted by the Wage and Hour Division, which does not provide case opening or closing dates. The company name is the Legal Name provided by the dataset unless that field is blank, in which case the Trade Name is used. The dataset provides only one address and does not indicate whether it is the company headquarters address or the establishment address. The penalty amount is the total of civil monetary penalties and mandated back wages. The original dataset provides a breakdown."
"AUSTIN INDUSTRIAL SPECIALTY SERVICES, L.P.","Austin Industries","$10,800","$0","$10,800","2011","20110223","safety-related offenses","workplace safety or health violation","","","federal","agency action","Occupational Safety & Health Administration","civil","","","","","","Texas","DEER PARK","41 TIDAL ROAD","77536","488210","488210: Support Activities for Rail Transportation","USA","Texas","employee-owned","","construction and engineering","construction & engineering","Extracted from a download of OSHA's Enforcment Data downloaded on 3/02/2022, available at https://enforcedata.dol.gov/views/data_catalogs.php",""
"Austin Industries, Inc.","Austin Industries","$6,200","$0","$6,200","2018","20180529","safety-related offenses","railroad safety violation","","","federal","agency action","Federal Railroad Administration","civil","","","ZAID 2016-1(HMT)","","","","","","","","","USA","Texas","employee-owned","","construction and engineering","construction & engineering","https://www.fra.dot.gov/eLib/Find#p1_z5_lEA",""
"AUSTIN INDUSTRIAL SERVICES, LP","Austin Industries","$12,500","$0","$12,500","2015","20150507","safety-related offenses","workplace safety or health violation","","","federal","agency action","Occupational Safety & Health Administration","civil","","","","","","Texas","MONT BELVIEU","10319 HWY 146","77580","237990","237990: Other Heavy and Civil Engineering Construction","USA","Texas","employee-owned","","construction and engineering","construction & engineering","Extracted from a download of OSHA's Enforcment Data downloaded on 3/02/2022, available at https://enforcedata.dol.gov/views/data_catalogs.php",""
