"Company","Parent Company","Penalty Amount","Subtraction From Penalty","Penalty Amount Adjusted For Eliminating Multiple Counting","Penalty Year","Penalty Date","Offense Group","Primary Offense","Secondary Offense","Description","Level of Government","Action Type","Agency","Civil/Criminal","Prosecution Agreement","Court","Case ID","Private Litigation Case Title","Lawsuit Resolution","Facility State","City","Address","Zip","NAICS Code","NAICS Translation","HQ Country of Parent","HQ State of Parent","Ownership Structure","Parent Company Stock Ticker","Major Industry of Parent","Specific Industry of Parent","Info Source","Notes"
"Nissan of Brandon, Inc.","AutoNation","$5,660","$0","$5,660","2012","20120714","employment-related offenses","wage and hour violation","Fair Labor Standards Act","","federal","agency action","Labor Department Wage and Hour Division","civil","","","1659590","","","Florida","Tampa","","33619","44111","44111: New Car Dealers","USA","Florida","publicly traded","AN","retailing","retail-automotive","March 7, 2017 download of a dataset posted by the Wage and Hour Division at https://enforcedata.dol.gov/views/data_summary.php","Date and year are the Findings End Date in the dataset posted by the Wage and Hour Division, which does not provide case opening or closing dates. The company name is the Legal Name provided by the dataset unless that field is blank, in which case the Trade Name is used. The dataset provides only one address and does not indicate whether it is the company headquarters address or the establishment address. The penalty amount is the total of civil monetary penalties and mandated back wages. The original dataset provides a breakdown."
"AutoNation","AutoNation","$3,380,000","$0","$3,380,000","2018","20180226","environment-related offenses","environmental violation","","AutoNation's 57 subsidiaries in California agreed to pay a total of $3.38 million in settlement of allegations by eight California District Attorneys that they violated laws concerning the storage and disposal of hazardous waste produced by their automobile dealerships and collision centers.","local","agency action","California Multi-Jurisdiction Case","civil","","","","","settlement","California","","","","","","USA","Florida","publicly traded","AN","retailing","retail-automotive","https://www.alcoda.org/newsroom/2018/feb/autonation_dealership_lawsuit#more",""
"Auto Nation, Inc. and Village Motors, LLC d/b/a Libertyville Toyota","AutoNation","$9,317","$0","$9,317","2018","20180328","employment-related offenses","labor relations violation","","","federal","agency action","National Labor Relations Board","civil","","","13-CA-063676","","","Illinois","Libertyville","","","","","USA","Florida","publicly traded","AN","retailing","retail-automotive","Extracted from a spreadsheet obtained from the NLRB through a Freedom of Information Act request fulfilled on 5/28/2020.",""
"Autonation, Inc. et al.","AutoNation","$205,000","$0","$205,000","2007","20070323","consumer-protection-related offenses","insurance violation","","","state","agency action","California Department of Insurance","civil","","","","","","California","","","","","","USA","Florida","publicly traded","AN","retailing","retail-automotive","https://legaldocs.insurance.ca.gov/publicdocs/SearchBasic",""
"AUTONATION","AutoNation","$8,000","$0","$8,000","2014","20140310","safety-related offenses","workplace safety or health violation","","","federal","agency action","Occupational Safety & Health Administration","civil","","","","","","Colorado","LONE TREE","8101 PARKWAY DRIVE","80124","441110","441110: New Car Dealers","USA","Florida","publicly traded","AN","retailing","retail-automotive","Extracted from a download of OSHA's Enforcment Data downloaded on 3/02/2022, available at https://enforcedata.dol.gov/views/data_catalogs.php",""
"AUTO NATION HYUNDAI MALL OF GEORGIA","AutoNation","$7,956","$0","$7,956","2018","20181012","safety-related offenses","workplace safety or health violation","","","federal","agency action","Occupational Safety & Health Administration","civil","","","","","","Georgia","BUFORD","3445 BUFORD DRIVE","30519","441310","441310: Automotive Parts and Accessories Stores","USA","Florida","publicly traded","AN","retailing","retail-automotive","Extracted from a download of OSHA's Enforcment Data downloaded on 3/02/2022, available at https://enforcedata.dol.gov/views/data_catalogs.php",""
"AUTONATION TOYOTA","AutoNation","$10,000","$0","$10,000","2018","20181030","safety-related offenses","workplace safety or health violation","","","federal","agency action","Occupational Safety & Health Administration","civil","","","","","","Colorado","CENTENNIAL","10531 E ARAPAHOE RD","80112","441110","441110: New Car Dealers","USA","Florida","publicly traded","AN","retailing","retail-automotive","Extracted from a download of OSHA's Enforcment Data downloaded on 3/02/2022, available at https://enforcedata.dol.gov/views/data_catalogs.php",""
"AUTONATION AUTO AUCTION ORLANDO","AutoNation","$9,282","$0","$9,282","2019","20190221","safety-related offenses","workplace safety or health violation","","","federal","agency action","Occupational Safety & Health Administration","civil","","","","","","Florida","LONGWOOD","650 N US HWY 17 92","32750","423110","423110: Automobile and Other Motor Vehicle Merchant Wholesalers","USA","Florida","publicly traded","AN","retailing","retail-automotive","Extracted from a download of OSHA's Enforcment Data downloaded on 3/02/2022, available at https://enforcedata.dol.gov/views/data_catalogs.php",""
