"Company","Parent Company","Penalty Amount","Subtraction From Penalty","Penalty Amount Adjusted For Eliminating Multiple Counting","Penalty Year","Penalty Date","Offense Group","Primary Offense","Secondary Offense","Description","Level of Government","Action Type","Agency","Civil/Criminal","Prosecution Agreement","Court","Case ID","Private Litigation Case Title","Lawsuit Resolution","Facility State","City","Address","Zip","NAICS Code","NAICS Translation","HQ Country of Parent","HQ State of Parent","Ownership Structure","Parent Company Stock Ticker","Major Industry of Parent","Specific Industry of Parent","Info Source","Notes"
"Autoliv Inc.","Autoliv Inc.","$14,500,000","$0","$14,500,000","2012","20120606","competition-related offenses","price-fixing or anti-competitive practices","","Stockholm-based Autoliv Inc. agreed to plead guilty for its role in a conspiracy to fix prices of seatbelts, airbags and steering wheels installed in U.S. cars to one automobile manufacturer and a separate conspiracy to fix prices of seatbelts to another.","federal","agency action","Justice Department Antitrust Division","criminal","","","","","","","","","","","","Sweden","","publicly traded","ALV","automotive parts","automotive parts","https://www.justice.gov/opa/pr/autoliv-inc-and-yazaki-corp-executive-agree-plead-guilty-price-fixing-automobile-parts",""
"Autoliv, ASP","Autoliv Inc.","$5,050","$0","$5,050","2000","20000209","employment-related offenses","labor relations violation","","back pay award in unfair labor practices case","federal","agency action","National Labor Relations Board","civil","","","25-CA-26477-001","","","Indiana","Indianapolis","","46278","336360","336360: Motor Vehicle Seating and Interior Trim Manufacturing","Sweden","","publicly traded","ALV","automotive parts","automotive parts","Extracted from an NLRB dataset covering 1999-2011 downloaded at https://catalog.data.gov/dataset/nlrb-cats-final-c-case-data-bulk-19990101-20110930-in-xml",""
"Autoliv A S P, Inc.","Autoliv Inc.","$70,000","$0","$70,000","2005","20050413","employment-related offenses","employment discrimination","","disability","federal","agency action","Equal Employment Opportunity Commission","civil","","","","","","Utah","Ogden","","","","","Sweden","","publicly traded","ALV","automotive parts","automotive parts","https://web.archive.org/web/20090813022019/http://eeoc.gov/litigation/settlements/settlement04-05.html",""
"AUTOLIV ASP, INC.","Autoliv Inc.","$15,000","$0","$15,000","2015","20150206","safety-related offenses","workplace safety or health violation","","","federal","agency action","Occupational Safety & Health Administration","civil","","","","","","Utah","CORINNE","16700 W HWY 83","84307","336399","336399: All Other Motor Vehicle Parts Manufacturing","Sweden","","publicly traded","ALV","automotive parts","automotive parts","Extracted from a download of OSHA's Enforcment Data downloaded on 3/02/2022, available at https://enforcedata.dol.gov/views/data_catalogs.php",""
"AUTOLIV ASP, INC.-PRO","Autoliv Inc.","$20,850","$0","$20,850","2018","20180326","safety-related offenses","workplace safety or health violation","","","federal","agency action","Occupational Safety & Health Administration","civil","","","","","","Utah","CORINNE","167000 W HWY 83","84307","336399","336399: All Other Motor Vehicle Parts Manufacturing","Sweden","","publicly traded","ALV","automotive parts","automotive parts","Extracted from a download of OSHA's Enforcment Data downloaded on 3/02/2022, available at https://enforcedata.dol.gov/views/data_catalogs.php",""
