"Company","Parent Company","Penalty Amount","Subtraction From Penalty","Penalty Amount Adjusted For Eliminating Multiple Counting","Penalty Year","Penalty Date","Offense Group","Primary Offense","Secondary Offense","Description","Level of Government","Action Type","Agency","Civil/Criminal","Prosecution Agreement","Court","Case ID","Private Litigation Case Title","Lawsuit Resolution","Facility State","City","Address","Zip","NAICS Code","NAICS Translation","HQ Country of Parent","HQ State of Parent","Ownership Structure","Parent Company Stock Ticker","Major Industry of Parent","Specific Industry of Parent","Info Source","Notes"
"BrightView Landscapes","BrightView Landscapes","$4,746,778","$0","$4,746,778","2017","20171206","employment-related offenses","wage and hour violation","","overtime violation","federal","private litigation","","civil","","Middle District of Pennsylvania","13-cv-2529","Amador v. BrightView Landscapes, LLC f/k/a The Brickman Group, LTD, LLC","settlement","","","","","","","USA","Pennsylvania","privately held","","miscellaneous services","landscaping services","",""
"BrightView Landscapes","BrightView Landscapes","$225,000","$0","$225,000","2014","20140513","employment-related offenses","wage and hour violation","","","federal","private litigation","","civil","","Northern District of Illinois","12-cv-2020","Zamora et al v. The Brickman Group, Ltd., Llc","settlement","","","","","","","USA","Pennsylvania","privately held","","miscellaneous services","landscaping services","",""
"BRIGHTVIEW LANDSCAPES, LLC","BrightView Landscapes","$20,000","$0","$20,000","2016","20161020","safety-related offenses","workplace safety or health violation","","","federal","agency action","Occupational Safety & Health Administration","civil","","","","","","Illinois","DOWNERS GROVE","1901 BUTTERFIELD RD","60515","561730","561730: Landscaping Services","USA","Pennsylvania","privately held","","miscellaneous services","landscaping services","Extracted from a download of OSHA's Enforcment Data downloaded on 3/02/2022, available at https://enforcedata.dol.gov/views/data_catalogs.php",""
"BRIGHTVIEW LANDSCAPES, LLC","BrightView Landscapes","$12,676","$0","$12,676","2017","20170809","safety-related offenses","workplace safety or health violation","","","federal","agency action","Occupational Safety & Health Administration","civil","","","","","","Florida","ORLANDO","LAKE UNDERHILL AND MARK TWAIN BLVD","32825","561730","561730: Landscaping Services","USA","Pennsylvania","privately held","","miscellaneous services","landscaping services","Extracted from a download of OSHA's Enforcment Data downloaded on 3/02/2022, available at https://enforcedata.dol.gov/views/data_catalogs.php",""
"BRIGHTVIEW LANDSCAPES SERVICES LLC","BrightView Landscapes","$31,600","$0","$31,600","2019","20190816","safety-related offenses","workplace safety or health violation","","","federal","agency action","Occupational Safety & Health Administration","civil","","","","","","California","NOVATO","IN THE VICINITY OF 82 CAPTIAN NURSE","94947","561730","561730: Landscaping Services","USA","Pennsylvania","privately held","","miscellaneous services","landscaping services","Extracted from a download of OSHA's Enforcment Data downloaded on 3/02/2022, available at https://enforcedata.dol.gov/views/data_catalogs.php",""
