"Company","Parent Company","Penalty Amount","Subtraction From Penalty","Penalty Amount Adjusted For Eliminating Multiple Counting","Penalty Year","Penalty Date","Offense Group","Primary Offense","Secondary Offense","Description","Level of Government","Action Type","Agency","Civil/Criminal","Prosecution Agreement","Court","Case ID","Private Litigation Case Title","Lawsuit Resolution","Facility State","City","Address","Zip","NAICS Code","NAICS Translation","HQ Country of Parent","HQ State of Parent","Ownership Structure","Parent Company Stock Ticker","Major Industry of Parent","Specific Industry of Parent","Info Source","Notes"
"Harrah's Chester Casino & Racetrack","Caesars Holdings","$63,000","$0","$63,000","2011","20110126","environment-related offenses","environmental violation","","The U.S. Environmental Protection Agency today announced it has settled a Clean Water Act case with Harrahs Chester Casino & Racetrack (Harrah's) for unpermitted discharges to the Delaware River. Under the settlement, Harrah's has agreed to pay a $39,000 penalty and to take measures, costing an estimated $24,000, to reduce water pollution from the facility.","federal","agency action","Environmental Protection Agency","civil","","","","","","Pennsylvania","Chester","","","","","USA","Nevada","publicly traded","CZR","entertainment","casinos","https://archive.epa.gov/epapages/newsroom_archive/newsreleases/f3af54a5565c6b288525782400606db0.html",""
"Bally's Park Place d/b/a Bally's Atlantic City","Caesars Holdings","$5,000","$0","$5,000","2008","20080701","employment-related offenses","labor relations violation","","back pay award in unfair labor practices case","federal","agency action","National Labor Relations Board","civil","","","04-CA-35516-001","","","New Jersey","Atlantic City","","08401","713290","713290: Other Gambling Industries","USA","Nevada","publicly traded","CZR","entertainment","casinos","Extracted from an NLRB dataset covering 1999-2011 downloaded at https://catalog.data.gov/dataset/nlrb-cats-final-c-case-data-bulk-19990101-20110930-in-xml","Caesars Entertainment leases the casino from Vici Properties"
"Caesar's Atlantic City","Caesars Holdings","$5,000","$0","$5,000","2003","20030506","employment-related offenses","labor relations violation","","back pay award in unfair labor practices case","federal","agency action","National Labor Relations Board","civil","","","04-CA-31788-001","","","New Jersey","Atlantic City","","08401","713210","713210: Casinos (except Casino Hotels)","USA","Nevada","publicly traded","CZR","entertainment","casinos","Extracted from an NLRB dataset covering 1999-2011 downloaded at https://catalog.data.gov/dataset/nlrb-cats-final-c-case-data-bulk-19990101-20110930-in-xml",""
"Caesar's Casino Hotel","Caesars Holdings","$800,000","$0","$800,000","2004","20040628","employment-related offenses","labor relations violation","","back pay award in unfair labor practices case","federal","agency action","National Labor Relations Board","civil","","","04-CA-30635-001","","","New Jersey","Atlantic City","","08401","721120","721120: Casino Hotels","USA","Nevada","publicly traded","CZR","entertainment","casinos","Extracted from an NLRB dataset covering 1999-2011 downloaded at https://catalog.data.gov/dataset/nlrb-cats-final-c-case-data-bulk-19990101-20110930-in-xml",""
"Caesar's Entertainment, Inc.","Caesars Holdings","$11,335","$0","$11,335","2012","20120402","employment-related offenses","Family and Medical Leave Act","","","federal","agency action","Labor Department Wage and Hour Division","civil","","","1643625","","","Mississippi","Robinsonville","","38664","713290","713290: Other Gambling Industries","USA","Nevada","publicly traded","CZR","entertainment","casinos","March 7, 2017 download of a dataset posted by the Wage and Hour Division at https://enforcedata.dol.gov/views/data_summary.php","Date and year are the Findings End Date in the dataset posted by the Wage and Hour Division, which does not provide case opening or closing dates. The company name is the Legal Name provided by the dataset unless that field is blank, in which case the Trade Name is used. The dataset provides only one address and does not indicate whether it is the company headquarters address or the establishment address. The penalty amount is the total of civil monetary penalties and mandated back wages. The original dataset provides a breakdown."
"Caesar's Entertainment/Park Place Bally's","Caesars Holdings","$54,000","$0","$54,000","2004","20040818","employment-related offenses","labor relations violation","","back pay award in unfair labor practices case","federal","agency action","National Labor Relations Board","civil","","","04-CA-32794-001","","","New Jersey","Atlantic City","","08401","713290","713290: Other Gambling Industries","USA","Nevada","publicly traded","CZR","entertainment","casinos","Extracted from an NLRB dataset covering 1999-2011 downloaded at https://catalog.data.gov/dataset/nlrb-cats-final-c-case-data-bulk-19990101-20110930-in-xml",""
"Caesars Palace","Caesars Holdings","$850,000","$0","$850,000","2007","20070820","employment-related offenses","employment discrimination","","sexual harassment","federal","agency action","Equal Employment Opportunity Commission","civil","","","","","","Nevada","","","","","","USA","Nevada","publicly traded","CZR","entertainment","casinos","https://www.eeoc.gov/eeoc/newsroom/release/archive/8-20-07.html","Description field shows type of discrimination that EEOC had alleged."
"Caesars Riverboat Casino, LLC","Caesars Holdings","$5,655","$0","$5,655","2009","20090926","employment-related offenses","wage and hour violation","Fair Labor Standards Act","","federal","agency action","Labor Department Wage and Hour Division","civil","","","1501695","","","Indiana","Elizabeth","","47117","721120","721120: Casino Hotels","USA","Nevada","publicly traded","CZR","entertainment","casinos","March 7, 2017 download of a dataset posted by the Wage and Hour Division at https://enforcedata.dol.gov/views/data_summary.php","Date and year are the Findings End Date in the dataset posted by the Wage and Hour Division, which does not provide case opening or closing dates. The company name is the Legal Name provided by the dataset unless that field is blank, in which case the Trade Name is used. The dataset provides only one address and does not indicate whether it is the company headquarters address or the establishment address. The penalty amount is the total of civil monetary penalties and mandated back wages. The original dataset provides a breakdown."
"Desert Palace, Inc. d/b/a Caesars Palace","Caesars Holdings","$8,000,000","$0","$8,000,000","2015","20150908","financial offenses","anti-money-laundering deficiencies","","The Financial Crimes Enforcement Network announced a settlement with Desert Palace, Inc. d/b/a Caesars Palace whereby Caesars agreed to pay an $8 million civil money penalty for willful and repeated violations of the Bank Secrecy Act.","federal","agency action","Treasury Department Financial Crimes Enforcement Network","civil","","","","","","","","","","","","USA","Nevada","publicly traded","CZR","entertainment","casinos","https://www.fincen.gov/news_room/nr/html/20150908.html","Caesars Entertainment leases the casino from Vici Properties"
"Desert Palace, Inc. d/b/a Caesar's Palace","Caesars Holdings","$100,000","$0","$100,000","2005","20051215","employment-related offenses","labor relations violation","","back pay award in unfair labor practices case","federal","agency action","National Labor Relations Board","civil","","","28-CA-20052-001","","","Nevada","Las Vegas","","89109","721120","721120: Casino Hotels","USA","Nevada","publicly traded","CZR","entertainment","casinos","Extracted from an NLRB dataset covering 1999-2011 downloaded at https://catalog.data.gov/dataset/nlrb-cats-final-c-case-data-bulk-19990101-20110930-in-xml","Caesars Entertainment leases the casino from Vici Properties"
"Desert Palace, Inc. dba Caesars Palace","Caesars Holdings","$5,500","$0","$5,500","2009","20091124","employment-related offenses","labor relations violation","","back pay award in unfair labor practices case","federal","agency action","National Labor Relations Board","civil","","","28-CA-22583-001","","","Nevada","Las Vegas","","89109","721120","721120: Casino Hotels","USA","Nevada","publicly traded","CZR","entertainment","casinos","Extracted from an NLRB dataset covering 1999-2011 downloaded at https://catalog.data.gov/dataset/nlrb-cats-final-c-case-data-bulk-19990101-20110930-in-xml","Caesars Entertainment leases the casino from Vici Properties"
"FLAMINGO HILTON","Caesars Holdings","$16,000","$0","$16,000","2000","20000628","employment-related offenses","labor relations violation","","back pay award in unfair labor practices case","federal","agency action","National Labor Relations Board","civil","","","28-CA-16224-001","","","Nevada","Las Vegas","","89142","721120","721120: Casino Hotels","USA","Nevada","publicly traded","CZR","entertainment","casinos","Extracted from an NLRB dataset covering 1999-2011 downloaded at https://catalog.data.gov/dataset/nlrb-cats-final-c-case-data-bulk-19990101-20110930-in-xml",""
"Flamingo Hilton Casino","Caesars Holdings","$9,000","$0","$9,000","2000","20000616","employment-related offenses","labor relations violation","","back pay award in unfair labor practices case","federal","agency action","National Labor Relations Board","civil","","","17-CA-20381-001","","","Missouri","Kansas City","","64120","713210","713210: Casinos (except Casino Hotels)","USA","Nevada","publicly traded","CZR","entertainment","casinos","Extracted from an NLRB dataset covering 1999-2011 downloaded at https://catalog.data.gov/dataset/nlrb-cats-final-c-case-data-bulk-19990101-20110930-in-xml",""
"Flamingo Hilton  Hotel and Casino","Caesars Holdings","$13,709","$0","$13,709","2001","20011026","employment-related offenses","labor relations violation","","back pay award in unfair labor practices case","federal","agency action","National Labor Relations Board","civil","","","28-CA-15154-001","","","Nevada","Las Vegas","","89109","721110","721110: Hotels (except Casino Hotels) and Motels","USA","Nevada","publicly traded","CZR","entertainment","casinos","Extracted from an NLRB dataset covering 1999-2011 downloaded at https://catalog.data.gov/dataset/nlrb-cats-final-c-case-data-bulk-19990101-20110930-in-xml",""
"Flamingo Hotel & Casino","Caesars Holdings","$10,000","$0","$10,000","2003","20030822","employment-related offenses","labor relations violation","","back pay award in unfair labor practices case","federal","agency action","National Labor Relations Board","civil","","","28-CA-17219-001","","","Nevada","Las Vegas","","89109","721120","721120: Casino Hotels","USA","Nevada","publicly traded","CZR","entertainment","casinos","Extracted from an NLRB dataset covering 1999-2011 downloaded at https://catalog.data.gov/dataset/nlrb-cats-final-c-case-data-bulk-19990101-20110930-in-xml",""
"Flamingo Las Vegas","Caesars Holdings","$275,000","$0","$275,000","2007","20071231","employment-related offenses","labor relations violation","","back pay award in unfair labor practices case","federal","agency action","National Labor Relations Board","civil","","","28-CA-21555-001","","","Nevada","Las Vegas","","89109","721120","721120: Casino Hotels","USA","Nevada","publicly traded","CZR","entertainment","casinos","Extracted from an NLRB dataset covering 1999-2011 downloaded at https://catalog.data.gov/dataset/nlrb-cats-final-c-case-data-bulk-19990101-20110930-in-xml",""
"Flamingo Las Vegas Operating Company, LLC","Caesars Holdings","$29,312","$0","$29,312","2014","20141124","employment-related offenses","Family and Medical Leave Act","","","federal","agency action","Labor Department Wage and Hour Division","civil","","","1732200","","","Nevada","Las Vegas","","89109","721120","721120: Casino Hotels","USA","Nevada","publicly traded","CZR","entertainment","casinos","March 7, 2017 download of a dataset posted by the Wage and Hour Division at https://enforcedata.dol.gov/views/data_summary.php","Date and year are the Findings End Date in the dataset posted by the Wage and Hour Division, which does not provide case opening or closing dates. The company name is the Legal Name provided by the dataset unless that field is blank, in which case the Trade Name is used. The dataset provides only one address and does not indicate whether it is the company headquarters address or the establishment address. The penalty amount is the total of civil monetary penalties and mandated back wages. The original dataset provides a breakdown."
"Grand Casinos, Inc.","Caesars Holdings","$60,000","$0","$60,000","2005","20050526","consumer-protection-related offenses","aviation consumer protection violation","","","federal","agency action","Transportation Department Aviation Consumer Protection Division","civil","","","","","","","","","","","","USA","Nevada","publicly traded","CZR","entertainment","casinos","https://www.transportation.gov/sites/dot.gov/files/docs/2005-5-15.pdf",""
"Harrah's Casino","Caesars Holdings","$15,000","$0","$15,000","2006","20060609","employment-related offenses","labor relations violation","","back pay award in unfair labor practices case","federal","agency action","National Labor Relations Board","civil","","","04-CA-34246-001","","","New Jersey","Atlantic City","","08401","713290","713290: Other Gambling Industries","USA","Nevada","publicly traded","CZR","entertainment","casinos","Extracted from an NLRB dataset covering 1999-2011 downloaded at https://catalog.data.gov/dataset/nlrb-cats-final-c-case-data-bulk-19990101-20110930-in-xml",""
"Harrah's Casino","Caesars Holdings","$7,500","$0","$7,500","2009","20090817","employment-related offenses","labor relations violation","","back pay award in unfair labor practices case","federal","agency action","National Labor Relations Board","civil","","","26-CA-23420-001","","","Mississippi","Tunica","","38664","713210","713210: Casinos (except Casino Hotels)","USA","Nevada","publicly traded","CZR","entertainment","casinos","Extracted from an NLRB dataset covering 1999-2011 downloaded at https://catalog.data.gov/dataset/nlrb-cats-final-c-case-data-bulk-19990101-20110930-in-xml",""
"HARRAHS","Caesars Holdings","$5,400","$0","$5,400","2008","20081219","safety-related offenses","motor vehicle safety violation","","LA-2009-0006-US0764","federal","agency action","Federal Motor Carrier Safety Administration","civil","","","","","","Louisiana","BOSSIER CITY","","","","","USA","Nevada","publicly traded","CZR","entertainment","casinos","https://www.fmcsa.dot.gov/sites/fmcsa.dot.gov/files/docs/closedByEnforcement_FY2009_04-26-2013.pdf",""
"Harrah's","Caesars Holdings","$22,500","$0","$22,500","2001","20010716","employment-related offenses","labor relations violation","","back pay award in unfair labor practices case","federal","agency action","National Labor Relations Board","civil","","","28-CA-16407-001","","","Nevada","Laughlin","","89029","721120","721120: Casino Hotels","USA","Nevada","publicly traded","CZR","entertainment","casinos","Extracted from an NLRB dataset covering 1999-2011 downloaded at https://catalog.data.gov/dataset/nlrb-cats-final-c-case-data-bulk-19990101-20110930-in-xml",""
"HARRAH'S ENTERTAINMENT INC","Caesars Holdings","$6,960","$0","$6,960","2008","20081124","safety-related offenses","motor vehicle safety violation","","NV-2008-0066-US1207","federal","agency action","Federal Motor Carrier Safety Administration","civil","","","","","","Nevada","STATELINE","","","","","USA","Nevada","publicly traded","CZR","entertainment","casinos","https://www.fmcsa.dot.gov/sites/fmcsa.dot.gov/files/docs/closedByEnforcement_FY2009_04-26-2013.pdf",""
"Harrah's Entertainment Corp. d/b/a Caesar's Palace","Caesars Holdings","$11,000","$0","$11,000","2010","20100614","employment-related offenses","labor relations violation","","back pay award in unfair labor practices case","federal","agency action","National Labor Relations Board","civil","","","28-CA-21981-001","","","Nevada","Las Vegas","","89109","721120","721120: Casino Hotels","USA","Nevada","publicly traded","CZR","entertainment","casinos","Extracted from an NLRB dataset covering 1999-2011 downloaded at https://catalog.data.gov/dataset/nlrb-cats-final-c-case-data-bulk-19990101-20110930-in-xml",""
"Harrahs Hotel and Casino","Caesars Holdings","$10,000","$0","$10,000","2005","20051021","employment-related offenses","labor relations violation","","back pay award in unfair labor practices case","federal","agency action","National Labor Relations Board","civil","","","28-CA-18997-001","","","Nevada","Las Vegas","","89109","721120","721120: Casino Hotels","USA","Nevada","publicly traded","CZR","entertainment","casinos","Extracted from an NLRB dataset covering 1999-2011 downloaded at https://catalog.data.gov/dataset/nlrb-cats-final-c-case-data-bulk-19990101-20110930-in-xml",""
"Harrah's Kansas Casino Corporation d/b/a Harrah's Prairie Band Casino","Caesars Holdings","$10,456","$0","$10,456","2002","20021015","employment-related offenses","labor relations violation","","back pay award in unfair labor practices case","federal","agency action","National Labor Relations Board","civil","","","17-CA-21580-001","","","Kansas","Mayetta","","66509","713210","713210: Casinos (except Casino Hotels)","USA","Nevada","publicly traded","CZR","entertainment","casinos","Extracted from an NLRB dataset covering 1999-2011 downloaded at https://catalog.data.gov/dataset/nlrb-cats-final-c-case-data-bulk-19990101-20110930-in-xml",""
"Harrahs' Las Vegas","Caesars Holdings","$16,500","$0","$16,500","2001","20010430","employment-related offenses","labor relations violation","","back pay award in unfair labor practices case","federal","agency action","National Labor Relations Board","civil","","","28-CA-16819-001","","","Nevada","Las Vegas","","89109","721120","721120: Casino Hotels","USA","Nevada","publicly traded","CZR","entertainment","casinos","Extracted from an NLRB dataset covering 1999-2011 downloaded at https://catalog.data.gov/dataset/nlrb-cats-final-c-case-data-bulk-19990101-20110930-in-xml","Caesars Entertainment leases the casino from Vici Properties"
"Harrahs Las Vegas LLC","Caesars Holdings","$24,478","$0","$24,478","2012","20120614","employment-related offenses","wage and hour violation","Fair Labor Standards Act","","federal","agency action","Labor Department Wage and Hour Division","civil","","","1649651","","","Nevada","Las Vegas","","89109","722410","722410: Drinking Places (Alcoholic Beverages)","USA","Nevada","publicly traded","CZR","entertainment","casinos","March 7, 2017 download of a dataset posted by the Wage and Hour Division at https://enforcedata.dol.gov/views/data_summary.php","Caesars Entertainment leases the casino from Vici Properties"
"Harrah's Las Vegas, Inc.","Caesars Holdings","$22,442","$0","$22,442","2005","20050126","employment-related offenses","labor relations violation","","back pay award in unfair labor practices case","federal","agency action","National Labor Relations Board","civil","","","28-CA-18385-001","","","Nevada","Las Vegas","","89109","721120","721120: Casino Hotels","USA","Nevada","publicly traded","CZR","entertainment","casinos","Extracted from an NLRB dataset covering 1999-2011 downloaded at https://catalog.data.gov/dataset/nlrb-cats-final-c-case-data-bulk-19990101-20110930-in-xml","Caesars Entertainment leases the casino from Vici Properties"
"Harrah's North Kansas City Casino","Caesars Holdings","$80,000","$0","$80,000","2003","20031103","employment-related offenses","labor relations violation","","back pay award in unfair labor practices case","federal","agency action","National Labor Relations Board","civil","","","17-CA-22238-001","","","Missouri","North Kansas City","","64116","713210","713210: Casinos (except Casino Hotels)","USA","Nevada","publicly traded","CZR","entertainment","casinos","Extracted from an NLRB dataset covering 1999-2011 downloaded at https://catalog.data.gov/dataset/nlrb-cats-final-c-case-data-bulk-19990101-20110930-in-xml","Caesars Entertainment leases the casino from Vici Properties"
"Harrah's Showboat Mardi Gras Casino","Caesars Holdings","$7,263","$0","$7,263","2005","20050914","employment-related offenses","labor relations violation","","back pay award in unfair labor practices case","federal","agency action","National Labor Relations Board","civil","","","13-CA-42180-001","","","Illinois","East Chicago","","46312","713210","713210: Casinos (except Casino Hotels)","USA","Nevada","publicly traded","CZR","entertainment","casinos","Extracted from an NLRB dataset covering 1999-2011 downloaded at https://catalog.data.gov/dataset/nlrb-cats-final-c-case-data-bulk-19990101-20110930-in-xml",""
"Harrah's Southern IN Riverboat Partnership LP","Caesars Holdings","$25,661","$0","$25,661","2006","20061102","employment-related offenses","Family and Medical Leave Act","","","federal","agency action","Labor Department Wage and Hour Division","civil","","","1452414","","","Indiana","Elizabeth","","47117","721120","721120: Casino Hotels","USA","Nevada","publicly traded","CZR","entertainment","casinos","March 7, 2017 download of a dataset posted by the Wage and Hour Division at https://enforcedata.dol.gov/views/data_summary.php","Date and year are the Findings End Date in the dataset posted by the Wage and Hour Division, which does not provide case opening or closing dates. The company name is the Legal Name provided by the dataset unless that field is blank, in which case the Trade Name is used. The dataset provides only one address and does not indicate whether it is the company headquarters address or the establishment address. The penalty amount is the total of civil monetary penalties and mandated back wages. The original dataset provides a breakdown."
"Isle of Capri Casinos, Inc.","Caesars Holdings","$36,040","$0","$36,040","2007","20070812","employment-related offenses","wage and hour violation","Fair Labor Standards Act","","federal","agency action","Labor Department Wage and Hour Division","civil","","","1470488","","","Missouri","Saint Louis","","63141","713210","713210: Casinos (except Casino Hotels)","USA","Nevada","publicly traded","CZR","entertainment","casinos","March 7, 2017 download of a dataset posted by the Wage and Hour Division at https://enforcedata.dol.gov/views/data_summary.php","Date and year are the Findings End Date in the dataset posted by the Wage and Hour Division, which does not provide case opening or closing dates. The company name is the Legal Name provided by the dataset unless that field is blank, in which case the Trade Name is used. The dataset provides only one address and does not indicate whether it is the company headquarters address or the establishment address. The penalty amount is the total of civil monetary penalties and mandated back wages. The original dataset provides a breakdown."
"HARVEY'S TAHOE MANAGEMENT COMPANY, INC.","Caesars Holdings","$6,885","$0","$6,885","2008","20081002","safety-related offenses","workplace safety or health violation","","","federal","agency action","Occupational Safety & Health Administration","civil","","","","","","Nevada","STATELINE","15 HIGHWAY 50 EAST","89449","721120","721120: Casino Hotels","USA","Nevada","publicly traded","CZR","entertainment","casinos","Extracted from a download of OSHA's Enforcment Data downloaded on 3/02/2022, available at https://enforcedata.dol.gov/views/data_catalogs.php",""
"HARRAH'S LAKE TAHOE","Caesars Holdings","$5,100","$0","$5,100","2008","20081002","safety-related offenses","workplace safety or health violation","","","federal","agency action","Occupational Safety & Health Administration","civil","","","","","","Nevada","STATELINE","15 HIGHWAY 50","89449","721120","721120: Casino Hotels","USA","Nevada","publicly traded","CZR","entertainment","casinos","Extracted from a download of OSHA's Enforcment Data downloaded on 3/02/2022, available at https://enforcedata.dol.gov/views/data_catalogs.php","Caesars Entertainment leases the casino from Vici Properties"
"CAESARS PALACE","Caesars Holdings","$17,550","$0","$17,550","2007","20070226","safety-related offenses","workplace safety or health violation","","","federal","agency action","Occupational Safety & Health Administration","civil","","","","","","Nevada","LAS VEGAS","3570 LAS VEGAS BLVD., SOUTH","89109","721120","721120: Casino Hotels","USA","Nevada","publicly traded","CZR","entertainment","casinos","Extracted from a download of OSHA's Enforcment Data downloaded on 3/02/2022, available at https://enforcedata.dol.gov/views/data_catalogs.php",""
"CAESARS PALACE","Caesars Holdings","$15,900","$0","$15,900","2007","20070226","safety-related offenses","workplace safety or health violation","","","federal","agency action","Occupational Safety & Health Administration","civil","","","","","","Nevada","LAS VEGAS","3570 LAS VEGAS BLVD., SOUTH","89109","721120","721120: Casino Hotels","USA","Nevada","publicly traded","CZR","entertainment","casinos","Extracted from a download of OSHA's Enforcment Data downloaded on 3/02/2022, available at https://enforcedata.dol.gov/views/data_catalogs.php",""
"HARRAH'S LAUNDRY","Caesars Holdings","$8,010","$0","$8,010","2006","20060907","safety-related offenses","workplace safety or health violation","","","federal","agency action","Occupational Safety & Health Administration","civil","","","","","","Nevada","NORTH LAS VEGAS","100 WEST CAREY AVENUE","89030","812332","812332: Industrial Launderers","USA","Nevada","publicly traded","CZR","entertainment","casinos","Extracted from a download of OSHA's Enforcment Data downloaded on 3/02/2022, available at https://enforcedata.dol.gov/views/data_catalogs.php",""
