"Company","Parent Company","Penalty Amount","Subtraction From Penalty","Penalty Amount Adjusted For Eliminating Multiple Counting","Penalty Year","Penalty Date","Offense Group","Primary Offense","Secondary Offense","Description","Level of Government","Action Type","Agency","Civil/Criminal","Prosecution Agreement","Court","Case ID","Private Litigation Case Title","Lawsuit Resolution","Facility State","City","Address","Zip","NAICS Code","NAICS Translation","HQ Country of Parent","HQ State of Parent","Ownership Structure","Parent Company Stock Ticker","Major Industry of Parent","Specific Industry of Parent","Info Source","Notes"
"Cedars Sinai Medical Center","Cedars-Sinai Health System","$1,485,846","$0","$1,485,846","2013","20130702","government-contracting-related offenses","False Claims Act and related","","Fifty-five hospitals in 21 states agreed to pay the United States a total of more than $34 million to settle allegations that they submitted false claims to Medicare for kyphoplasty, a minimally-invasive procedure used to treat certain spinal fractures that often are due to osteoporosis. ","federal","agency action","Justice Department Civil Division","civil","","","","","","California","Los Angeles","","","","","USA","California","non-profit","","healthcare services","hospitals","https://www.justice.gov/opa/pr/fifty-five-hospitals-pay-us-more-34-million-resolve-false-claims-act-allegations-related",""
"CEDARS-SINAI MEDICAL CENTER","Cedars-Sinai Health System","$18,710","$0","$18,710","2006","20061006","safety-related offenses","workplace safety or health violation","","","federal","agency action","Occupational Safety & Health Administration","civil","","","","","","California","LOS ANGELES","8700 BEVERLY BLVD.","90048","622110","622110: General Medical and Surgical Hospitals","USA","California","non-profit","","healthcare services","hospitals","Extracted from a download of OSHA's Enforcment Data downloaded on 3/02/2022, available at https://enforcedata.dol.gov/views/data_catalogs.php",""
"Cedars-Sinai Medical Center","Cedars-Sinai Health System","$41,000","$0","$41,000","2017","20171220","environment-related offenses","environmental violation","","air pollution","local","agency action","South Coast (CA) Air Quality Management District ","civil","","","","","","California","","","","","","USA","California","non-profit","","healthcare services","hospitals","http://www.aqmd.gov/docs/default-source/Agendas/Governing-Board/2018/2018-feb2-016.pdf?sfvrsn=8",""
"Cedarssinai Medical Center","Cedars-Sinai Health System","$25,000","$0","$25,000","2015","20150625","environment-related offenses","environmental violation","","air pollution","local","agency action","South Coast (CA) Air Quality Management District ","civil","","","","","","California","","","","","","USA","California","non-profit","","healthcare services","hospitals","http://www.aqmd.gov/docs/default-source/Agendas/Governing-Board/2015/2015-sep4-019.pdf?sfvrsn=2",""
"CEDARS-SINAI MEDICAL CENTER","Cedars-Sinai Health System","$97,700","$0","$97,700","2020","20200708","safety-related offenses","workplace safety or health violation","","","federal","agency action","Occupational Safety & Health Administration","civil","","","","","","California","LOS ANGELES","8700 BEVERLY BLVD.","90048","622110","622110: General Medical and Surgical Hospitals","USA","California","non-profit","","healthcare services","hospitals","Extracted from a download of OSHA's Enforcment Data downloaded on 3/02/2022, available at https://enforcedata.dol.gov/views/data_catalogs.php",""
