"Company","Parent Company","Penalty Amount","Subtraction From Penalty","Penalty Amount Adjusted For Eliminating Multiple Counting","Penalty Year","Penalty Date","Offense Group","Primary Offense","Secondary Offense","Description","Level of Government","Action Type","Agency","Civil/Criminal","Prosecution Agreement","Court","Case ID","Private Litigation Case Title","Lawsuit Resolution","Facility State","City","Address","Zip","NAICS Code","NAICS Translation","HQ Country of Parent","HQ State of Parent","Ownership Structure","Parent Company Stock Ticker","Major Industry of Parent","Specific Industry of Parent","Info Source","Notes"
"Cleveland Clinic Foundation","Cleveland Clinic","$1,600,000","$0","$1,600,000","2016","20160217","government-contracting-related offenses","False Claims Act and related","","The Department of Justice announced that it  reached settlements with 51 hospitals in 15 states for more than $23 million related to cardiac devices that were implanted in Medicare patients in violation of Medicare coverage requirements.","federal","agency action","Justice Department Civil Division","civil","","","","","","","","","","","","USA","Ohio","non-profit","","healthcare services","healthcare services","https://www.justice.gov/opa/pr/fifty-one-hospitals-pay-united-states-more-23-million-resolve-false-claims-act-allegations",""
"Cleveland Clinic Health Foundation, Inc.","Cleveland Clinic","$21,905","$0","$21,905","2007","20070324","employment-related offenses","wage and hour violation","Fair Labor Standards Act","","federal","agency action","Labor Department Wage and Hour Division","civil","","","1473818","","","Ohio","Cleveland","","44195","622110","622110: General Medical and Surgical Hospitals","USA","Ohio","non-profit","","healthcare services","healthcare services","March 7, 2017 download of a dataset posted by the Wage and Hour Division at https://enforcedata.dol.gov/views/data_summary.php","Date and year are the Findings End Date in the dataset posted by the Wage and Hour Division, which does not provide case opening or closing dates. The company name is the Legal Name provided by the dataset unless that field is blank, in which case the Trade Name is used. The dataset provides only one address and does not indicate whether it is the company headquarters address or the establishment address. The penalty amount is the total of civil monetary penalties and mandated back wages. The original dataset provides a breakdown."
"Martin Memorial Medical Center","Cleveland Clinic","$2,000,000","$0","$2,000,000","2015","20151218","government-contracting-related offenses","False Claims Act and related","","","federal","agency action","U.S. Attorney-Western District of New York","civil","","","","","","Florida","Stuart","","","","","USA","Ohio","non-profit","","healthcare services","healthcare services","https://www.justice.gov/usao-wdny/pr/32-hospitals-pay-us-more-28-million-resolve-false-claims-act-allegations-related",""
"The Cleveland Clinic","Cleveland Clinic","$1,740,000","$0","$1,740,000","2015","20151218","government-contracting-related offenses","False Claims Act and related","","","federal","agency action","U.S. Attorney-Western District of New York","civil","","","","","","Ohio","Cleveland","","","","","USA","Ohio","non-profit","","healthcare services","healthcare services","https://www.justice.gov/usao-wdny/pr/32-hospitals-pay-us-more-28-million-resolve-false-claims-act-allegations-related",""
"Cleveland Clinic Foundation","Cleveland Clinic","$30,000","$0","$30,000","2002","20020311","environment-related offenses","environmental violation","","","state","agency action","Ohio Environmental Protection Agency","civil","","","","","","Ohio","Cleveland","","","","","USA","Ohio","non-profit","","healthcare services","healthcare services","http://edocpub.epa.ohio.gov/publicportal/ViewDocument.aspx?docid=395400","Penalty listed includes a $30,000 Supplemental Environmental Project."
