"Company","Parent Company","Penalty Amount","Subtraction From Penalty","Penalty Amount Adjusted For Eliminating Multiple Counting","Penalty Year","Penalty Date","Offense Group","Primary Offense","Secondary Offense","Description","Level of Government","Action Type","Agency","Civil/Criminal","Prosecution Agreement","Court","Case ID","Private Litigation Case Title","Lawsuit Resolution","Facility State","City","Address","Zip","NAICS Code","NAICS Translation","HQ Country of Parent","HQ State of Parent","Ownership Structure","Parent Company Stock Ticker","Major Industry of Parent","Specific Industry of Parent","Info Source","Notes"
"The Cooper Health System d/b/a Cooper University Health Care and Cooper University Hospital","Cooper Health","$1,200,000","$0","$1,200,000","2015","20151030","government-contracting-related offenses","False Claims Act and related","","The Department of Justice reached 70 settlements involving 457 hospitals in 43 states for more than $250 million related to cardiac devices that were implanted in Medicare patients in violation of Medicare coverage requirements.","federal","agency action","Justice Department Civil Division","civil","","","","","","New Jersey","Camden","","","","","USA","New Jersey","non-profit","","healthcare services","hospitals","https://www.justice.gov/opa/pr/nearly-500-hospitals-pay-united-states-more-250-million-resolve-false-claims-act-allegations",""
"Cooper University Hospital","Cooper Health","$3,850,000","$0","$3,850,000","2008","20080924","government-contracting-related offenses","False Claims Act and related","","Cooper University Hospital in Camden, N.J., agreed to pay the United States $3.85 million plus interest to settle allegations that it defrauded Medicare.","federal","agency action","Justice Department Civil Division","civil","","","","","","New Jersey","Camden","","","","","USA","New Jersey","non-profit","","healthcare services","hospitals","https://www.justice.gov/archive/opa/pr/2008/September/08-civ-850.html",""
"The Cooper Health System","Cooper Health","$12,500,000","$0","$12,500,000","2013","20130124","government-contracting-related offenses","False Claims Act and related","","","federal","agency action","U.S. Attorney-District of New Jersey","civil","","","","","","New Jersey","","","","","","USA","New Jersey","non-profit","","healthcare services","hospitals","https://www.justice.gov/usao-nj/pr/major-new-jersey-hospital-pays-125-million-resolve-kickback-allegations",""
"COOPER UNIVERSITY HOSPITAL","Cooper Health","$9,000","$0","$9,000","2016","20160812","environment-related offenses","environmental violation","","air quality violation","state","agency action","New Jersey Department of Environmental Protection","civil","","","50078-NEA160001","","","New Jersey","","","","","","USA","New Jersey","non-profit","","healthcare services","hospitals","Contained in data received from the agency on October 26, 2020 in response to an open records request. The data was a spreadsheet version of information contained in the records in the DEP DataMiner at https://www13.state.nj.us/DataMiner",""
"COOPER UNIVERSITY HOSPITAL","Cooper Health","$40,000","$0","$40,000","2015","20151022","safety-related offenses","workplace safety or health violation","","","federal","agency action","Occupational Safety & Health Administration","civil","","","","","","New Jersey","CAMDEN","ONE COOPER PLAZA","08103","622110","622110: General Medical and Surgical Hospitals","USA","New Jersey","non-profit","","healthcare services","hospitals","Extracted from a download of OSHA's Enforcment Data downloaded on 3/02/2022, available at https://enforcedata.dol.gov/views/data_catalogs.php",""
