"Company","Parent Company","Penalty Amount","Subtraction From Penalty","Penalty Amount Adjusted For Eliminating Multiple Counting","Penalty Year","Penalty Date","Offense Group","Primary Offense","Secondary Offense","Description","Level of Government","Action Type","Agency","Civil/Criminal","Prosecution Agreement","Court","Case ID","Private Litigation Case Title","Lawsuit Resolution","Facility State","City","Address","Zip","NAICS Code","NAICS Translation","HQ Country of Parent","HQ State of Parent","Ownership Structure","Parent Company Stock Ticker","Major Industry of Parent","Specific Industry of Parent","Info Source","Notes"
"Guardian Elder Care","Guardian Elder Care","$65,825","$0","$65,825","2010","20100619","employment-related offenses","wage and hour violation","Fair Labor Standards Act","","federal","agency action","Labor Department Wage and Hour Division","civil","","","1580061","","","Pennsylvania","Millmont","","17845","623110","623110: Nursing Care Facilities","USA","Pennsylvania","privately held","","healthcare services","nursing homes","March 7, 2017 download of a dataset posted by the Wage and Hour Division at https://enforcedata.dol.gov/views/data_summary.php","Date and year are the Findings End Date in the dataset posted by the Wage and Hour Division, which does not provide case opening or closing dates. The company name is the Legal Name provided by the dataset unless that field is blank, in which case the Trade Name is used. The dataset provides only one address and does not indicate whether it is the company headquarters address or the establishment address. The penalty amount is the total of civil monetary penalties and mandated back wages. The original dataset provides a breakdown."
"Guardian Elder Care LLC","Guardian Elder Care","$115,014","$0","$115,014","2014","20140613","employment-related offenses","wage and hour violation","child labor or youth employment violation","child labor penalties included","federal","agency action","Labor Department Wage and Hour Division","civil","","","1731568","","","Pennsylvania","Mountain Top","","18707","623110","623110: Nursing Care Facilities","USA","Pennsylvania","privately held","","healthcare services","nursing homes","March 7, 2017 download of a dataset posted by the Wage and Hour Division at https://enforcedata.dol.gov/views/data_summary.php","Date and year are the Findings End Date in the dataset posted by the Wage and Hour Division, which does not provide case opening or closing dates. The company name is the Legal Name provided by the dataset unless that field is blank, in which case the Trade Name is used. The dataset provides only one address and does not indicate whether it is the company headquarters address or the establishment address. The penalty amount is the total of civil monetary penalties and mandated back wages. The original dataset provides a breakdown."
"Guardian Elder Care LLC","Guardian Elder Care","$26,448","$0","$26,448","2014","20141018","employment-related offenses","wage and hour violation","Fair Labor Standards Act","","federal","agency action","Labor Department Wage and Hour Division","civil","","","1744051","","","Pennsylvania","Brockway","","15824","623110","623110: Nursing Care Facilities","USA","Pennsylvania","privately held","","healthcare services","nursing homes","March 7, 2017 download of a dataset posted by the Wage and Hour Division at https://enforcedata.dol.gov/views/data_summary.php","Date and year are the Findings End Date in the dataset posted by the Wage and Hour Division, which does not provide case opening or closing dates. The company name is the Legal Name provided by the dataset unless that field is blank, in which case the Trade Name is used. The dataset provides only one address and does not indicate whether it is the company headquarters address or the establishment address. The penalty amount is the total of civil monetary penalties and mandated back wages. The original dataset provides a breakdown."
"Guardian Elder Care, LLC","Guardian Elder Care","$12,517","$0","$12,517","2013","20130420","employment-related offenses","wage and hour violation","Fair Labor Standards Act","","federal","agency action","Labor Department Wage and Hour Division","civil","","","1693114","","","Pennsylvania","Brockway","","15824","623110","623110: Nursing Care Facilities","USA","Pennsylvania","privately held","","healthcare services","nursing homes","March 7, 2017 download of a dataset posted by the Wage and Hour Division at https://enforcedata.dol.gov/views/data_summary.php","Date and year are the Findings End Date in the dataset posted by the Wage and Hour Division, which does not provide case opening or closing dates. The company name is the Legal Name provided by the dataset unless that field is blank, in which case the Trade Name is used. The dataset provides only one address and does not indicate whether it is the company headquarters address or the establishment address. The penalty amount is the total of civil monetary penalties and mandated back wages. The original dataset provides a breakdown."
"Guardian Elder Care Holdings Inc.","Guardian Elder Care","$15,466,278","$0","$15,466,278","2020","20200219","government-contracting-related offenses","False Claims Act and related","","Guardian Elder Care Holdings Inc., and related companies Guardian LTC Management Inc., Guardian Elder Care Management Inc., Guardian Elder Care Management I Inc., and Guardian Rehabilitation Services Inc., agreed to pay $15,466,278 to resolve False Claims Act allegations that they knowingly overbilled Medicare and the Federal Employees Health Benefits Program for medically unnecessary rehabilitation therapy services.","federal","agency action","Justice Department Civil Division","civil","","","","","","","","","","","","USA","Pennsylvania","privately held","","healthcare services","nursing homes","https://www.justice.gov/opa/pr/guardian-elder-care-holdings-and-related-entities-agree-pay-154-million-resolve-false-claims",""
"GUARDIAN ELDER CARE AT WHEELING","Guardian Elder Care","$9,750","$0","$9,750","2020","20200624","safety-related offenses","nursing home violation","","","federal","agency action","Centers for Medicare & Medicaid Services","civil","","","","","","West Virginia","WHEELING","20 HOMESTEAD AVENUE","26003","","","USA","Pennsylvania","privately held","","healthcare services","nursing homes","https://data.cms.gov/provider-data/dataset/g6vv-u9sr",""
