"Company","Parent Company","Penalty Amount","Subtraction From Penalty","Penalty Amount Adjusted For Eliminating Multiple Counting","Penalty Year","Penalty Date","Offense Group","Primary Offense","Secondary Offense","Description","Level of Government","Action Type","Agency","Civil/Criminal","Prosecution Agreement","Court","Case ID","Private Litigation Case Title","Lawsuit Resolution","Facility State","City","Address","Zip","NAICS Code","NAICS Translation","HQ Country of Parent","HQ State of Parent","Ownership Structure","Parent Company Stock Ticker","Major Industry of Parent","Specific Industry of Parent","Info Source","Notes"
"Harley-Davidson","Harley-Davidson","$12,000,000","$0","$12,000,000","2016","20160818","environment-related offenses","environmental violation","","The EPA and the Department of Justice announced a settlement with Harley-Davidson, Inc., Harley-Davidson Motor Company Group, LLC, Harley-Davidson Motorcycle Company, Inc., and Harley-Davidson Motor Company Operations, Inc. that required the companies to stop selling and to buy back and destroy illegal devices that increase air pollution from their motorcycles, and to sell only models of these devices that are certified to meet Clean Air Act emissions standards. Harley-Davidson agreed to pay a $12 million civil penalty and spend $3 million to mitigate air pollution through a project to replace conventional woodstoves with cleaner-burning stoves in local communities. The $3 million mitigation expense was later rescinded.","federal","agency action","Environmental Protection Agency civil settlements","civil","","","","","","","","","","","","USA","Wisconsin","publicly traded","HOG","motor vehicles","motor vehicles","https://www.epa.gov/newsreleases/harley-davidson-stop-sales-illegal-devices-increased-air-pollution-companys-motorcycles",""
"Harley-Davidson Financial Services, Inc.","Harley-Davidson","$253,000","$0","$253,000","2014","20140606","consumer-protection-related offenses","consumer protection violation","","Harley-Davidson Financial Services, Inc. agreed to pay $228,000 in restitution and $25,000 in costs in settlement of allegations it failed to pay proper refunds under the terms of its motorcycle finance agreements.","state","agency action","Massachusetts Attorney General","civil","","","","","","Massachusetts","","","","","","USA","Wisconsin","publicly traded","HOG","motor vehicles","motor vehicles","https://web.archive.org/web/20140709014611/http://www.mass.gov/ago/news-and-updates/press-releases/2014/2014-06-06-harley-davidson.html",""
"Harley-Davidson Insurance Services, Inc.","Harley-Davidson","$17,500","$0","$17,500","2008","20081002","consumer-protection-related offenses","insurance violation","","","state","agency action","Indiana Department of Insurance","civil","","","","","","Indiana","","","","","","USA","Wisconsin","publicly traded","HOG","motor vehicles","motor vehicles","https://www.in.gov/idoi/files/enforcement/6301_FO(2).pdf",""
"HARLEY-DAVIDSON INSURANCE SERVICES","Harley-Davidson","$5,000","$0","$5,000","2009","20091001","consumer-protection-related offenses","insurance violation","","","state","agency action","Virginia Bureau of Insurance","civil","","","INS-2009-00183","","","Virginia","","","","","","USA","Wisconsin","publicly traded","HOG","motor vehicles","motor vehicles","https://scc.virginia.gov/docketsearch/DOCS/1zr_01!.PDF",""
"HARLEY DAVIDSON, INC.","Harley-Davidson","$5,250","$0","$5,250","2011","20111013","safety-related offenses","workplace safety or health violation","","","federal","agency action","Occupational Safety & Health Administration","civil","","","","","","Missouri","KANSAS CITY","11401 NORTH CONGRESS AVENUE","64153","336991","336991: Motorcycle, Bicycle, and Parts Manufacturing","USA","Wisconsin","publicly traded","HOG","motor vehicles","motor vehicles","Extracted from a download of OSHA's Enforcment Data downloaded on 3/02/2022, available at https://enforcedata.dol.gov/views/data_catalogs.php",""
"HARLEY-DAVIDSON, INC.","Harley-Davidson","$5,100","$0","$5,100","2012","20120510","safety-related offenses","workplace safety or health violation","","","federal","agency action","Occupational Safety & Health Administration","civil","","","","","","Wisconsin","TOMAHAWK","611 KAPHAEM RD.","54487","336991","336991: Motorcycle, Bicycle, and Parts Manufacturing","USA","Wisconsin","publicly traded","HOG","motor vehicles","motor vehicles","Extracted from a download of OSHA's Enforcment Data downloaded on 3/02/2022, available at https://enforcedata.dol.gov/views/data_catalogs.php",""
"HARLEY-DAVIDSON MOTOR COMPANY, INC.","Harley-Davidson","$26,520","$0","$26,520","2018","20181119","safety-related offenses","workplace safety or health violation","","","federal","agency action","Occupational Safety & Health Administration","civil","","","","","","Pennsylvania","YORK","1425 EDEN ROAD","17402","336991","336991: Motorcycle, Bicycle, and Parts Manufacturing","USA","Wisconsin","publicly traded","HOG","motor vehicles","motor vehicles","Extracted from a download of OSHA's Enforcment Data downloaded on 3/02/2022, available at https://enforcedata.dol.gov/views/data_catalogs.php",""
"Harley-Davidson Motor Co","Harley-Davidson","$12,500","$0","$12,500","2002","20021231","environment-related offenses","environmental violation","","","federal","agency action","Environmental Protection Agency","civil","","","03-2002-0271","","","","","","","","","USA","Wisconsin","publicly traded","HOG","motor vehicles","motor vehicles","Extracted from a download of the EPA's Enforcement and Compliance History Online (ECHO) ICIS FE&C file downloaded on 3/02/2022, available at http://echo.epa.gov/tools/data-downloads#downloads",""
