"Company","Parent Company","Penalty Amount","Subtraction From Penalty","Penalty Amount Adjusted For Eliminating Multiple Counting","Penalty Year","Penalty Date","Offense Group","Primary Offense","Secondary Offense","Description","Level of Government","Action Type","Agency","Civil/Criminal","Prosecution Agreement","Court","Case ID","Private Litigation Case Title","Lawsuit Resolution","Facility State","City","Address","Zip","NAICS Code","NAICS Translation","HQ Country of Parent","HQ State of Parent","Ownership Structure","Parent Company Stock Ticker","Major Industry of Parent","Specific Industry of Parent","Info Source","Notes"
"Harvard University","Harvard University","$20,000","$0","$20,000","2000","20001221","employment-related offenses","labor relations violation","","back pay award in unfair labor practices case","federal","agency action","National Labor Relations Board","civil","","","01-CA-38428-001","","","Massachusetts","Cambridge","","02138","611310","611310: Colleges, Universities, and Professional Schools","USA","Massachusetts","non-profit","","miscellaneous services","university","Extracted from an NLRB dataset covering 1999-2011 downloaded at https://catalog.data.gov/dataset/nlrb-cats-final-c-case-data-bulk-19990101-20110930-in-xml",""
"Harvard University","Harvard University","$14,620","$0","$14,620","2004","20040429","employment-related offenses","labor relations violation","","back pay award in unfair labor practices case","federal","agency action","National Labor Relations Board","civil","","","01-CA-41025-001","","","Massachusetts","Cambridge","","02138","611310","611310: Colleges, Universities, and Professional Schools","USA","Massachusetts","non-profit","","miscellaneous services","university","Extracted from an NLRB dataset covering 1999-2011 downloaded at https://catalog.data.gov/dataset/nlrb-cats-final-c-case-data-bulk-19990101-20110930-in-xml",""
"Harvard University","Harvard University","$6,845","$0","$6,845","2004","20041006","employment-related offenses","labor relations violation","","back pay award in unfair labor practices case","federal","agency action","National Labor Relations Board","civil","","","01-CA-40785-001","","","Massachusetts","Cambridge","","02138","561612","561612: Security Guards and Patrol Services","USA","Massachusetts","non-profit","","miscellaneous services","university","Extracted from an NLRB dataset covering 1999-2011 downloaded at https://catalog.data.gov/dataset/nlrb-cats-final-c-case-data-bulk-19990101-20110930-in-xml",""
"Harvard University","Harvard University","$1,359,791","$0","$1,359,791","2020","20200427","government-contracting-related offenses","False Claims Act and related","","","federal","agency action","U.S. Attorney-District of Massachusetts","civil","","","","","","Massachusetts","","","","","","USA","Massachusetts","non-profit","","miscellaneous services","university","https://www.justice.gov/usao-ma/pr/harvard-university-agrees-pay-over-13-million-resolve-allegations-overcharging-nih-grants",""
"HARVARD UNIVERSITY","Harvard University","$7,000","$0","$7,000","2014","20140417","safety-related offenses","workplace safety or health violation","","","federal","agency action","Occupational Safety & Health Administration","civil","","","","","","Massachusetts","CAMBRIDGE","1 OXFORD STREET","02139","611310","611310: Colleges, Universities, and Professional Schools","USA","Massachusetts","non-profit","","miscellaneous services","university","Extracted from a download of OSHA's Enforcment Data downloaded on 3/02/2022, available at https://enforcedata.dol.gov/views/data_catalogs.php",""
