"Company","Parent Company","Penalty Amount","Subtraction From Penalty","Penalty Amount Adjusted For Eliminating Multiple Counting","Penalty Year","Penalty Date","Offense Group","Primary Offense","Secondary Offense","Description","Level of Government","Action Type","Agency","Civil/Criminal","Prosecution Agreement","Court","Case ID","Private Litigation Case Title","Lawsuit Resolution","Facility State","City","Address","Zip","NAICS Code","NAICS Translation","HQ Country of Parent","HQ State of Parent","Ownership Structure","Parent Company Stock Ticker","Major Industry of Parent","Specific Industry of Parent","Info Source","Notes"
"Hewlett-Packard Co","Hewlett Packard Enterprise","$16,250,000","$0","$16,250,000","2010","20101110","government-contracting-related offenses","False Claims Act and related","","The United States settled two whistleblower lawsuits for $16.25 million alleging that Hewlett-Packard Co. violated the competitive bidding rules of the Federal Communications Commission's E-Rate Program at the Dallas and Houston Independent School Districts in connection with technology services contracts with those school districts. ","federal","agency action","Justice Department Civil Division","civil","","","","","","Texas","","","","","","USA","California","publicly traded","NYSE: HPE","information technology","information technology","https://www.justice.gov/opa/pr/us-settles-lawsuits-against-hewlett-packard-and-intervenes-against-its-business-partners",""
"Hewlett-Packard Co.","Hewlett Packard Enterprise","$55,000,000","$0","$55,000,000","2010","20100830","government-contracting-related offenses","False Claims Act and related","kickbacks and bribery","Hewlett-Packard Co. agreed to pay the United States $55 million to settle claims that the company defrauded the General Services Administration and other federal agencies.  The settlement resolved allegationsthat HP knowingly paid kickbacks, or ""influencer fees,"" to systems integrator companies in return for recommendations that federal agencies purchase HP's products.  The settlement also resolved claims that HP's 2002 contract with the GSA was defectively priced because HP provided incomplete information to GSA contracting officers during contract negotiations. ","federal","agency action","Justice Department Civil Division","civil","","","","","","","","","","","","USA","California","publicly traded","NYSE: HPE","information technology","information technology","https://www.justice.gov/opa/pr/hewlett-packard-agrees-pay-united-states-55-million-settle-allegations-fraud",""
"Hewlett-Packard Co.","Hewlett Packard Enterprise","$32,500,000","$0","$32,500,000","2014","20140801","government-contracting-related offenses","False Claims Act and related","","Hewlett-Packard Co. agreed to pay $32.5 million to resolve allegations under the False Claims Act that it overcharged the U.S. Postal Service for products between October 2001 and December 2010.","federal","agency action","Justice Department Civil Division","civil","","","","","","","","","","","","USA","California","publicly traded","NYSE: HPE","information technology","information technology","https://www.justice.gov/opa/pr/hewlett-packard-company-agrees-pay-325-million-alleged-overbilling-us-postal-service",""
"Hewlett-Packard Co.","Hewlett Packard Enterprise","$750,000","$0","$750,000","2016","20160921","employment-related offenses","employment discrimination","","The Office of Federal Contract Compliance Programs announced that HP agreed to pay $750,000 in back wages and interest to settle allegations of hiring discrimination. The action affected 504 qualified applicants -- including 349 African Americans, one American Indian/Alaskan Native, 109 Asians, 44 Hispanics and one Native Hawaiian/Pacific Islander -- who the company rejected for Inside Sales Representative positions.","federal","agency action","Office of Federal Contract Compliance Programs","civil","","","","","","Arkansas","Conway","","","","","USA","California","publicly traded","NYSE: HPE","information technology","information technology","https://www.dol.gov/newsroom/releases/ofccp/ofccp20160921",""
"Silicon Graphics Inc.","Hewlett Packard Enterprise","$182,000","$0","$182,000","2003","20030106","competition-related offenses","export control violation","","","federal","agency action","Bureau of Industry and Security","civil","","","","","","","","","","","","USA","California","publicly traded","NYSE: HPE","information technology","information technology","FOIA140","Source document obtained through a Freedom of Information Act request to the agency."
"Silicon Graphics","Hewlett Packard Enterprise","$5,500,000","$0","$5,500,000","2002","20020725","employment-related offenses","wage and hour violation","","misclassification","state","private litigation","","civil","","Superior Court of State of California, County of Santa Clara","C-00-20731","Sweeney v. Silicon Graphics Inc.","settlement","California","","","","","","USA","California","publicly traded","NYSE: HPE","information technology","information technology","http://www.chavezgertler.com/recent-successes/5-5-million-recovery-against-silicon-graphics/",""
"Hewlett Packard Enterprise","Hewlett Packard Enterprise","$427,000","$0","$427,000","2020","20200930","employment-related offenses","employment discrimination","","","federal","agency action","Office of Federal Contract Compliance Programs","civil","","","","","","","","","","","","USA","California","publicly traded","NYSE: HPE","information technology","information technology","https://www.dol.gov/sites/dolgov/files/OFCCP/foia/files/20200930-HPE-CA-00181394-00196701-SW.pdf",""
"HEWLETT PACKARD ENTERPRISE COMPANY","Hewlett Packard Enterprise","$15,000","$0","$15,000","2002","20021212","environment-related offenses","environmental violation","","","state","agency action","Massachusetts Executive Office of Energy and Environmental Affairs","civil","","","","","","Massachusetts","Andover","","","","","USA","California","publicly traded","NYSE: HPE","information technology","information technology","https://eeaonline.eea.state.ma.us/Portal/#!/search/enforcements/results?FacilityName=HEWLETT PACKARD ENTERPRISE COMPANY","Captured from records in EEA database with basic enforcement information; may not include full details of penalties."
"HP Enterprise Services, LLC","Hewlett Packard Enterprise","$32,359","$0","$32,359","2013","20131007","environment-related offenses","environmental violation","","","state","agency action","Virginia Department of Environmental Quality","civil","","","","","","Virginia","Herndon","","","","","USA","California","publicly traded","NYSE: HPE","information technology","information technology","https://www.deq.virginia.gov/permits-regulations/enforcement/final-orders",""
