"Company","Parent Company","Penalty Amount","Subtraction From Penalty","Penalty Amount Adjusted For Eliminating Multiple Counting","Penalty Year","Penalty Date","Offense Group","Primary Offense","Secondary Offense","Description","Level of Government","Action Type","Agency","Civil/Criminal","Prosecution Agreement","Court","Case ID","Private Litigation Case Title","Lawsuit Resolution","Facility State","City","Address","Zip","NAICS Code","NAICS Translation","HQ Country of Parent","HQ State of Parent","Ownership Structure","Parent Company Stock Ticker","Major Industry of Parent","Specific Industry of Parent","Info Source","Notes"
"Hydrofarm Inc.","Hydrofarm","$11,320","$0","$11,320","2013","20130701","safety-related offenses","motor vehicle safety violation","","","federal","agency action","Federal Motor Carrier Safety Administration","civil","","","","","","California","PETALUMA","","","","","USA","California","privately held","","agribusiness","agricultural equipment","https://www.fmcsa.dot.gov/regulations/enforcement/national-listing-enforcement-cases-subject-name-closed-fiscal-year-2013-pdf",""
"Hydrofarm, Inc.","Hydrofarm","$316,000","$0","$316,000","2013","20130403","environment-related offenses","environmental violation","","The U.S. Environmental Protection Agency announced a settlement with Hydrofarm, Inc. for selling two unregistered pesticides in violation of federal pesticide law. As part of the settlement, the Petaluma, Calif.-based Hydrofarm, Inc., one of the nation's largest distributors of agricultural and hydroponic supplies, has agreed to pay $316,000 in fines and has stopped selling both products.","federal","agency action","Environmental Protection Agency","civil","","","","","","","","","","","","USA","California","privately held","","agribusiness","agricultural equipment","https://archive.epa.gov/epapages/newsroom_archive/newsreleases/e3ff9d4e2397666085257b420058dffd.html",""
"Hydrofarm Inc.","Hydrofarm","$150,000","$0","$150,000","2017","20170607","environment-related offenses","environmental violation","","pesticide violation","state","agency action","California Department of Pesticide Regulation","civil","","","","","","California","","","","","","USA","California","privately held","","agribusiness","agricultural equipment","https://www.cdpr.ca.gov/docs/mill/actions/fines.htm",""
"Hydrofarm Inc.","Hydrofarm","$6,433","$0","$6,433","2013","20130523","environment-related offenses","environmental violation","","pesticide violation","state","agency action","California Department of Pesticide Regulation","civil","","","","","","California","","","","","","USA","California","privately held","","agribusiness","agricultural equipment","Contained in data obtained from the agency on October 6, 2020 in response to an open records request. ",""
"Hydrofarm Inc.","Hydrofarm","$27,424","$0","$27,424","2010","20100406","environment-related offenses","environmental violation","","pesticide violation","state","agency action","California Department of Pesticide Regulation","civil","","","","","","California","","","","","","USA","California","privately held","","agribusiness","agricultural equipment","Contained in data obtained from the agency on October 6, 2020 in response to an open records request. ",""
"Hydrofarm, Inc.","Hydrofarm","$316,000","$316,000","$0","2013","20130329","environment-related offenses","environmental violation","","","federal","agency action","Environmental Protection Agency","civil","","","09-2012-4099","","","California","PETALUMA","2249 S. MCDOWELL BOULEVARD","94954","","","USA","California","privately held","","agribusiness","agricultural equipment","Extracted from a download of the EPA's Enforcement and Compliance History Online (ECHO) ICIS FE&C file downloaded on 3/02/2022, available at http://echo.epa.gov/tools/data-downloads#downloads","Note: This penalty is a duplicate of an amount shown in another record (either because it applies to a multi-location settlement or because Violation Tracker contains an agency record and a settlement announcement for the same case)."
