"Company","Parent Company","Penalty Amount","Subtraction From Penalty","Penalty Amount Adjusted For Eliminating Multiple Counting","Penalty Year","Penalty Date","Offense Group","Primary Offense","Secondary Offense","Description","Level of Government","Action Type","Agency","Civil/Criminal","Prosecution Agreement","Court","Case ID","Private Litigation Case Title","Lawsuit Resolution","Facility State","City","Address","Zip","NAICS Code","NAICS Translation","HQ Country of Parent","HQ State of Parent","Ownership Structure","Parent Company Stock Ticker","Major Industry of Parent","Specific Industry of Parent","Info Source","Notes"
"BP Amoco Chemical Company","Ineos","$12,350","$0","$12,350","2007","20070330","safety-related offenses","railroad safety violation","","","federal","agency action","Federal Railroad Administration","civil","","","","","","","","","","","","United Kingdom","","privately held","","chemicals","chemicals","Taken from the Federal Railroad Administration's FY2007 safety penalty report obtained through a Freedom of Information Act request. A copy is available upon request. ",""
"CALABRIAN CORP.","Ineos","$7,500","$0","$7,500","2014","20140505","safety-related offenses","railroad safety violation","","","federal","agency action","Federal Railroad Administration","civil","","","","","","","","","","","","United Kingdom","","privately held","","chemicals","chemicals","https://www.fra.dot.gov/eLib/details/L16190#p1_z5_gD_lEA",""
"CALABRIAN CORP.","Ineos","$6,500","$0","$6,500","2010","20100125","safety-related offenses","railroad safety violation","","","federal","agency action","Federal Railroad Administration","civil","","","","","","","","","","","","United Kingdom","","privately held","","chemicals","chemicals","https://www.fra.dot.gov/eLib/details/L01493#p1_z5_gD_lEA",""
"CALABRIAN CORP.","Ineos","$5,000","$0","$5,000","2016","20160504","safety-related offenses","railroad safety violation","","","federal","agency action","Federal Railroad Administration","civil","","","","","","","","","","","","United Kingdom","","privately held","","chemicals","chemicals","https://www.fra.dot.gov/Elib/Document/16831","Year is fiscal year."
"CALABRIAN CORP.","Ineos","$5,000","$0","$5,000","2013","20130528","safety-related offenses","railroad safety violation","","","federal","agency action","Federal Railroad Administration","civil","","","","","","","","","","","","United Kingdom","","privately held","","chemicals","chemicals","https://www.fra.dot.gov/eLib/details/L04899#p1_z5_gD_lEA",""
"INEOS","Ineos","$10,000","$0","$10,000","2012","20120215","safety-related offenses","railroad safety violation","","","federal","agency action","Federal Railroad Administration","civil","","","","","","","","","","","","United Kingdom","","privately held","","chemicals","chemicals","https://www.fra.dot.gov/eLib/details/L04190#p1_z5_gD_lEA",""
"INEOS","Ineos","$8,000","$0","$8,000","2009","20091116","safety-related offenses","railroad safety violation","","","federal","agency action","Federal Railroad Administration","civil","","","","","","","","","","","","United Kingdom","","privately held","","chemicals","chemicals","https://www.fra.dot.gov/eLib/details/L01493#p1_z5_gD_lEA",""
"INEOS","Ineos","$6,000","$0","$6,000","2009","20091116","safety-related offenses","railroad safety violation","","","federal","agency action","Federal Railroad Administration","civil","","","","","","","","","","","","United Kingdom","","privately held","","chemicals","chemicals","https://www.fra.dot.gov/eLib/details/L01493#p1_z5_gD_lEA",""
"INEOS ABS USA Corp.","Ineos","$5,100,000","$0","$5,100,000","2009","20090731","environment-related offenses","environmental violation","","The former and current owners and operators of a chemical facility in Addyston, Ohio, LANXESS Corp. and INEOS ABS USA Corp., agreed to pay a $3.1 million civil penalty and INEOS will spend up to $2 million to install environmental controls and modify operating procedures to resolve violations of multiple environmental laws.","federal","agency action","Justice Department Environment and Natural Resources Division","civil","","","","","","","","","","","","United Kingdom","","privately held","","chemicals","chemicals","https://www.justice.gov/opa/pr/two-chemical-companies-agree-resolve-environmental-violations-ohio",""
"Ineos Acrylics Inc.","Ineos","$5,000","$0","$5,000","2001","20011010","safety-related offenses","railroad safety violation","","","federal","agency action","Federal Railroad Administration","civil","","","","","","","","","","","","United Kingdom","","privately held","","chemicals","chemicals","Taken from the Federal Railroad Administration's FY2002 safety penalty report obtained through a Freedom of Information Act request. A copy is available upon request. ",""
"Ineos Chlor America Inc.","Ineos","$175,000","$0","$175,000","2012","20120821","environment-related offenses","environmental violation","","The U.S. Environmental Protection Agency (EPA) announced a settlement with INEOS Chlor Americas, Inc., based in Wilmington, Del., to resolve violations of the Toxic Substances Control Act (TSCA). INEOS allegedly imported various chain-length chlorinated paraffins into the United States without providing the required notice to EPA. Under this settlement INEOS has ended the importation of short-chained chlorinated paraffins into the United States. ","federal","agency action","Environmental Protection Agency","civil","","","","","","","","","","","","United Kingdom","","privately held","","chemicals","chemicals","http://www2.epa.gov/enforcement/ineos-chlor-americas-settlement",""
"INEOS Melamines LLC","Ineos","$485,000","$0","$485,000","2012","20121220","environment-related offenses","environmental violation","","Two companies operating a chemical plant in Springfield, Mass. will pay a penalty of $970,000 and take other actions, under a settlement announced today between Solutia Inc. and INEOS Melamines LLC, and the U.S. Environmental Protection Agency and the U.S. Department of Justice. (The consent decree did not specify how the cost would be divided between the two companies. Here it is divided evenly between them.)","federal","agency action","Environmental Protection Agency","civil","","","","","","Massachusetts","Springfield","","","","","United Kingdom","","privately held","","chemicals","chemicals","https://archive.epa.gov/epapages/newsroom_archive/newsreleases/b2bdd1d0e5ad522885257ada006f95fc.html",""
"Ineos Phenol Inc.","Ineos","$5,000","$0","$5,000","2007","20070711","safety-related offenses","railroad safety violation","","","federal","agency action","Federal Railroad Administration","civil","","","","","","","","","","","","United Kingdom","","privately held","","chemicals","chemicals","Taken from the Federal Railroad Administration's FY2007 safety penalty report obtained through a Freedom of Information Act request. A copy is available upon request. ",""
"Ineos Phenol Inc.","Ineos","$5,000","$0","$5,000","2007","20070711","safety-related offenses","railroad safety violation","","","federal","agency action","Federal Railroad Administration","civil","","","","","","","","","","","","United Kingdom","","privately held","","chemicals","chemicals","Taken from the Federal Railroad Administration's FY2007 safety penalty report obtained through a Freedom of Information Act request. A copy is available upon request. ",""
"INEOS PHENOL, INC.","Ineos","$8,000","$0","$8,000","2013","20131031","safety-related offenses","railroad safety violation","","","federal","agency action","Federal Railroad Administration","civil","","","","","","","","","","","","United Kingdom","","privately held","","chemicals","chemicals","https://www.fra.dot.gov/eLib/details/L16190#p1_z5_gD_lEA",""
"INEOS PHENOL, INC.","Ineos","$7,500","$0","$7,500","2010","20101227","safety-related offenses","railroad safety violation","","","federal","agency action","Federal Railroad Administration","civil","","","","","","","","","","","","United Kingdom","","privately held","","chemicals","chemicals","https://www.fra.dot.gov/eLib/details/L01494#p1_z5_gD_lEA",""
"INEOS PHENOL, INC.","Ineos","$5,000","$0","$5,000","2015","20151028","safety-related offenses","railroad safety violation","","","federal","agency action","Federal Railroad Administration","civil","","","","","","","","","","","","United Kingdom","","privately held","","chemicals","chemicals","https://railroads.dot.gov/elibrary/fiscal-year-2016-enforcement-report",""
"INEOS PHENOL, INC.","Ineos","$5,000","$0","$5,000","2010","20100126","safety-related offenses","railroad safety violation","","","federal","agency action","Federal Railroad Administration","civil","","","","","","","","","","","","United Kingdom","","privately held","","chemicals","chemicals","https://www.fra.dot.gov/eLib/details/L01493#p1_z5_gD_lEA",""
"INEOS USA LLC","Ineos","$222,420","$0","$222,420","2007","20070326","employment-related offenses","wage and hour violation","Fair Labor Standards Act","","federal","agency action","Labor Department Wage and Hour Division","civil","","","1474666","","","Ohio","Lima","","45804","3259","3259: Other Chemical Product and Preparation Manufacturing","United Kingdom","","privately held","","chemicals","chemicals","March 7, 2017 download of a dataset posted by the Wage and Hour Division at https://enforcedata.dol.gov/views/data_summary.php","Date and year are the Findings End Date in the dataset posted by the Wage and Hour Division, which does not provide case opening or closing dates. The company name is the Legal Name provided by the dataset unless that field is blank, in which case the Trade Name is used. The dataset provides only one address and does not indicate whether it is the company headquarters address or the establishment address. The penalty amount is the total of civil monetary penalties and mandated back wages. The original dataset provides a breakdown."
"INEOS/NOVA, LLC","Ineos","$13,608","$0","$13,608","2009","20091231","employment-related offenses","labor relations violation","","back pay award in unfair labor practices case","federal","agency action","National Labor Relations Board","civil","","","01-CA-45407-001","","","Massachusetts","Indian Orchard","","01151","325199","325199: All Other Basic Organic Chemical Manufacturing","United Kingdom","","privately held","","chemicals","chemicals","Extracted from an NLRB dataset covering 1999-2011 downloaded at https://catalog.data.gov/dataset/nlrb-cats-final-c-case-data-bulk-19990101-20110930-in-xml",""
"INEOS ABS USA Corporation (aks Lanxess Corporation)","Ineos","$25,000","$0","$25,000","2010","20101015","employment-related offenses","labor relations violation","","back pay award in unfair labor practices case","federal","agency action","National Labor Relations Board","civil","","","09-CA-44592-001","","","Ohio","Addyston","","45001","326191","326191: Plastics Plumbing Fixture Manufacturing","United Kingdom","","privately held","","chemicals","chemicals","Extracted from an NLRB dataset covering 1999-2011 downloaded at https://catalog.data.gov/dataset/nlrb-cats-final-c-case-data-bulk-19990101-20110930-in-xml",""
"INEOS OXIDE","Ineos","$7,500","$0","$7,500","2009","20090929","safety-related offenses","railroad safety violation","","","federal","agency action","Federal Railroad Administration","civil","","","","","","","","","","","","United Kingdom","","privately held","","chemicals","chemicals","https://www.fra.dot.gov/Elib/Document/282","Year is fiscal year."
"INEOS FILMS INC.","Ineos","$8,715","$0","$8,715","2010","20100120","safety-related offenses","workplace safety or health violation","","","federal","agency action","Occupational Safety & Health Administration","civil","","","","","","Delaware","DELAWARE CITY","1389 SCHOOL HOUSE ROAD","19706","326113","326113: Unlaminated Plastics Film and Sheet (except Packaging) Manufacturing","United Kingdom","","privately held","","chemicals","chemicals","Extracted from a download of OSHA's Enforcment Data downloaded on 3/02/2022, available at https://enforcedata.dol.gov/views/data_catalogs.php",""
"BP, COOPER RIVER DIVISION","Ineos","$5,625","$0","$5,625","2001","20010326","safety-related offenses","workplace safety or health violation","","","federal","agency action","Occupational Safety & Health Administration","civil","","","","","","South Carolina","WANDO","1306 AMOCO DRIVE","29492","000000","","United Kingdom","","privately held","","chemicals","chemicals","Extracted from a download of OSHA's Enforcment Data downloaded on 3/02/2022, available at https://enforcedata.dol.gov/views/data_catalogs.php",""
"INEOS ABS","Ineos","$1,550,000","$1,550,000","$0","2009","20090731","environment-related offenses","environmental violation","","The former and current owners and operators of a chemical facility in Addyston, Ohio agreed to pay $1.55 million to state and local agencies to resolve air pollution violations. This was part of a larger $5.1 million settlement involving the federal government; see the Violation Tracker entry at https://violationtracker.goodjobsfirst.org/violation-tracker/-ineos-abs-usa-corp","state","agency action","Ohio Attorney General","civil","","","","","","Ohio","Addyston","","","","","United Kingdom","","privately held","","chemicals","chemicals","https://web.archive.org/web/20101227184817/http://www.ohioattorneygeneral.gov/Briefing-Room/News-Releases/July-2009/Cordray-and-Ohio-EPA-Reach-Multimillion-Dollar-Set",""
"INEOS Phenol","Ineos","$20,000","$0","$20,000","2005","20050222","environment-related offenses","environmental violation","","Air","state","agency action","Alabama Department of Environmental Management","civil","","","","","","Alabama","","","","","","United Kingdom","","privately held","","chemicals","chemicals","List of FY2005 ADEM Administrative Orders obtained via an open records request on October 5, 2020.",""
"BP Amoco Chemical Company","Ineos","$15,000","$0","$15,000","2004","20041202","environment-related offenses","environmental violation","","Air","state","agency action","Alabama Department of Environmental Management","civil","","","","","","Alabama","","","","","","United Kingdom","","privately held","","chemicals","chemicals","List of FY2005 ADEM Administrative Orders obtained via an open records request on October 5, 2020.",""
"INEOS BIO USA, LLC","Ineos","$6,750","$0","$6,750","2015","20151110","environment-related offenses","environmental violation","","hazardous waste violation","state","agency action","Arkansas Division of Environmental Quality","civil","","","","","","Arkansas","","","","","","United Kingdom","","privately held","","chemicals","chemicals","https://www.adeq.state.ar.us/downloads/Communications/Enforcement_Actions/2015-11-10_Notice_of_Enforcement_Actions.pdf",""
"INEOS Americas, LLC","Ineos","$13,648","$0","$13,648","2016","20160119","environment-related offenses","environmental violation","","","state","agency action","Louisiana Department of Environmental Quality","civil","","","","","","Louisiana","","","","","","United Kingdom","","privately held","","chemicals","chemicals","https://deq.louisiana.gov/assets/docs/General/Settlement_Agreements/2015/INEOS0035_Final.pdf",""
"Ineos Fluor Americas, LLC","Ineos","$5,000","$0","$5,000","2012","20121204","environment-related offenses","environmental violation","","","state","agency action","Louisiana Department of Environmental Quality","civil","","","","","","Louisiana","St. Gabriel","","","","","United Kingdom","","privately held","","chemicals","chemicals","https://deq.louisiana.gov/assets/docs/General/Settlement_Agreements/2012/IneosFluor_Final.pdf",""
"STYROLUTION AMERICA LLC","Ineos","$23,250","$0","$23,250","2012","20121015","environment-related offenses","environmental violation","","","state","agency action","Massachusetts Executive Office of Energy and Environmental Affairs","civil","","","","","","Massachusetts","Springfield","","","","","United Kingdom","","privately held","","chemicals","chemicals","https://eeaonline.eea.state.ma.us/Portal/#!/search/enforcements/results?FacilityName=STYROLUTION AMERICA LLC - INDIAN ORCHARD","Captured from records in EEA database with basic enforcement information; may not include full details of penalties."
"Ineos USA LLC","Ineos","$5,500","$0","$5,500","2010","20100512","environment-related offenses","environmental violation","","","state","agency action","Ohio Environmental Protection Agency","civil","","","","","","Ohio","Lima","","","","","United Kingdom","","privately held","","chemicals","chemicals","http://edocpub.epa.ohio.gov/publicportal/ViewDocument.aspx?docid=52198",""
"INEOS USA LLC","Ineos","$21,240","$0","$21,240","2020","20200512","environment-related offenses","environmental violation","","","state","agency action","Texas Commission on Environmental Quality","civil","","","","","","Texas","","","","","","United Kingdom","","privately held","","chemicals","chemicals","https://www.tceq.texas.gov/compliance/enforcement/enforcement-reports/annenfreport.html",""
"INEOS Americas LLC","Ineos","$13,251","$0","$13,251","2020","20200121","environment-related offenses","environmental violation","","","state","agency action","Texas Commission on Environmental Quality","civil","","","","","","Texas","","","","","","United Kingdom","","privately held","","chemicals","chemicals","https://www.tceq.texas.gov/compliance/enforcement/enforcement-reports/annenfreport.html",""
"INEOS NITRILES USA LLC","Ineos","$42,400","$0","$42,400","2019","20191025","environment-related offenses","environmental violation","","","state","agency action","Texas Commission on Environmental Quality","civil","","","","","","Texas","","","","","","United Kingdom","","privately held","","chemicals","chemicals","https://www.tceq.texas.gov/compliance/enforcement/enforcement-reports/annenfreport.html",""
"INEOS USA LLC","Ineos","$164,867","$0","$164,867","2019","20191021","environment-related offenses","environmental violation","","","state","agency action","Texas Commission on Environmental Quality","civil","","","","","","Texas","","","","","","United Kingdom","","privately held","","chemicals","chemicals","https://www.tceq.texas.gov/compliance/enforcement/enforcement-reports/annenfreport.html",""
"INEOS Styrolution America LLC","Ineos","$7,200","$0","$7,200","2019","20191001","environment-related offenses","environmental violation","","","state","agency action","Texas Commission on Environmental Quality","civil","","","","","","Texas","","","","","","United Kingdom","","privately held","","chemicals","chemicals","https://www.tceq.texas.gov/compliance/enforcement/enforcement-reports/annenfreport.html",""
"INEOS USA LLC","Ineos","$24,451","$0","$24,451","2019","20190701","environment-related offenses","environmental violation","","","state","agency action","Texas Commission on Environmental Quality","civil","","","","","","Texas","","","","","","United Kingdom","","privately held","","chemicals","chemicals","https://www.tceq.texas.gov/assets/public/compliance/enforcement/enf_reports/AER/historical/Annual-Enforcement-Report-FY2019.pdf",""
"INEOS USA LLC","Ineos","$7,620","$0","$7,620","2019","20190426","environment-related offenses","environmental violation","","","state","agency action","Texas Commission on Environmental Quality","civil","","","","","","Texas","","","","","","United Kingdom","","privately held","","chemicals","chemicals","https://www.tceq.texas.gov/assets/public/compliance/enforcement/enf_reports/AER/historical/Annual-Enforcement-Report-FY2019.pdf",""
"INEOS USA LLC","Ineos","$45,000","$0","$45,000","2018","20180822","environment-related offenses","environmental violation","","","state","agency action","Texas Commission on Environmental Quality","civil","","","","","","Texas","","","","","","United Kingdom","","privately held","","chemicals","chemicals","https://www.tceq.texas.gov/assets/public/compliance/enforcement/enf_reports/AER/historical/Annual-Enforcement-Report-FY2018.pdf",""
"INEOS Styrolution America LLC","Ineos","$25,780","$0","$25,780","2018","20180627","environment-related offenses","environmental violation","","","state","agency action","Texas Commission on Environmental Quality","civil","","","","","","Texas","","","","","","United Kingdom","","privately held","","chemicals","chemicals","https://www.tceq.texas.gov/assets/public/compliance/enforcement/enf_reports/AER/historical/Annual-Enforcement-Report-FY2018.pdf",""
"INEOS USA LLC","Ineos","$36,000","$0","$36,000","2016","20161026","environment-related offenses","environmental violation","","","state","agency action","Texas Commission on Environmental Quality","civil","","","","","","Texas","","","","","","United Kingdom","","privately held","","chemicals","chemicals","https://www.tceq.texas.gov/assets/public/compliance/enforcement/enf_reports/AER/historical/Annual-Enforcement-Report-FY2017.pdf",""
"INEOS USA LLC","Ineos","$11,400","$0","$11,400","2016","20160912","environment-related offenses","environmental violation","","","state","agency action","Texas Commission on Environmental Quality","civil","","","","","","Texas","","","","","","United Kingdom","","privately held","","chemicals","chemicals","https://www.tceq.texas.gov/assets/public/compliance/enforcement/enf_reports/AER/historical/Annual-Enforcement-Report-FY2017.pdf",""
"INEOS USA LLC","Ineos","$10,500","$0","$10,500","2016","20160811","environment-related offenses","environmental violation","","","state","agency action","Texas Commission on Environmental Quality","civil","","","","","","Texas","","","","","","United Kingdom","","privately held","","chemicals","chemicals","https://www.tceq.texas.gov/assets/public/compliance/enforcement/enf_reports/AER/historical/Annual-Enforcement-Report-FY2017.pdf",""
"BP Amoco Chemical Company","Ineos","$11,611","$0","$11,611","2015","20150206","environment-related offenses","environmental violation","","","state","agency action","Texas Commission on Environmental Quality","civil","","","","","","Texas","","","","","","United Kingdom","","privately held","","chemicals","chemicals","https://www.tceq.texas.gov/assets/public/compliance/enforcement/enf_reports/AER/historical/Annual-Enforcement-Report-FY2015.pdf",""
"INEOS USA LLC","Ineos","$136,500","$0","$136,500","2014","20141207","environment-related offenses","environmental violation","","","state","agency action","Texas Commission on Environmental Quality","civil","","","","","","Texas","","","","","","United Kingdom","","privately held","","chemicals","chemicals","https://www.tceq.texas.gov/assets/public/compliance/enforcement/enf_reports/AER/historical/Annual-Enforcement-Report-FY2015.pdf",""
"Ineos USA, LLC","Ineos","$28,500","$0","$28,500","2014","20140629","environment-related offenses","environmental violation","","","state","agency action","Texas Commission on Environmental Quality","civil","","","","","","Texas","","","","","","United Kingdom","","privately held","","chemicals","chemicals","https://www.tceq.texas.gov/assets/public/compliance/enforcement/enf_reports/AER/historical/Annual-Enforcement-Report-FY2014.pdf",""
"Ineos USA, LLC","Ineos","$64,034","$0","$64,034","2014","20140306","environment-related offenses","environmental violation","","","state","agency action","Texas Commission on Environmental Quality","civil","","","","","","Texas","","","","","","United Kingdom","","privately held","","chemicals","chemicals","https://www.tceq.texas.gov/assets/public/compliance/enforcement/enf_reports/AER/historical/Annual-Enforcement-Report-FY2014.pdf",""
"Styrolution America LLC","Ineos","$37,680","$0","$37,680","2013","20130803","environment-related offenses","environmental violation","","","state","agency action","Texas Commission on Environmental Quality","civil","","","","","","Texas","","","","","","United Kingdom","","privately held","","chemicals","chemicals","https://www.tceq.texas.gov/assets/public/compliance/enforcement/enf_reports/AER/historical/Annual-Enforcement-Report-FY2013.pdf",""
"Ineos Polyethylene North America","Ineos","$37,737","$0","$37,737","2013","20130116","environment-related offenses","environmental violation","","","state","agency action","Texas Commission on Environmental Quality","civil","","","","","","Texas","","","","","","United Kingdom","","privately held","","chemicals","chemicals","https://www.tceq.texas.gov/assets/public/compliance/enforcement/enf_reports/AER/historical/Annual-Enforcement-Report-FY2013.pdf",""
"INEOS USA LLC","Ineos","$10,000","$0","$10,000","2012","20120706","environment-related offenses","environmental violation","","","state","agency action","Texas Commission on Environmental Quality","civil","","","","","","Texas","","","","","","United Kingdom","","privately held","","chemicals","chemicals","https://www.tceq.texas.gov/assets/public/compliance/enforcement/enf_reports/AER/historical/Annual-Enforcement-Report-FY2012.pdf",""
"BP Amoco Chemical Company","Ineos","$11,450","$0","$11,450","2012","20120608","environment-related offenses","environmental violation","","","state","agency action","Texas Commission on Environmental Quality","civil","","","","","","Texas","","","","","","United Kingdom","","privately held","","chemicals","chemicals","https://www.tceq.texas.gov/assets/public/compliance/enforcement/enf_reports/AER/historical/Annual-Enforcement-Report-FY2012.pdf",""
"INEOS USA LLC","Ineos","$17,490","$0","$17,490","2012","20120608","environment-related offenses","environmental violation","","","state","agency action","Texas Commission on Environmental Quality","civil","","","","","","Texas","","","","","","United Kingdom","","privately held","","chemicals","chemicals","https://www.tceq.texas.gov/assets/public/compliance/enforcement/enf_reports/AER/historical/Annual-Enforcement-Report-FY2012.pdf",""
