"Company","Parent Company","Penalty Amount","Subtraction From Penalty","Penalty Amount Adjusted For Eliminating Multiple Counting","Penalty Year","Penalty Date","Offense Group","Primary Offense","Secondary Offense","Description","Level of Government","Action Type","Agency","Civil/Criminal","Prosecution Agreement","Court","Case ID","Private Litigation Case Title","Lawsuit Resolution","Facility State","City","Address","Zip","NAICS Code","NAICS Translation","HQ Country of Parent","HQ State of Parent","Ownership Structure","Parent Company Stock Ticker","Major Industry of Parent","Specific Industry of Parent","Info Source","Notes"
"Bachman Services, Inc.","Innospec","$10,001","$0","$10,001","2016","20160411","employment-related offenses","benefit plan administrator violation","","Deficient Filer","federal","agency action","Employee Benefits Security Administration","civil","","","","","","Oklahoma","","","","","","USA","Colorado","publicly traded","Nasdaq: IOSP","chemicals","specialty chemicals","Included in a dataset downloaded at https://enforcedata.dol.gov/views/data_summary.php","Company is plan administrator. Penalty amount reported in range of $10,001 to $50,000. "
"Innospec Inc.","Innospec","$14,100,000","$0","$14,100,000","2010","20100318","competition-related offenses","Foreign Corrupt Practices Act","economic sanction violation","Innospec Inc. pleaded guilty to defrauding the United Nations, to violating the Foreign Corrupt Practices Act and to violating the U.S. embargo against Cuba.","federal","agency action","Justice Department Criminal Division","criminal","","","","","","","","","","","","USA","Colorado","publicly traded","Nasdaq: IOSP","chemicals","specialty chemicals","https://www.justice.gov/opa/pr/innospec-inc-pleads-guilty-fcpa-charges-and-defrauding-united-nations-admits-violating-us",""
"Innospec Inc.","Innospec","$11,200,000","$0","$11,200,000","2010","20100318","competition-related offenses","Foreign Corrupt Practices Act","","","federal","agency action","Securities and Exchange Commission","civil","","","","","","","","","","","","USA","Colorado","publicly traded","Nasdaq: IOSP","chemicals","specialty chemicals","https://www.sec.gov/news/press/2010/2010-40.htm",""
"Innospec Inc.","Innospec","$2,200,000","$0","$2,200,000","2010","20100317","financial offenses","economic sanction violation","","","federal","agency action","Office of Foreign Assets Control","civil","","","","","","","","","","","","USA","Colorado","publicly traded","Nasdaq: IOSP","chemicals","specialty chemicals","https://www.treasury.gov/resource-center/sanctions/OFAC-Enforcement/Documents/innospec_ag.pdf",""
"INNOSPEC ACTIVE CHEMICALS LLC","Innospec","$7,650","$0","$7,650","2012","20120228","safety-related offenses","workplace safety or health violation","","","federal","agency action","Occupational Safety & Health Administration","civil","","","","","","North Carolina","HIGH POINT","510 W GRIMES AVE","27260","325998","325998: All Other Miscellaneous Chemical Product and Preparation Manufacturing","USA","Colorado","publicly traded","Nasdaq: IOSP","chemicals","specialty chemicals","Extracted from a download of OSHA's Enforcment Data downloaded on 3/02/2022, available at https://enforcedata.dol.gov/views/data_catalogs.php",""
