"Company","Parent Company","Penalty Amount","Subtraction From Penalty","Penalty Amount Adjusted For Eliminating Multiple Counting","Penalty Year","Penalty Date","Offense Group","Primary Offense","Secondary Offense","Description","Level of Government","Action Type","Agency","Civil/Criminal","Prosecution Agreement","Court","Case ID","Private Litigation Case Title","Lawsuit Resolution","Facility State","City","Address","Zip","NAICS Code","NAICS Translation","HQ Country of Parent","HQ State of Parent","Ownership Structure","Parent Company Stock Ticker","Major Industry of Parent","Specific Industry of Parent","Info Source","Notes"
"JB Hunt","J.B. Hunt Transport Services","$8,000","$0","$8,000","2015","20151105","safety-related offenses","railroad safety violation","","","federal","agency action","Federal Railroad Administration","civil","","","","","","","","","","","","USA","Arkansas","publicly traded","JBHT","freight and logistics","freight services","https://railroads.dot.gov/elibrary/fiscal-year-2016-enforcement-report",""
"JB Hunt","J.B. Hunt Transport Services","$7,500","$0","$7,500","2012","20120208","safety-related offenses","railroad safety violation","","","federal","agency action","Federal Railroad Administration","civil","","","","","","","","","","","","USA","Arkansas","publicly traded","JBHT","freight and logistics","freight services","https://www.fra.dot.gov/eLib/details/L04190#p1_z5_gD_lEA",""
"J.B. Hunt Transport, Inc.","J.B. Hunt Transport Services","$260,000","$0","$260,000","2016","20161115","employment-related offenses","employment discrimination","","Race; National Origin; Religion","federal","agency action","Equal Employment Opportunity Commission","civil","","","","","","California","","","","","","USA","Arkansas","publicly traded","JBHT","freight and logistics","freight services","https://www.eeoc.gov/eeoc/newsroom/release/11-15-16.cfm","Description field shows type of discrimination that EEOC had alleged."
"J. B. Hunt Transport Services, Inc.","J.B. Hunt Transport Services","$6,180","$0","$6,180","2007","20070113","employment-related offenses","wage and hour violation","Fair Labor Standards Act","","federal","agency action","Labor Department Wage and Hour Division","civil","","","1468074","","","New Jersey","Cranbury","","08512","48412","48412: General Freight Trucking, Long-Distance","USA","Arkansas","publicly traded","JBHT","freight and logistics","freight services","March 7, 2017 download of a dataset posted by the Wage and Hour Division at https://enforcedata.dol.gov/views/data_summary.php","Date and year are the Findings End Date in the dataset posted by the Wage and Hour Division, which does not provide case opening or closing dates. The company name is the Legal Name provided by the dataset unless that field is blank, in which case the Trade Name is used. The dataset provides only one address and does not indicate whether it is the company headquarters address or the establishment address. The penalty amount is the total of civil monetary penalties and mandated back wages. The original dataset provides a breakdown."
"J.B. Hunt Transport Services, Inc.","J.B. Hunt Transport Services","$5,678","$0","$5,678","2008","20081231","employment-related offenses","wage and hour violation","Fair Labor Standards Act","","federal","agency action","Labor Department Wage and Hour Division","civil","","","1535611","","","Arkansas","Lowell","","72745","484121","484121: General Freight Trucking, Long-Distance, Truckload","USA","Arkansas","publicly traded","JBHT","freight and logistics","freight services","March 7, 2017 download of a dataset posted by the Wage and Hour Division at https://enforcedata.dol.gov/views/data_summary.php","Date and year are the Findings End Date in the dataset posted by the Wage and Hour Division, which does not provide case opening or closing dates. The company name is the Legal Name provided by the dataset unless that field is blank, in which case the Trade Name is used. The dataset provides only one address and does not indicate whether it is the company headquarters address or the establishment address. The penalty amount is the total of civil monetary penalties and mandated back wages. The original dataset provides a breakdown."
"J B HUNT TRANSP INC","J.B. Hunt Transport Services","$9,000","$0","$9,000","2018","20180509","environment-related offenses","environmental violation","","","state","agency action","Pennsylvania Department of Environmental Protection","civil","","","","","","Pennsylvania","","","","","","USA","Arkansas","publicly traded","JBHT","freight and logistics","freight services","Contained in data received from the agency on February 25, 2021 in response to an open records request. The data was a spreadsheet version of information contained in individual case documents that can be retrieved at https://www.ahs.dep.pa.gov/eFACTSWeb/default.aspx",""
"JB Hunt","J.B. Hunt Transport Services","$6,000","$0","$6,000","2016","20161208","safety-related offenses","railroad safety violation","","","federal","agency action","Federal Railroad Administration","civil","","","ZJBH 2016-1(HMT)","","","","","","","","","USA","Arkansas","publicly traded","JBHT","freight and logistics","freight services","https://www.fra.dot.gov/Elib/Document/17839",""
"JB Hunt","J.B. Hunt Transport Services","$7,500","$0","$7,500","2016","20161222","safety-related offenses","railroad safety violation","","","federal","agency action","Federal Railroad Administration","civil","","","ZJBH 2016-2(HMT)","","","","","","","","","USA","Arkansas","publicly traded","JBHT","freight and logistics","freight services","https://www.fra.dot.gov/Elib/Document/17839",""
"J. B. Hunt Transport Inc","J.B. Hunt Transport Services","$8,521","$0","$8,521","2013","20130416","employment-related offenses","wage and hour violation","","overtime violation","state","agency action","Washington State Department of Labor & Industries","civil","","","82241","","","Washington","","","","","","USA","Arkansas","publicly traded","JBHT","freight and logistics","freight services","Contained in data obtained on May 15, 2017 in response to an open records request. ",""
"J. B. Hunt Transport Inc","J.B. Hunt Transport Services","$23,634","$0","$23,634","2013","20130403","employment-related offenses","wage and hour violation","","overtime violation","state","agency action","Washington State Department of Labor & Industries","civil","","","82582","","","Washington","","","","","","USA","Arkansas","publicly traded","JBHT","freight and logistics","freight services","Contained in data obtained on May 15, 2017 in response to an open records request. ",""
"J. B. Hunt Transport, Inc.","J.B. Hunt Transport Services","$15,000,000","$0","$15,000,000","2018","20181127","employment-related offenses","wage and hour violation","","","federal","private litigation","","civil","","Central District of California","2:07-cv-8336","Gerardo Ortega et al v. J. B. Hunt Transport, Inc. et al","settlement","","","","","","","USA","Arkansas","publicly traded","JBHT","freight and logistics","freight services","https://www.law360.com/articles/1088649/jb-hunt-drivers-reach-15m-deal-in-calif-wage-suit",""
"J.B. Hunt Transport Inc.","J.B. Hunt Transport Services","$6,500,000","$0","$6,500,000","2020","20201217","employment-related offenses","wage and hour violation","","misclassification","federal","private litigation","","civil","","Central District of California","2:19cv1334","Duy Nam Ly et al v. J.B. Hunt Transport Inc. et al","settlement","","","","","","","USA","Arkansas","publicly traded","JBHT","freight and logistics","freight services","https://www.law360.com/articles/1289905/jb-hunt-transport-drivers-ink-6-5m-misclassification-deal",""
"J.B. HUNT TRANSPORT, INC.","J.B. Hunt Transport Services","$5,000","$0","$5,000","2012","20121002","safety-related offenses","workplace safety or health violation","","","federal","agency action","Occupational Safety & Health Administration","civil","","","","","","California","BUENA PARK","6800 ARTESIA BLVD.","90621","484230","484230: Specialized Freight (except Used Goods) Trucking, Long-Distance","USA","Arkansas","publicly traded","JBHT","freight and logistics","freight services","Extracted from a download of OSHA's Enforcment Data downloaded on 3/02/2022, available at https://enforcedata.dol.gov/views/data_catalogs.php",""
"J.B. HUNT TRANSPORT INC","J.B. Hunt Transport Services","$5,000","$0","$5,000","2012","20121210","safety-related offenses","workplace safety or health violation","","","federal","agency action","Occupational Safety & Health Administration","civil","","","","","","California","REDLANDS","2300 W SAN BERNARDINO AVENUE","92373","488490","488490: Other Support Activities for Road Transportation","USA","Arkansas","publicly traded","JBHT","freight and logistics","freight services","Extracted from a download of OSHA's Enforcment Data downloaded on 3/02/2022, available at https://enforcedata.dol.gov/views/data_catalogs.php",""
"J. B. HUNT TRANSPORT SERVICES, INC.","J.B. Hunt Transport Services","$5,000","$0","$5,000","2013","20130913","safety-related offenses","workplace safety or health violation","","","federal","agency action","Occupational Safety & Health Administration","civil","","","","","","Pennsylvania","CARLISLE","6 LOGISTICS DRIVE","17013","488510","488510: Freight Transportation Arrangement","USA","Arkansas","publicly traded","JBHT","freight and logistics","freight services","Extracted from a download of OSHA's Enforcment Data downloaded on 3/02/2022, available at https://enforcedata.dol.gov/views/data_catalogs.php",""
"J B HUNT","J.B. Hunt Transport Services","$9,000","$0","$9,000","2014","20140219","safety-related offenses","workplace safety or health violation","","","federal","agency action","Occupational Safety & Health Administration","civil","","","","","","Texas","SAN MARCOS","1811 MEDICAL PARKWAY","78666","484110","484110: General Freight Trucking, Local","USA","Arkansas","publicly traded","JBHT","freight and logistics","freight services","Extracted from a download of OSHA's Enforcment Data downloaded on 3/02/2022, available at https://enforcedata.dol.gov/views/data_catalogs.php",""
"JB HUNT TRANSPORTATION","J.B. Hunt Transport Services","$7,935","$0","$7,935","2015","20151120","safety-related offenses","workplace safety or health violation","","","federal","agency action","Occupational Safety & Health Administration","civil","","","","","","California","RIVERSIDE","1500 E. RIDGE AVENUE","92507","484230","484230: Specialized Freight (except Used Goods) Trucking, Long-Distance","USA","Arkansas","publicly traded","JBHT","freight and logistics","freight services","Extracted from a download of OSHA's Enforcment Data downloaded on 3/02/2022, available at https://enforcedata.dol.gov/views/data_catalogs.php",""
"J.B. HUNT TRANSPORT INC","J.B. Hunt Transport Services","$6,500","$0","$6,500","2017","20170412","safety-related offenses","workplace safety or health violation","","","federal","agency action","Occupational Safety & Health Administration","civil","","","","","","Texas","POYNOR","AT A JOBSITE LOCATED AT: APPROXIMATELY AT CROSS STREET OF: 15703 US 175 AND MAIN ST.","75782","484121","484121: General Freight Trucking, Long-Distance, Truckload","USA","Arkansas","publicly traded","JBHT","freight and logistics","freight services","Extracted from a download of OSHA's Enforcment Data downloaded on 3/02/2022, available at https://enforcedata.dol.gov/views/data_catalogs.php",""
"J.B. HUNT TRANSPORT SERVICES, INC.","J.B. Hunt Transport Services","$10,000","$0","$10,000","2019","20190521","safety-related offenses","workplace safety or health violation","","","federal","agency action","Occupational Safety & Health Administration","civil","","","","","","New Jersey","EDISON","174 NORTHFILED AVE.","08837","493110","493110: General Warehousing and Storage","USA","Arkansas","publicly traded","JBHT","freight and logistics","freight services","Extracted from a download of OSHA's Enforcment Data downloaded on 3/02/2022, available at https://enforcedata.dol.gov/views/data_catalogs.php",""
"JB Hunt Transport Inc","J.B. Hunt Transport Services","$41,000","$0","$41,000","2015","20150115","environment-related offenses","environmental violation","","","federal","agency action","Environmental Protection Agency","civil","","","10-2015-0028","","","Washington","SUMNER","540 142ND AVE E","98390","","","USA","Arkansas","publicly traded","JBHT","freight and logistics","freight services","Extracted from a download of the EPA's Enforcement and Compliance History Online (ECHO) ICIS FE&C file downloaded on 3/02/2022, available at http://echo.epa.gov/tools/data-downloads#downloads",""
