"Company","Parent Company","Penalty Amount","Subtraction From Penalty","Penalty Amount Adjusted For Eliminating Multiple Counting","Penalty Year","Penalty Date","Offense Group","Primary Offense","Secondary Offense","Description","Level of Government","Action Type","Agency","Civil/Criminal","Prosecution Agreement","Court","Case ID","Private Litigation Case Title","Lawsuit Resolution","Facility State","City","Address","Zip","NAICS Code","NAICS Translation","HQ Country of Parent","HQ State of Parent","Ownership Structure","Parent Company Stock Ticker","Major Industry of Parent","Specific Industry of Parent","Info Source","Notes"
"John Muir Health","John Muir Health","$12,131","$0","$12,131","2007","20070831","employment-related offenses","Family and Medical Leave Act","","","federal","agency action","Labor Department Wage and Hour Division","civil","","","1489348","","","California","Walnut Creek","","94597","6221","6221: General Medical and Surgical Hospitals","USA","California","non-profit","","healthcare services","hospitals","March 7, 2017 download of a dataset posted by the Wage and Hour Division at https://enforcedata.dol.gov/views/data_summary.php","Date and year are the Findings End Date in the dataset posted by the Wage and Hour Division, which does not provide case opening or closing dates. The company name is the Legal Name provided by the dataset unless that field is blank, in which case the Trade Name is used. The dataset provides only one address and does not indicate whether it is the company headquarters address or the establishment address. The penalty amount is the total of civil monetary penalties and mandated back wages. The original dataset provides a breakdown."
"John Muir Health","John Muir Health","$340,000","$0","$340,000","2011","20110316","employment-related offenses","employment discrimination","Americans with Disabilities Act","Disabilities","federal","agency action","Equal Employment Opportunity Commission","civil","","","","","","California","","","","","","USA","California","non-profit","","healthcare services","hospitals","https://www.eeoc.gov/eeoc/newsroom/release/3-16-11b.cfm","Description field shows type of discrimination that EEOC had alleged."
"John Muir Health","John Muir Health","$550,000","$0","$550,000","2015","20150629","government-contracting-related offenses","False Claims Act and related","","","federal","agency action","U.S. Attorney-Northern District of California","civil","","","","","","California","","","","","","USA","California","non-profit","","healthcare services","hospitals","https://www.justice.gov/usao-ndca/pr/john-muir-health-agrees-pay-550000-resolve-false-claims-allegations",""
"John Muir Health","John Muir Health","$9,500,000","$0","$9,500,000","2019","20191120","employment-related offenses","wage and hour violation","","","federal","private litigation","","civil","","Northern District of California","4:17-cv-5779","Martinez V. John Muir Health","settlement","","","","","","","USA","California","non-profit","","healthcare services","hospitals","https://www.law360.com/articles/1221960/calif-health-group-s-9-5m-wage-deal-gets-final-ok",""
"JOHN MUIR HEALTH","John Muir Health","$28,125","$0","$28,125","2016","20160913","safety-related offenses","workplace safety or health violation","","","federal","agency action","Occupational Safety & Health Administration","civil","","","","","","California","WALNUT CREEK","1601 YGNACIO VALLEY ROAD","94597","622110","622110: General Medical and Surgical Hospitals","USA","California","non-profit","","healthcare services","hospitals","Extracted from a download of OSHA's Enforcment Data downloaded on 3/02/2022, available at https://enforcedata.dol.gov/views/data_catalogs.php",""
