"Company","Parent Company","Penalty Amount","Subtraction From Penalty","Penalty Amount Adjusted For Eliminating Multiple Counting","Penalty Year","Penalty Date","Offense Group","Primary Offense","Secondary Offense","Description","Level of Government","Action Type","Agency","Civil/Criminal","Prosecution Agreement","Court","Case ID","Private Litigation Case Title","Lawsuit Resolution","Facility State","City","Address","Zip","NAICS Code","NAICS Translation","HQ Country of Parent","HQ State of Parent","Ownership Structure","Parent Company Stock Ticker","Major Industry of Parent","Specific Industry of Parent","Info Source","Notes"
"SHOWA ALUMINUM CORPORATION OF AMERICA","Keihin","$8,066","$0","$8,066","2007","20070917","safety-related offenses","workplace safety or health violation","","","federal","agency action","Occupational Safety & Health Administration","civil","","","","","","Ohio","MT. STERLING","10500 O'DAY-HARRISON RD.","43143","336399","336399: All Other Motor Vehicle Parts Manufacturing","Japan","","publicly traded","","automotive parts","automotive parts","Extracted from a download of OSHA's Enforcment Data downloaded on 3/02/2022, available at https://enforcedata.dol.gov/views/data_catalogs.php",""
"SHOWA ALUMINUM CORPORATION OF AMERICA","Keihin","$28,575","$0","$28,575","2003","20030515","safety-related offenses","workplace safety or health violation","","","federal","agency action","Occupational Safety & Health Administration","civil","","","","","","Ohio","MT. STERLING","10500 O'DAY-HARRISON RD.","43143","336399","336399: All Other Motor Vehicle Parts Manufacturing","Japan","","publicly traded","","automotive parts","automotive parts","Extracted from a download of OSHA's Enforcment Data downloaded on 3/02/2022, available at https://enforcedata.dol.gov/views/data_catalogs.php",""
"KEIHIN IPT MFG INC","Keihin","$7,000","$0","$7,000","2003","20030523","environment-related offenses","environmental violation","","air pollution violation","state","agency action","Indiana Department of Environmental Management","civil","","","","","","Indiana","Greenfield","","","","","Japan","","publicly traded","","automotive parts","automotive parts","http://www.in.gov/idem/oe/cause/AO/11508-A.htm",""
"KEIHIN THERMAL TECHNOLOGY OF AMERICA","Keihin","$6,300","$0","$6,300","2015","20150608","safety-related offenses","workplace safety or health violation","","","federal","agency action","Occupational Safety & Health Administration","civil","","","","","","Ohio","MOUNT STERLING","10500 O'DAY-HARRISON ROAD","43143","423120","423120: Motor Vehicle Supplies and New Parts Merchant Wholesalers","Japan","","publicly traded","","automotive parts","automotive parts","Extracted from a download of OSHA's Enforcment Data downloaded on 3/02/2022, available at https://enforcedata.dol.gov/views/data_catalogs.php",""
"SHOWA ALUMINUM CORPORATION OF AMERICA","Keihin","$8,190","$0","$8,190","2015","20150619","safety-related offenses","workplace safety or health violation","","","federal","agency action","Occupational Safety & Health Administration","civil","","","","","","Ohio","MOUNT STERLING","10500 O'DAY-HARRISON ROAD","43143","423120","423120: Motor Vehicle Supplies and New Parts Merchant Wholesalers","Japan","","publicly traded","","automotive parts","automotive parts","Extracted from a download of OSHA's Enforcment Data downloaded on 3/02/2022, available at https://enforcedata.dol.gov/views/data_catalogs.php",""
"SHOWA ALUMINUM CORPORATION","Keihin","$5,000","$0","$5,000","2000","20001102","environment-related offenses","environmental violation","","","federal","agency action","Environmental Protection Agency","civil","","","05-2001-0153","","","","","","","","","Japan","","publicly traded","","automotive parts","automotive parts","Extracted from a download of the EPA's Enforcement and Compliance History Online (ECHO) ICIS FE&C file downloaded on 3/02/2022, available at http://echo.epa.gov/tools/data-downloads#downloads",""
