"Company","Parent Company","Penalty Amount","Subtraction From Penalty","Penalty Amount Adjusted For Eliminating Multiple Counting","Penalty Year","Penalty Date","Offense Group","Primary Offense","Secondary Offense","Description","Level of Government","Action Type","Agency","Civil/Criminal","Prosecution Agreement","Court","Case ID","Private Litigation Case Title","Lawsuit Resolution","Facility State","City","Address","Zip","NAICS Code","NAICS Translation","HQ Country of Parent","HQ State of Parent","Ownership Structure","Parent Company Stock Ticker","Major Industry of Parent","Specific Industry of Parent","Info Source","Notes"
"Letourneau Technologies Drilling Systems Inc","Keppel","$27,899","$0","$27,899","2010","20100108","employment-related offenses","wage and hour violation","Fair Labor Standards Act","","federal","agency action","Labor Department Wage and Hour Division","civil","","","1545979","","","Texas","Houston","","77041","213112","213112: Support Activities for Oil and Gas Operations","Singapore","","publicly traded","","diversified","diversified","March 7, 2017 download of a dataset posted by the Wage and Hour Division at https://enforcedata.dol.gov/views/data_summary.php","Date and year are the Findings End Date in the dataset posted by the Wage and Hour Division, which does not provide case opening or closing dates. The company name is the Legal Name provided by the dataset unless that field is blank, in which case the Trade Name is used. The dataset provides only one address and does not indicate whether it is the company headquarters address or the establishment address. The penalty amount is the total of civil monetary penalties and mandated back wages. The original dataset provides a breakdown."
"Keppel Offshore & Marine Ltd.","Keppel","$105,554,245","$0","$105,554,245","2017","20171222","competition-related offenses","Foreign Corrupt Practices Act","","Keppel Offshore & Marine Ltd., a Singapore-based company that operates shipyards and repairs and upgrades shipping vessels, and its wholly owned U.S. subsidiary, Keppel Offshore & Marine U.S.A. Inc., agreed to pay a combined total penalty of more than $422 million to resolve charges with authorities in the United States, Brazil and Singapore arising out of a decade-long scheme to pay millions of dollars in bribes to officials in Brazil. The U.S. criminal penalty was $105,554,245.","federal","agency action","Justice Department Criminal Division","criminal","deferred prosecution agreement","","","","","","","","","","","Singapore","","publicly traded","","diversified","diversified","https://www.justice.gov/usao-edny/pr/keppel-offshore-marine-ltd-and-us-based-subsidiary-agree-pay-422-million-global",""
"Keppel AmFELS, L.L.C.","Keppel","$7,626","$0","$7,626","2020","20200220","employment-related offenses","labor relations violation","","","federal","agency action","National Labor Relations Board","civil","","","16-CA-242088","","","Texas","Brownsville","","","","","Singapore","","publicly traded","","diversified","diversified","Extracted from a spreadsheet obtained from the NLRB through a Freedom of Information Act request fulfilled on 5/28/2020.",""
"KEPPEL AMFELS, INC.","Keppel","$9,100","$0","$9,100","2011","20110310","safety-related offenses","workplace safety or health violation","","","federal","agency action","Occupational Safety & Health Administration","civil","","","","","","Texas","BROWNSVILLE","20000 STATE HWY 48","78523","336611","336611: Ship Building and Repairing","Singapore","","publicly traded","","diversified","diversified","Extracted from a download of OSHA's Enforcment Data downloaded on 3/02/2022, available at https://enforcedata.dol.gov/views/data_catalogs.php",""
"KEPPEL AMFELS, L.L.C.","Keppel","$6,734","$0","$6,734","2016","20160613","safety-related offenses","workplace safety or health violation","","","federal","agency action","Occupational Safety & Health Administration","civil","","","","","","Texas","BROWNSVILLE","20000 STATE HIGHWAY 48","78523","336611","336611: Ship Building and Repairing","Singapore","","publicly traded","","diversified","diversified","Extracted from a download of OSHA's Enforcment Data downloaded on 3/02/2022, available at https://enforcedata.dol.gov/views/data_catalogs.php",""
