"Company","Parent Company","Penalty Amount","Subtraction From Penalty","Penalty Amount Adjusted For Eliminating Multiple Counting","Penalty Year","Penalty Date","Offense Group","Primary Offense","Secondary Offense","Description","Level of Government","Action Type","Agency","Civil/Criminal","Prosecution Agreement","Court","Case ID","Private Litigation Case Title","Lawsuit Resolution","Facility State","City","Address","Zip","NAICS Code","NAICS Translation","HQ Country of Parent","HQ State of Parent","Ownership Structure","Parent Company Stock Ticker","Major Industry of Parent","Specific Industry of Parent","Info Source","Notes"
"Almost Family Inc","LHC Group","$17,767","$0","$17,767","2016","20160519","employment-related offenses","wage and hour violation","Fair Labor Standards Act","","federal","agency action","Labor Department Wage and Hour Division","civil","","","1782030","","","Kentucky","Louisville","","40218","621610","621610: Home Health Care Services","USA","Louisiana","publicly traded","LHCG","healthcare services","healthcare services","March 7, 2017 download of a dataset posted by the Wage and Hour Division at https://enforcedata.dol.gov/views/data_summary.php","Date and year are the Findings End Date in the dataset posted by the Wage and Hour Division, which does not provide case opening or closing dates. The company name is the Legal Name provided by the dataset unless that field is blank, in which case the Trade Name is used. The dataset provides only one address and does not indicate whether it is the company headquarters address or the establishment address. The penalty amount is the total of civil monetary penalties and mandated back wages. The original dataset provides a breakdown."
"Cambridge Home Health Care, Inc.","LHC Group","$10,130","$0","$10,130","2011","20110926","employment-related offenses","wage and hour violation","Fair Labor Standards Act","","federal","agency action","Labor Department Wage and Hour Division","civil","","","1610207","","","Ohio","Marietta","","45750","62412","62412: Services for the Elderly and Persons with Disabilities","USA","Louisiana","publicly traded","LHCG","healthcare services","healthcare services","March 7, 2017 download of a dataset posted by the Wage and Hour Division at https://enforcedata.dol.gov/views/data_summary.php","Date and year are the Findings End Date in the dataset posted by the Wage and Hour Division, which does not provide case opening or closing dates. The company name is the Legal Name provided by the dataset unless that field is blank, in which case the Trade Name is used. The dataset provides only one address and does not indicate whether it is the company headquarters address or the establishment address. The penalty amount is the total of civil monetary penalties and mandated back wages. The original dataset provides a breakdown."
"LHC Group Inc.","LHC Group","$65,000,000","$0","$65,000,000","2011","20110930","government-contracting-related offenses","False Claims Act and related","","LHC Group Inc. agreed to pay $65 million, plus interest, to the federal government to resolve allegations that it violated the False Claims Act for false home healthcare billings to the Medicare, TRICARE and Federal Employees Health Benefits programs. The company also agreed to be bound by the terms of a Corporate Integrity Agreement with the Department of Health and Human Services Office of Inspector General. ","federal","agency action","Justice Department Civil Division","civil","","","","","","","","","","","","USA","Louisiana","publicly traded","LHCG","healthcare services","healthcare services","https://www.justice.gov/opa/pr/louisiana-based-lhc-group-inc-agrees-pay-us-65-million-resolve-false-claims-act-allegations",""
"LHC Group, Inc.","LHC Group","$47,832","$0","$47,832","2009","20091010","employment-related offenses","wage and hour violation","Fair Labor Standards Act","","federal","agency action","Labor Department Wage and Hour Division","civil","","","1542625","","","Missouri","Springfield","","65804","621610","621610: Home Health Care Services","USA","Louisiana","publicly traded","LHCG","healthcare services","healthcare services","March 7, 2017 download of a dataset posted by the Wage and Hour Division at https://enforcedata.dol.gov/views/data_summary.php","Date and year are the Findings End Date in the dataset posted by the Wage and Hour Division, which does not provide case opening or closing dates. The company name is the Legal Name provided by the dataset unless that field is blank, in which case the Trade Name is used. The dataset provides only one address and does not indicate whether it is the company headquarters address or the establishment address. The penalty amount is the total of civil monetary penalties and mandated back wages. The original dataset provides a breakdown."
"ALMOST FAMILY INC","LHC Group","$20,000","$0","$20,000","2002","20021010","employment-related offenses","wage and hour violation","","overtime violation","state","agency action","Kentucky Department of Workplace Standards","civil","","","3403723","","","Kentucky","","","","","","USA","Louisiana","publicly traded","LHCG","healthcare services","healthcare services","Contained in data obtained on April 11, 2017 in response to an open records request. ",""
"ALMOST FAMILY INC.","LHC Group","$5,772","$0","$5,772","2017","20170410","safety-related offenses","workplace safety or health violation","","","federal","agency action","Occupational Safety & Health Administration","civil","","","","","","New York","OLEAN","2211 WEST STATE STREET","14760","621610","621610: Home Health Care Services","USA","Louisiana","publicly traded","LHCG","healthcare services","healthcare services","Extracted from a download of OSHA's Enforcment Data downloaded on 3/02/2022, available at https://enforcedata.dol.gov/views/data_catalogs.php",""
