"Company","Parent Company","Penalty Amount","Subtraction From Penalty","Penalty Amount Adjusted For Eliminating Multiple Counting","Penalty Year","Penalty Date","Offense Group","Primary Offense","Secondary Offense","Description","Level of Government","Action Type","Agency","Civil/Criminal","Prosecution Agreement","Court","Case ID","Private Litigation Case Title","Lawsuit Resolution","Facility State","City","Address","Zip","NAICS Code","NAICS Translation","HQ Country of Parent","HQ State of Parent","Ownership Structure","Parent Company Stock Ticker","Major Industry of Parent","Specific Industry of Parent","Info Source","Notes"
"THE L. S. STARRETT COMPANY","L.S. Starrett Co.","$8,000","$0","$8,000","2000","20000613","safety-related offenses","workplace safety or health violation","","","federal","agency action","Occupational Safety & Health Administration","civil","","","","","","North Carolina","MT. AIRY","1372 BOGGS DR.","27030","000000","","USA","Massachusetts","publicly traded","NYSE: SCX","industrial equipment","industrial equipment","Extracted from a download of OSHA's Enforcment Data downloaded on 3/02/2022, available at https://enforcedata.dol.gov/views/data_catalogs.php",""
"THE L.S. STARRETT COMPANY","L.S. Starrett Co.","$8,500","$0","$8,500","2015","20151125","safety-related offenses","workplace safety or health violation","","","federal","agency action","Occupational Safety & Health Administration","civil","","","","","","Massachusetts","ATHOL","121 CRESCENT STREET","01331","332216","332216: Saw Blade and Handtool Manufacturing","USA","Massachusetts","publicly traded","NYSE: SCX","industrial equipment","industrial equipment","Extracted from a download of OSHA's Enforcment Data downloaded on 3/02/2022, available at https://enforcedata.dol.gov/views/data_catalogs.php",""
"L. S. STARRETT COMPANY, THE","L.S. Starrett Co.","$6,300","$0","$6,300","2016","20160712","safety-related offenses","workplace safety or health violation","","","federal","agency action","Occupational Safety & Health Administration","civil","","","","","","Massachusetts","ATHOL","121 CRESCENT ST","01331","332213","332213: Saw Blade and Handsaw Manufacturing","USA","Massachusetts","publicly traded","NYSE: SCX","industrial equipment","industrial equipment","Extracted from a download of OSHA's Enforcment Data downloaded on 3/02/2022, available at https://enforcedata.dol.gov/views/data_catalogs.php",""
"THE L.S. STARRETT COMPANY","L.S. Starrett Co.","$21,482","$0","$21,482","2019","20190711","safety-related offenses","workplace safety or health violation","","","federal","agency action","Occupational Safety & Health Administration","civil","","","","","","Massachusetts","ATHOL","121 CRESCENT STREET","01331","332216","332216: Saw Blade and Handtool Manufacturing","USA","Massachusetts","publicly traded","NYSE: SCX","industrial equipment","industrial equipment","Extracted from a download of OSHA's Enforcment Data downloaded on 3/02/2022, available at https://enforcedata.dol.gov/views/data_catalogs.php",""
"L S STARRETT","L.S. Starrett Co.","$5,400","$0","$5,400","2014","20140415","environment-related offenses","environmental violation","","","federal","agency action","Environmental Protection Agency","civil","","","01-2014-2505","","","","","","","","","USA","Massachusetts","publicly traded","NYSE: SCX","industrial equipment","industrial equipment","Extracted from a download of the EPA's Enforcement and Compliance History Online (ECHO) ICIS FE&C file downloaded on 3/02/2022, available at http://echo.epa.gov/tools/data-downloads#downloads",""
