"Company","Parent Company","Penalty Amount","Subtraction From Penalty","Penalty Amount Adjusted For Eliminating Multiple Counting","Penalty Year","Penalty Date","Offense Group","Primary Offense","Secondary Offense","Description","Level of Government","Action Type","Agency","Civil/Criminal","Prosecution Agreement","Court","Case ID","Private Litigation Case Title","Lawsuit Resolution","Facility State","City","Address","Zip","NAICS Code","NAICS Translation","HQ Country of Parent","HQ State of Parent","Ownership Structure","Parent Company Stock Ticker","Major Industry of Parent","Specific Industry of Parent","Info Source","Notes"
"Lyft","Lyft Inc.","$1,950,000","$0","$1,950,000","2018","20180328","employment-related offenses","wage and hour violation","","","federal","private litigation","","civil","","Northern District of California","16-cv-2558","Zamora et al v. Lyft, Inc.","settlement","","","","","","","USA","California","privately held","","miscellaneous services","transportation services","https://www.law360.com/employment/articles/1027806/lyft-settles-calif-drivers-premium-fare-suit-for-1-95m",""
"Lyft","Lyft Inc.","$27,000,000","$0","$27,000,000","2017","20170316","employment-related offenses","wage and hour violation","","misclassification","federal","private litigation","","civil","","Northern District of California","13-cv-4065","Cotter v. Lyft, Inc.","settlement","","","","","","","USA","California","privately held","","miscellaneous services","transportation services","13-9 Mealey's Litig. Rep. Employ. L. 8 (2017)",""
"Lyft","Lyft Inc.","$300,000","$0","$300,000","2015","20150618","consumer-protection-related offenses","consumer protection violation","","","state","agency action","New York Attorney General","civil","","","","","","New York","","","","","","USA","California","privately held","","miscellaneous services","transportation services","https://web.archive.org/web/20171204195040/https://ag.ny.gov/press-release/ag-schneiderman-announces-joint-settlement-lyft",""
"Lyft, Inc.","Lyft Inc.","$250,000","$0","$250,000","2014","20141209","consumer-protection-related offenses","consumer protection violation","false advertising","Lyft agreed to pay a total of $500,000 ($250,000 suspended on condition of complying with settlement conditions within a year) to Los Angeles County and San Francisco County in settlement of allegations it made false and misleading statements to customers concerning its drivers' background checks, that it failed to get approval from state authorities that the measurements in its phone application were accurate, and that it failed to get authorization to operate at California airports.","local","agency action","California Multi-Jurisdiction Case","civil","","","","","settlement","California","","","","","","USA","California","privately held","","miscellaneous services","transportation services","http://da.lacounty.gov/media/news/san-francisco-and-los-angeles-county-das-announce-settlement-lyft-filing-against-uber",""
"Lyft, Inc.","Lyft Inc.","$40,000","$0","$40,000","2020","20200622","consumer-protection-related offenses","Americans with Disabilities Act","","","federal","agency action","U.S. Attorney-Central District of California","civil","","","","","","","","","","","","USA","California","privately held","","miscellaneous services","transportation services","https://www.justice.gov/usao-cdca/pr/lyft-agrees-resolve-allegations-it-violated-federal-law-when-its-drivers-denied-rides",""
