"Company","Parent Company","Penalty Amount","Subtraction From Penalty","Penalty Amount Adjusted For Eliminating Multiple Counting","Penalty Year","Penalty Date","Offense Group","Primary Offense","Secondary Offense","Description","Level of Government","Action Type","Agency","Civil/Criminal","Prosecution Agreement","Court","Case ID","Private Litigation Case Title","Lawsuit Resolution","Facility State","City","Address","Zip","NAICS Code","NAICS Translation","HQ Country of Parent","HQ State of Parent","Ownership Structure","Parent Company Stock Ticker","Major Industry of Parent","Specific Industry of Parent","Info Source","Notes"
"McLaren Greater Lansing","McLaren Health Care","$40,000","$0","$40,000","2014","20141027","employment-related offenses","labor relations violation","","back pay award in unfair labor practices case","federal","agency action","National Labor Relations Board","civil","","","07-CA-128214","","","Michigan","Lansing","","","","","USA","Michigan","non-profit","","healthcare services","hospitals","Extracted from a spreadsheet obtained from the NLRB through a Freedom of Information Act request fulfilled on 5/16/2017.",""
"McLaren Health Care Corporation","McLaren Health Care","$3,425,000","$0","$3,425,000","2015","20151030","government-contracting-related offenses","False Claims Act and related","","The Department of Justice reached 70 settlements involving 457 hospitals in 43 states for more than $250 million related to cardiac devices that were implanted in Medicare patients in violation of Medicare coverage requirements.","federal","agency action","Justice Department Civil Division","civil","","","","","","","","","","","","USA","Michigan","non-profit","","healthcare services","hospitals","https://www.justice.gov/opa/pr/nearly-500-hospitals-pay-united-states-more-250-million-resolve-false-claims-act-allegations",""
"MCLAREN REGIONAL MEDICAL CTR","McLaren Health Care","$8,250","$0","$8,250","2004","20040615","safety-related offenses","workplace safety or health violation","","","federal","agency action","Occupational Safety & Health Administration","civil","","","","","","Michigan","FLINT","401 S BALLENGER HWY","48532","622110","622110: General Medical and Surgical Hospitals","USA","Michigan","non-profit","","healthcare services","hospitals","Extracted from a download of OSHA's Enforcment Data downloaded on 3/02/2022, available at https://enforcedata.dol.gov/views/data_catalogs.php",""
"McLaren Health Care","McLaren Health Care","$2,036,791","$0","$2,036,791","2013","20131024","employment-related offenses","wage and hour violation","","","federal","private litigation","","civil","","Eastern District of Michigan","06-cv-15601","Cason-Merendo et al v. VHS of Michigan, Inc. et al","settlement","","","","","","","USA","Michigan","non-profit","","healthcare services","hospitals","https://www.law360.com/articles/353360/mich-hospital-pays-2m-to-settle-wage-fixing-claims","This case, which was brought as an antitrust action, accused various Detroit-area hospitals of conspiring to depress the wages of nurses."
"McLaren Health Care Corporation","McLaren Health Care","$7,750,000","$0","$7,750,000","2021","20210119","healthcare-related offenses","Controlled Substances Act violation","","drug diversion","federal","agency action","U.S. Attorney-Western District of Michigan","civil","","","","","","","","","","","","USA","Michigan","non-profit","","healthcare services","hospitals","https://www.justice.gov/usao-wdmi/pr/2021_0119_MHCC",""
"MCLAREN BAY REGION","McLaren Health Care","$9,000","$0","$9,000","2019","20190612","safety-related offenses","workplace safety or health violation","","","federal","agency action","Occupational Safety & Health Administration","civil","","","","","","Michigan","BAY CITY","1900 COLUMBUS","48706","622110","622110: General Medical and Surgical Hospitals","USA","Michigan","non-profit","","healthcare services","hospitals","Extracted from a download of OSHA's Enforcment Data downloaded on 3/02/2022, available at https://enforcedata.dol.gov/views/data_catalogs.php",""
