"Company","Parent Company","Penalty Amount","Subtraction From Penalty","Penalty Amount Adjusted For Eliminating Multiple Counting","Penalty Year","Penalty Date","Offense Group","Primary Offense","Secondary Offense","Description","Level of Government","Action Type","Agency","Civil/Criminal","Prosecution Agreement","Court","Case ID","Private Litigation Case Title","Lawsuit Resolution","Facility State","City","Address","Zip","NAICS Code","NAICS Translation","HQ Country of Parent","HQ State of Parent","Ownership Structure","Parent Company Stock Ticker","Major Industry of Parent","Specific Industry of Parent","Info Source","Notes"
"Meggitt, Aircraft Braking Systems Corporation","Meggitt","$15,000","$0","$15,000","2010","20100504","employment-related offenses","labor relations violation","","back pay award in unfair labor practices case","federal","agency action","National Labor Relations Board","civil","","","08-CA-38103-001","","","Ohio","Akron","","44306","532411","532411: Commercial Air, Rail, and Water Transportation Equipment Rental and Leasing","United Kingdom","","publicly traded","LSE: MGGT","aerospace and military contracting","aerospace & military contracting","Extracted from an NLRB dataset covering 1999-2011 downloaded at https://catalog.data.gov/dataset/nlrb-cats-final-c-case-data-bulk-19990101-20110930-in-xml",""
"Meggitt-USA, Inc.","Meggitt","$25,000,000","$0","$25,000,000","2013","20130823","competition-related offenses","export control violation","","","federal","agency action","State Department Directorate of Defense Trade Controls","civil","","","","","","","","","","","","United Kingdom","","publicly traded","LSE: MGGT","aerospace and military contracting","aerospace & military contracting","https://www.pmddtc.state.gov/sys_attachment.do?sysparm_referring_url=tear_off&view=true&sys_id=9dfd7a89db99db0044f9ff621f9619dd",""
"SECURAPLANE TECHNOLOGIES LLC","Meggitt","$42,570","$0","$42,570","2011","20111130","safety-related offenses","aviation safety violation","","DRUG TESTING ","federal","agency action","Federal Aviation Administration","civil","","","","","","","","","","","","United Kingdom","","publicly traded","LSE: MGGT","aerospace and military contracting","aerospace & military contracting","https://www.faa.gov/about/office_org/headquarters_offices/agc/practice_areas/enforcement/reports/",""
"SECURAPLANE TECHNOLOGIES LLC","Meggitt","$10,000","$0","$10,000","2015","20150527","safety-related offenses","aviation safety violation","","DRUG TESTING","federal","agency action","Federal Aviation Administration","civil","","","","","","","","","","","","United Kingdom","","publicly traded","LSE: MGGT","aerospace and military contracting","aerospace & military contracting","https://www.faa.gov/about/office_org/headquarters_offices/agc/practice_areas/enforcement/reports/",""
"PACIFIC SCIENTIFIC","Meggitt","$14,500","$0","$14,500","2003","20030410","safety-related offenses","workplace safety or health violation","","","federal","agency action","Occupational Safety & Health Administration","civil","","","","","","Arizona","CHANDLER","7073 WEST WILLIS RD. LONE BUTTE IND. PARK","85226","311942","311942: Spice and Extract Manufacturing","United Kingdom","","publicly traded","LSE: MGGT","aerospace and military contracting","aerospace & military contracting","Extracted from a download of OSHA's Enforcment Data downloaded on 3/02/2022, available at https://enforcedata.dol.gov/views/data_catalogs.php",""
"MEGGITT NORTH HOLLYWOOD INC","Meggitt","$8,750","$0","$8,750","2018","20180912","safety-related offenses","aviation safety violation","","DRUG TESTING","federal","agency action","Federal Aviation Administration","civil","","","2018WP910025","","","","","","","","","United Kingdom","","publicly traded","LSE: MGGT","aerospace and military contracting","aerospace & military contracting","https://www.faa.gov/about/office_org/headquarters_offices/agc/practice_areas/enforcement/reports/",""
"MEGGITT INC","Meggitt","$5,250","$0","$5,250","2015","20150730","safety-related offenses","workplace safety or health violation","","","federal","agency action","Occupational Safety & Health Administration","civil","","","","","","Indiana","TROY","3 INDUSTRIAL DRIVE","47588","336411","336411: Aircraft Manufacturing","United Kingdom","","publicly traded","LSE: MGGT","aerospace and military contracting","aerospace & military contracting","Extracted from a download of OSHA's Enforcment Data downloaded on 3/02/2022, available at https://enforcedata.dol.gov/views/data_catalogs.php",""
"MEGGITT SAFETY SYSTEMS, INC","Meggitt","$5,935","$0","$5,935","2021","20210129","safety-related offenses","workplace safety or health violation","","","federal","agency action","Occupational Safety & Health Administration","civil","","","","","","California","SIMI VALLEY","1915 VOYAGER AVE.","93063","423690","423690: Other Electronic Parts and Equipment Merchant Wholesalers","United Kingdom","","publicly traded","LSE: MGGT","aerospace and military contracting","aerospace & military contracting","Extracted from a download of OSHA's Enforcment Data downloaded on 3/02/2022, available at https://enforcedata.dol.gov/views/data_catalogs.php",""
