"Company","Parent Company","Penalty Amount","Subtraction From Penalty","Penalty Amount Adjusted For Eliminating Multiple Counting","Penalty Year","Penalty Date","Offense Group","Primary Offense","Secondary Offense","Description","Level of Government","Action Type","Agency","Civil/Criminal","Prosecution Agreement","Court","Case ID","Private Litigation Case Title","Lawsuit Resolution","Facility State","City","Address","Zip","NAICS Code","NAICS Translation","HQ Country of Parent","HQ State of Parent","Ownership Structure","Parent Company Stock Ticker","Major Industry of Parent","Specific Industry of Parent","Info Source","Notes"
"Andover Healthcare","Milliken","$215,340","$0","$215,340","2010","20100521","environment-related offenses","environmental violation","","A Salisbury, Mass.-based company that makes bandages and tape for athletic and medical purposes has agreed to pay $215,340 to settle environmental claims by the U.S. Environmental Protection Agency.","federal","agency action","Environmental Protection Agency","civil","","","","","","Massachusetts","Salisbury","","","","","USA","South Carolina","privately held","","miscellaneous manufacturing","textiles","https://archive.epa.gov/epapages/newsroom_archive/newsreleases/6946725888db03d88525772a0050b96d.html",""
"Milliken & Company","Milliken","$7,500","$0","$7,500","2002","20020918","environment-related offenses","environmental violation","","Air Quality Act","state","agency action","Georgia Environmental Protection Division","civil","","","EPD-AQC-3281","","","Georgia","","","","","","USA","South Carolina","privately held","","miscellaneous manufacturing","textiles","Contained in a spreadsheet obtained from the agency on October 7, 2020 in response to an open records request. The spreadsheet contains cases from the enforcement database accessible at https://enfo.gaepd.org/Orders/Search",""
"MILLIKEN & COMPANY (PENDLETON PLANT)","Milliken","$6,800","$0","$6,800","2011","20110916","environment-related offenses","environmental violation","","air quality violation","state","agency action","South Carolina Department of Health and Environmental Control","civil","","","11-046-A","","","South Carolina","","","","","","USA","South Carolina","privately held","","miscellaneous manufacturing","textiles","Contained in data received from the agency on October 22, 2020 in response to an open records request.",""
"SPRINGFIELD, LLC","Milliken","$6,000","$0","$6,000","2002","20020620","environment-related offenses","environmental violation","","air quality violation","state","agency action","South Carolina Department of Health and Environmental Control","civil","","","02-061-A","","","South Carolina","","","","","","USA","South Carolina","privately held","","miscellaneous manufacturing","textiles","Contained in data received from the agency on October 22, 2020 in response to an open records request.",""
"ANDOVER HEALTHCARE, INC.","Milliken","$54,684","$0","$54,684","2014","20140109","safety-related offenses","workplace safety or health violation","","","federal","agency action","Occupational Safety & Health Administration","civil","","","","","","Massachusetts","SALISBURY","9 FANARAS DRIVE","01952","313320","313320: Fabric Coating Mills","USA","South Carolina","privately held","","miscellaneous manufacturing","textiles","Extracted from a download of OSHA's Enforcment Data downloaded on 3/02/2022, available at https://enforcedata.dol.gov/views/data_catalogs.php",""
"MILLIKEN & COMPANY","Milliken","$12,471","$0","$12,471","2016","20160823","safety-related offenses","workplace safety or health violation","","","federal","agency action","Occupational Safety & Health Administration","civil","","","","","","Georgia","NICHOLLS","2410 GEORGIA HIGHWAY 32 WEST","31554","313310","313310: Textile and Fabric Finishing Mills","USA","South Carolina","privately held","","miscellaneous manufacturing","textiles","Extracted from a download of OSHA's Enforcment Data downloaded on 3/02/2022, available at https://enforcedata.dol.gov/views/data_catalogs.php",""
"MILLIKEN & COMPANY","Milliken","$9,446","$0","$9,446","2019","20191230","safety-related offenses","workplace safety or health violation","","","federal","agency action","Occupational Safety & Health Administration","civil","","","","","","Georgia","GAINESVILLE","1750 JESSE JEWELL PARKWAY","30501","314999","314999: All Other Miscellaneous Textile Product Mills","USA","South Carolina","privately held","","miscellaneous manufacturing","textiles","Extracted from a download of OSHA's Enforcment Data downloaded on 3/02/2022, available at https://enforcedata.dol.gov/views/data_catalogs.php",""
"MILLIKEN & COMPANY, INC.","Milliken","$31,432","$0","$31,432","2008","20080703","environment-related offenses","environmental violation","","","federal","agency action","Environmental Protection Agency","civil","","","04-2008-2039","","","South Carolina","INMAN","1440 CAMPTON RD.","29349","325998","325998: All Other Miscellaneous Chemical Product and Preparation Manufacturing","USA","South Carolina","privately held","","miscellaneous manufacturing","textiles","Extracted from a download of the EPA's Enforcement and Compliance History Online (ECHO) ICIS FE&C file downloaded on 3/02/2022, available at http://echo.epa.gov/tools/data-downloads#downloads",""
