"Company","Parent Company","Penalty Amount","Subtraction From Penalty","Penalty Amount Adjusted For Eliminating Multiple Counting","Penalty Year","Penalty Date","Offense Group","Primary Offense","Secondary Offense","Description","Level of Government","Action Type","Agency","Civil/Criminal","Prosecution Agreement","Court","Case ID","Private Litigation Case Title","Lawsuit Resolution","Facility State","City","Address","Zip","NAICS Code","NAICS Translation","HQ Country of Parent","HQ State of Parent","Ownership Structure","Parent Company Stock Ticker","Major Industry of Parent","Specific Industry of Parent","Info Source","Notes"
"Penn A Kem","Minafin","$10,000","$0","$10,000","2016","20160415","safety-related offenses","railroad safety violation","","","federal","agency action","Federal Railroad Administration","civil","","","","","","","","","","","","France","","privately held","","chemicals","chemicals","https://www.fra.dot.gov/Elib/Document/16831","Year is fiscal year."
"Penn A Kem","Minafin","$7,500","$0","$7,500","2011","20111110","safety-related offenses","railroad safety violation","","","federal","agency action","Federal Railroad Administration","civil","","","","","","","","","","","","France","","privately held","","chemicals","chemicals","https://www.fra.dot.gov/eLib/details/L04190#p1_z5_gD_lEA",""
"PENNAKEM LLC","Minafin","$16,000","$0","$16,000","2008","20080805","safety-related offenses","workplace safety or health violation","","","federal","agency action","Occupational Safety & Health Administration","civil","","","","","","Tennessee","MEMPHIS","3324 CHELSEA AVENUE","38108","325320","325320: Pesticide and Other Agricultural Chemical Manufacturing","France","","privately held","","chemicals","chemicals","Extracted from a download of OSHA's Enforcment Data downloaded on 3/02/2022, available at https://enforcedata.dol.gov/views/data_catalogs.php",""
"PennAKem, LLC","Minafin","$10,084","$0","$10,084","2020","20200214","environment-related offenses","environmental violation","","solid waste violation","state","agency action","Tennessee Department of Environment & Conservation","civil","","","HWM19-0026","","","Tennessee","","","","","","France","","privately held","","chemicals","chemicals","Contained in data received from the agency on January 25, 2021 in response to an open records request. The data was a spreadsheet compilation of information in the search engine at http://tdec.tn.gov:8080/pls/enf_reports/f?p=9001:710::::::",""
"PennAKem, LLC","Minafin","$9,914","$0","$9,914","2016","20160628","environment-related offenses","environmental violation","","solid waste violation","state","agency action","Tennessee Department of Environment & Conservation","civil","","","HWM15-0017","","","Tennessee","","","","","","France","","privately held","","chemicals","chemicals","Contained in data received from the agency on January 25, 2021 in response to an open records request. The data was a spreadsheet compilation of information in the search engine at http://tdec.tn.gov:8080/pls/enf_reports/f?p=9001:710::::::",""
"PENNAKEM LLC","Minafin","$36,750","$0","$36,750","2012","20120924","safety-related offenses","workplace safety or health violation","","","federal","agency action","Occupational Safety & Health Administration","civil","","","","","","Tennessee","MEMPHIS","3324 CHELSEA AVENUE","38108","325320","325320: Pesticide and Other Agricultural Chemical Manufacturing","France","","privately held","","chemicals","chemicals","Extracted from a download of OSHA's Enforcment Data downloaded on 3/02/2022, available at https://enforcedata.dol.gov/views/data_catalogs.php",""
"PENN A KEM, LLC","Minafin","$64,185","$0","$64,185","2008","20080827","environment-related offenses","environmental violation","","","federal","agency action","Environmental Protection Agency","civil","","","04-2008-2534","","","Tennessee","MEMPHIS","3324 CHELSEA AVENUE","38108-0035","325199","325199: All Other Basic Organic Chemical Manufacturing","France","","privately held","","chemicals","chemicals","Extracted from a download of the EPA's Enforcement and Compliance History Online (ECHO) ICIS FE&C file downloaded on 3/02/2022, available at http://echo.epa.gov/tools/data-downloads#downloads",""
"PEENAKEM LLC","Minafin","$22,463","$0","$22,463","2010","20100802","environment-related offenses","environmental violation","","","federal","agency action","Environmental Protection Agency","civil","","","04-2010-1532","","","Tennessee","MEMPHIS","3324 CHELSEA AVENUE","38108-1909","325199","325199: All Other Basic Organic Chemical Manufacturing","France","","privately held","","chemicals","chemicals","Extracted from a download of the EPA's Enforcement and Compliance History Online (ECHO) ICIS FE&C file downloaded on 3/02/2022, available at http://echo.epa.gov/tools/data-downloads#downloads",""
