"Company","Parent Company","Penalty Amount","Subtraction From Penalty","Penalty Amount Adjusted For Eliminating Multiple Counting","Penalty Year","Penalty Date","Offense Group","Primary Offense","Secondary Offense","Description","Level of Government","Action Type","Agency","Civil/Criminal","Prosecution Agreement","Court","Case ID","Private Litigation Case Title","Lawsuit Resolution","Facility State","City","Address","Zip","NAICS Code","NAICS Translation","HQ Country of Parent","HQ State of Parent","Ownership Structure","Parent Company Stock Ticker","Major Industry of Parent","Specific Industry of Parent","Info Source","Notes"
"Modine Manufacturing Company","Modine Manufacturing","$14,000","$0","$14,000","2007","20070306","employment-related offenses","labor relations violation","","back pay award in unfair labor practices case","federal","agency action","National Labor Relations Board","civil","","","10-CA-36080-001","","","Tennessee","Clinton","","37716","336399","336399: All Other Motor Vehicle Parts Manufacturing","USA","Wisconsin","publicly traded","MOD","automotive parts","automotive parts","Extracted from an NLRB dataset covering 1999-2011 downloaded at https://catalog.data.gov/dataset/nlrb-cats-final-c-case-data-bulk-19990101-20110930-in-xml",""
"Modine Mfg Co","Modine Manufacturing","$9,000","$0","$9,000","2013","20130916","safety-related offenses","motor vehicle safety violation","","","federal","agency action","Federal Motor Carrier Safety Administration","civil","","","","","","Wisconsin","RACINE","","","","","USA","Wisconsin","publicly traded","MOD","automotive parts","automotive parts","https://www.fmcsa.dot.gov/regulations/enforcement/national-listing-enforcement-cases-subject-name-closed-fiscal-year-2013-pdf",""
"Modine Manufacturing","Modine Manufacturing","$2,000,000","$0","$2,000,000","2008","20080826","environment-related offenses","environmental violation","","Modine Manufacturing agreed to pay $2 million to settle its role in lawsuits alleging that its plant in Ringwood, Illinois released wastewater that degraded to form vinyl chloride, which caused brain cancers in some nearby residents.","federal","private litigation","","civil","","Eastern District of Pennsylvania","2:06cv1743"," Gates et al. v. Rohm and Haas Co., Morton International and Modine Manufacturing","settlement","Illinois","","","","","","USA","Wisconsin","publicly traded","MOD","automotive parts","automotive parts","https://www.law360.com/articles/45770/manufacturer-agrees-to-settle-cancer-cluster-case",""
"MODINE MANUFACTURING COMPANY","Modine Manufacturing","$5,398","$0","$5,398","2020","20201029","safety-related offenses","workplace safety or health violation","","","federal","agency action","Occupational Safety & Health Administration","civil","","","","","","Missouri","TRENTON","822 INDUSTRIAL DR.","64683","336390","336390: Other Motor Vehicle Parts Manufacturing","USA","Wisconsin","publicly traded","MOD","automotive parts","automotive parts","Extracted from a download of OSHA's Enforcment Data downloaded on 3/02/2022, available at https://enforcedata.dol.gov/views/data_catalogs.php",""
"MODINE MANUFACTURING COMPANY","Modine Manufacturing","$5,000","$0","$5,000","2000","20001003","environment-related offenses","environmental violation","","","federal","agency action","Environmental Protection Agency","civil","","","04-2001-0002","","","","","","","","","USA","Wisconsin","publicly traded","MOD","automotive parts","automotive parts","Extracted from a download of the EPA's Enforcement and Compliance History Online (ECHO) ICIS FE&C file downloaded on 3/02/2022, available at http://echo.epa.gov/tools/data-downloads#downloads",""
