"Company","Parent Company","Penalty Amount","Subtraction From Penalty","Penalty Amount Adjusted For Eliminating Multiple Counting","Penalty Year","Penalty Date","Offense Group","Primary Offense","Secondary Offense","Description","Level of Government","Action Type","Agency","Civil/Criminal","Prosecution Agreement","Court","Case ID","Private Litigation Case Title","Lawsuit Resolution","Facility State","City","Address","Zip","NAICS Code","NAICS Translation","HQ Country of Parent","HQ State of Parent","Ownership Structure","Parent Company Stock Ticker","Major Industry of Parent","Specific Industry of Parent","Info Source","Notes"
"NorthWestern Corporation and NorthWestern Services, LLC","NorthWestern Corp.","$450,000","$0","$450,000","2008","20081126","competition-related offenses","energy market violation","","","federal","agency action","Federal Energy Regulatory Commission","civil","","","","","","","","","","","","USA","South Dakota","publicly traded","NWE","utilities and power generation","utilities","https://www.ferc.gov/enforcement/civil-penalties/actions/civil-penalty-action-2008.asp",""
"Northwestern Corporation","NorthWestern Corp.","$1,000,000","$0","$1,000,000","2007","20070118","competition-related offenses","energy market violation","","","federal","agency action","Federal Energy Regulatory Commission","civil","","","","","","","","","","","","USA","South Dakota","publicly traded","NWE","utilities and power generation","utilities","https://www.ferc.gov/enforcement/civil-penalties/actions/civil-penalty-action-2007.asp",""
"NORTHWESTERN ENERGY","NorthWestern Corp.","$7,000","$0","$7,000","2008","20080529","safety-related offenses","workplace safety or health violation","","","federal","agency action","Occupational Safety & Health Administration","civil","","","","","","Montana","DEER LODGE","ROCK CREEK RANCH","59722","237120","237120: Oil and Gas Pipeline and Related Structures Construction","USA","South Dakota","publicly traded","NWE","utilities and power generation","utilities","Extracted from a download of OSHA's Enforcment Data downloaded on 3/02/2022, available at https://enforcedata.dol.gov/views/data_catalogs.php",""
"NORTHWESTERN ENERGY","NorthWestern Corp.","$20,000","$0","$20,000","2007","20071210","safety-related offenses","workplace safety or health violation","","","federal","agency action","Occupational Safety & Health Administration","civil","","","","","","Montana","CORWIN SPRINGS","63 WEST SUMMIT","59021","221122","221122: Electric Power Distribution","USA","South Dakota","publicly traded","NWE","utilities and power generation","utilities","Extracted from a download of OSHA's Enforcment Data downloaded on 3/02/2022, available at https://enforcedata.dol.gov/views/data_catalogs.php",""
"NORTHWESTERN ENERGY, INC.","NorthWestern Corp.","$55,000","$0","$55,000","2007","20070618","safety-related offenses","workplace safety or health violation","","","federal","agency action","Occupational Safety & Health Administration","civil","","","","","","Montana","BILLINGS","LOCKWOOD","59104","221122","221122: Electric Power Distribution","USA","South Dakota","publicly traded","NWE","utilities and power generation","utilities","Extracted from a download of OSHA's Enforcment Data downloaded on 3/02/2022, available at https://enforcedata.dol.gov/views/data_catalogs.php",""
"NorthWestern Corp.","NorthWestern Corp.","$765,000","$0","$765,000","2010","20101220","miscellaneous offenses","utility administrative violation","","The Montana Public Service Commission approved a settlement with NorthWestern Corp. to recover $765,000 in fines the commission unanimously assessed against the utility in late 2008 concerning the PSC's finding that the utility repeatedly violated the ""limited investment basket cap"" provisions of its 2004 bankruptcy stipulation.","state","agency action","Montana Public Service Commission","civil","","","","","","Montana","","","","","","USA","South Dakota","publicly traded","NWE","utilities and power generation","utilities","NorthWestern settles $765,000 Mont. fine with promises to do R&D projects, SNL Electric Utility Report, December 20, 2010 (via Nexis).",""
"NORTHWESTERN ENERGY","NorthWestern Corp.","$37,800","$0","$37,800","2010","20100805","safety-related offenses","workplace safety or health violation","","","federal","agency action","Occupational Safety & Health Administration","civil","","","","","","Montana","BILLINGS","1653 LAKE HILLS","59105","221122","221122: Electric Power Distribution","USA","South Dakota","publicly traded","NWE","utilities and power generation","utilities","Extracted from a download of OSHA's Enforcment Data downloaded on 3/02/2022, available at https://enforcedata.dol.gov/views/data_catalogs.php",""
"Northwestern Energy","NorthWestern Corp.","$6,800","$0","$6,800","2004","20040406","environment-related offenses","environmental violation","","","federal","agency action","Environmental Protection Agency","civil","","","08-2003-0216","","","","","","","","","USA","South Dakota","publicly traded","NWE","utilities and power generation","utilities","Extracted from a download of the EPA's Enforcement and Compliance History Online (ECHO) ICIS FE&C file downloaded on 3/02/2022, available at http://echo.epa.gov/tools/data-downloads#downloads",""
