"Company","Parent Company","Penalty Amount","Subtraction From Penalty","Penalty Amount Adjusted For Eliminating Multiple Counting","Penalty Year","Penalty Date","Offense Group","Primary Offense","Secondary Offense","Description","Level of Government","Action Type","Agency","Civil/Criminal","Prosecution Agreement","Court","Case ID","Private Litigation Case Title","Lawsuit Resolution","Facility State","City","Address","Zip","NAICS Code","NAICS Translation","HQ Country of Parent","HQ State of Parent","Ownership Structure","Parent Company Stock Ticker","Major Industry of Parent","Specific Industry of Parent","Info Source","Notes"
"The Northern Trust Company","Northern Trust","$60,000","$0","$60,000","2015","20150618","financial offenses","investor protection violation","securities issuance or trading violation","The SEC announced enforcement actions against 36 municipal underwriting firms for violations in municipal bond offerings.","federal","agency action","Securities and Exchange Commission","civil","","","","","","","","","","","","USA","Illinois","publicly traded","NTRS","financial services","banking","https://www.sec.gov/news/pressrelease/2015-125.html",""
"Northern Trust, IBC","Northern Trust","$18,027","$0","$18,027","2003","20030404","financial offenses","economic sanction violation","","","federal","agency action","Office of Foreign Assets Control","civil","","","","","","","","","","","","USA","Illinois","publicly traded","NTRS","financial services","banking","https://www.treasury.gov/resource-center/sanctions/OFAC-Enforcement/Documents/04042003.pdf",""
"Northern Trust, National Association","Northern Trust","$125,000","$0","$125,000","2008","20080702","financial offenses","banking violation","","","federal","agency action","Office of the Comptroller of the Currency","civil","","","AA-EC-08-40","","","Florida","Miami","","","","","USA","Illinois","publicly traded","NTRS","financial services","banking","https://www.occ.gov/static/enforcement-actions/ea2008-067.pdf",""
"Northern Trust Investments, N.A.","Northern Trust","$36,000,000","$0","$36,000,000","2015","20150810","employment-related offenses","benefit plan administrator violation","pension ERISA violation","","federal","private litigation","","civil","","Northern District of Illinois","1:09-cv-1934","Diebold et al v. Northern Trust Investments, N.A. et al","settlement","","","","","","","USA","Illinois","publicly traded","NTRS","financial services","banking","https://www.law360.com/articles/688795/court-oks-36m-settlement-by-northern-trust-in-erisa-suit",""
"Northern Trust","Northern Trust","$37,500,000","$0","$37,500,000","2006","20060724","employment-related offenses","benefit plan administrator violation","pension ERISA violation","The settlement amount listed here refers only to Northern Trust's portion of a larger case relating to the collapse of Enron.","federal","private litigation","","civil","","Southern District of Texas","4:01-cv-3913","Tittle, et al v. Enron Corp, et al","settlement","","","","","","","USA","Illinois","publicly traded","NTRS","financial services","banking","https://www.pionline.com/article/20060331/ONLINE/603310719/northern-trust-reaches-375-million-settlement-in-enron-suit",""
"Northern Trust Company","Northern Trust","$1,000,000","$0","$1,000,000","2019","20191001","financial offenses","investor protection violation","","swaps reporting violation","federal","agency action","Commodity Futures Trading Commission","civil","","","","","","","","","","","","USA","Illinois","publicly traded","NTRS","financial services","banking","https://www.cftc.gov/PressRoom/PressReleases/8040-19",""
"Northern Trust Hedge Fund Services LLC","Northern Trust","$167,629","$0","$167,629","2020","20200918","financial offenses","investor protection violation","","","federal","agency action","Securities and Exchange Commission","civil","","","","","","","","","","","","USA","Illinois","publicly traded","NTRS","financial services","banking","https://www.sec.gov/litigation/admin/2020/ia-5585.pdf",""
"Northern Trust Securities","Northern Trust","$600,000","$0","$600,000","2011","20110602","financial offenses","investor protection violation","financial institution supervision failures","The Financial Industry Regulatory Authority fined Northern Trust Securities $600,000 for deficiencies in supervising sales of collateralized mortgage obligations (CMOs) and failure to have adequate systems in place to monitor certain high-volume securities trades.","federal","agency action","Financial Industry Regulatory Authority","civil","","","","","","","","","","","","USA","Illinois","publicly traded","NTRS","financial services","banking","https://www.finra.org/media-center/news-releases/2011/finra-fines-northern-trust-securities-inc-600000-inadequate-supervision","FINRA is a securities industry self-regulatory body authorized by the federal government."
