"Company","Parent Company","Penalty Amount","Subtraction From Penalty","Penalty Amount Adjusted For Eliminating Multiple Counting","Penalty Year","Penalty Date","Offense Group","Primary Offense","Secondary Offense","Description","Level of Government","Action Type","Agency","Civil/Criminal","Prosecution Agreement","Court","Case ID","Private Litigation Case Title","Lawsuit Resolution","Facility State","City","Address","Zip","NAICS Code","NAICS Translation","HQ Country of Parent","HQ State of Parent","Ownership Structure","Parent Company Stock Ticker","Major Industry of Parent","Specific Industry of Parent","Info Source","Notes"
"Park Aerospace Technologies Corp.","Park Electrochemical","$9,864","$0","$9,864","2013","20130106","employment-related offenses","wage and hour violation","Fair Labor Standards Act","","federal","agency action","Labor Department Wage and Hour Division","civil","","","1674084","","","Kansas","Newton","","67114","332311","332311: Prefabricated Metal Building and Component Manufacturing","USA","New York","publicly traded","PKE","electrical and electronic equipment","electrical equipment","March 7, 2017 download of a dataset posted by the Wage and Hour Division at https://enforcedata.dol.gov/views/data_summary.php","Date and year are the Findings End Date in the dataset posted by the Wage and Hour Division, which does not provide case opening or closing dates. The company name is the Legal Name provided by the dataset unless that field is blank, in which case the Trade Name is used. The dataset provides only one address and does not indicate whether it is the company headquarters address or the establishment address. The penalty amount is the total of civil monetary penalties and mandated back wages. The original dataset provides a breakdown."
"Park Electrochemical Inc","Park Electrochemical","$10,814","$0","$10,814","2005","20050614","employment-related offenses","wage and hour violation","Fair Labor Standards Act","","federal","agency action","Labor Department Wage and Hour Division","civil","","","1395766","","","New York","Melville","","11747","32552","32552: Adhesive Manufacturing","USA","New York","publicly traded","PKE","electrical and electronic equipment","electrical equipment","March 7, 2017 download of a dataset posted by the Wage and Hour Division at https://enforcedata.dol.gov/views/data_summary.php","Date and year are the Findings End Date in the dataset posted by the Wage and Hour Division, which does not provide case opening or closing dates. The company name is the Legal Name provided by the dataset unless that field is blank, in which case the Trade Name is used. The dataset provides only one address and does not indicate whether it is the company headquarters address or the establishment address. The penalty amount is the total of civil monetary penalties and mandated back wages. The original dataset provides a breakdown."
"PARK ADVANCED COMPOSITE MATERIALS, INC.","Park Electrochemical","$5,500","$0","$5,500","2012","20120905","safety-related offenses","aviation safety violation","","hazardous materials shipping","federal","agency action","Federal Aviation Administration","civil","","","2012NE700125","","","","","","","","","USA","New York","publicly traded","PKE","electrical and electronic equipment","electrical equipment","from a spreadsheet posted on the FAA website at https://www.faa.gov/about/office_org/headquarters_offices/ash/ash_programs/hazmat/compliance_enforcement/",""
"Park Advanced Composite Materials Inc.","Park Electrochemical","$30,000","$0","$30,000","2009","20090506","environment-related offenses","environmental violation","","","state","agency action","Connecticut Department of Energy & Environmental Protection","civil","","","","","","Connecticut","Waterbury","","","","","USA","New York","publicly traded","PKE","electrical and electronic equipment","electrical equipment","https://www.depdata.ct.gov/enforcement/createrpt.asp?Programopt=Air&Townopt=Andover&select=all&B1=Submit","Captured from summaries produced by DEP; may not include full details of penalties."
"ZIN-PLAS CORP.","Park Electrochemical","$5,000","$0","$5,000","2001","20010305","environment-related offenses","environmental violation","","","federal","agency action","Environmental Protection Agency","civil","","","05-2001-0095","","","Michigan","GRAND RAPIDS","1141 IONIA ST.","49503","","","USA","New York","publicly traded","PKE","electrical and electronic equipment","electrical equipment","Extracted from a download of the EPA's Enforcement and Compliance History Online (ECHO) ICIS FE&C file downloaded on 3/02/2022, available at http://echo.epa.gov/tools/data-downloads#downloads",""
