"Company","Parent Company","Penalty Amount","Subtraction From Penalty","Penalty Amount Adjusted For Eliminating Multiple Counting","Penalty Year","Penalty Date","Offense Group","Primary Offense","Secondary Offense","Description","Level of Government","Action Type","Agency","Civil/Criminal","Prosecution Agreement","Court","Case ID","Private Litigation Case Title","Lawsuit Resolution","Facility State","City","Address","Zip","NAICS Code","NAICS Translation","HQ Country of Parent","HQ State of Parent","Ownership Structure","Parent Company Stock Ticker","Major Industry of Parent","Specific Industry of Parent","Info Source","Notes"
"Parsons Infrastructure & Technology Group","Parsons Corporation","$151,870","$0","$151,870","2013","20130517","employment-related offenses","wage and hour violation","Service Contract Act","","federal","agency action","Labor Department Wage and Hour Division","civil","","","1672558","","","California","Pasadena","","91124","541990","541990: All Other Professional, Scientific, and Technical Services","USA","California","employee-owned","","construction and engineering","construction & engineering","March 7, 2017 download of a dataset posted by the Wage and Hour Division at https://enforcedata.dol.gov/views/data_summary.php","Date and year are the Findings End Date in the dataset posted by the Wage and Hour Division, which does not provide case opening or closing dates. The company name is the Legal Name provided by the dataset unless that field is blank, in which case the Trade Name is used. The dataset provides only one address and does not indicate whether it is the company headquarters address or the establishment address. The penalty amount is the total of civil monetary penalties and mandated back wages. The original dataset provides a breakdown."
"Parsons Infrastructure & Technology Group Inc","Parsons Corporation","$63,635","$0","$63,635","2007","20071130","employment-related offenses","wage and hour violation","Service Contract Act","","federal","agency action","Labor Department Wage and Hour Division","civil","","","1454346","","","California","Pasadena","","91124","924120","924120: Administration of Conservation Programs","USA","California","employee-owned","","construction and engineering","construction & engineering","March 7, 2017 download of a dataset posted by the Wage and Hour Division at https://enforcedata.dol.gov/views/data_summary.php","Date and year are the Findings End Date in the dataset posted by the Wage and Hour Division, which does not provide case opening or closing dates. The company name is the Legal Name provided by the dataset unless that field is blank, in which case the Trade Name is used. The dataset provides only one address and does not indicate whether it is the company headquarters address or the establishment address. The penalty amount is the total of civil monetary penalties and mandated back wages. The original dataset provides a breakdown."
"Parsons Infrastructure & Technology Group, Inc.","Parsons Corporation","$70,000","$0","$70,000","2010","20101007","safety-related offenses","nuclear safety violation","","On October 7, 2010, the U.S. Department of Energy (DOE) Office of Health, Safety and Security's Office of Enforcement issued a Preliminary Notice of Violation (WEA-2010-06) to Parsons Infrastructure & Technology Group, Inc. for violations of 10 C.F.R. 851 related to a hand injury that occurred while a worker was performing crane lubrication on October 6, 2009, at the Salt Waste Processing Facility at t DOE's Savannah River Site.","federal","agency action","Energy Department Office of Enforcement","civil","","","","","","","","","","","","USA","California","employee-owned","","construction and engineering","construction & engineering","http://energy.gov/sites/prod/files/hss/Enforcement%20and%20Oversight/Enforcement/docs/eas/WEA-2010-06.pdf",""
"Parsons Infrastructure and Technology Group, Inc.","Parsons Corporation","$190,000","$0","$190,000","2010","20100413","safety-related offenses","nuclear safety violation","","On April 13, 2010, the U.S. Department of Energy (DOE) Office of Health, Safety and Security's Office of Enforcement issued a Consent Order to Parsons Infrastructure and Technology Group, Inc. for deficiencies in the oversight of suppliers of nuclear grade construction materials for the Salt Waste Processing Facility at DOE's Savannah River Site. The contractor agreed to the Consent Order.","federal","agency action","Energy Department Office of Enforcement","civil","","","","","","","","","","","","USA","California","employee-owned","","construction and engineering","construction & engineering","http://energy.gov/sites/prod/files/hss/Enforcement%20and%20Oversight/Enforcement/docs/consentorders/Parsons_Consent_Order_NCO-2010-02.pdf",""
"Parsons Government Services Inc.","Parsons Corporation","$3,800,000","$0","$3,800,000","2015","20150902","government-contracting-related offenses","False Claims Act and related","","Parsons Government Services Inc. agreed to pay the United States $3.8 million to settle allegations that the company knowingly mischarged the U.S. Department of Energy for ineligible or inflated short-term and long-term employee relocation costs in connection with its contract for the DOE Salt Waste Processing Facility Project at the DOE Savannah River Site in Aiken, South Carolina. ","federal","agency action","Justice Department Civil Division","civil","","","","","","","","","","","","USA","California","employee-owned","","construction and engineering","construction & engineering","https://www.justice.gov/opa/pr/parsons-government-services-inc-agrees-pay-38-million-settle-false-claims-act-allegations",""
"Parsons Infrastructure & Technology Group, In","Parsons Corporation","$1,329,031","$0","$1,329,031","2006","20060218","employment-related offenses","wage and hour violation","Service Contract Act","","federal","agency action","Labor Department Wage and Hour Division","civil","","","1419227","","","Indiana","Newport","","47966","928110","928110: National Security","USA","California","employee-owned","","construction and engineering","construction & engineering","March 7, 2017 download of a dataset posted by the Wage and Hour Division at https://enforcedata.dol.gov/views/data_summary.php","Date and year are the Findings End Date in the dataset posted by the Wage and Hour Division, which does not provide case opening or closing dates. The company name is the Legal Name provided by the dataset unless that field is blank, in which case the Trade Name is used. The dataset provides only one address and does not indicate whether it is the company headquarters address or the establishment address. The penalty amount is the total of civil monetary penalties and mandated back wages. The original dataset provides a breakdown."
"Parsons Government Services Inc.","Parsons Corporation","$36,000","$0","$36,000","2019","20191221","employment-related offenses","wage and hour violation","Service Contract Act","","federal","agency action","Labor Department Wage and Hour Division","civil","","","1889970","","","Virginia","Centreville","5875 Trinity Paykway. Suite 300","20120","541330","541330: Engineering Services","USA","California","employee-owned","","construction and engineering","construction & engineering","June 13, 2020 download of a dataset posted by the Wage and Hour Division at https://enforcedata.dol.gov/views/data_summary.php","Date and year are the Findings End Date in the dataset posted by the Wage and Hour Division, which does not provide case opening or closing dates. The company name is the Legal Name provided by the dataset unless that field is blank, in which case the Trade Name is used. The dataset provides only one address and does not indicate whether it is the company headquarters address or the establishment address. The penalty amount is the total of civil monetary penalties and mandated back wages. The original dataset provides a breakdown."
"PARSONS CONSTRUCTION","Parsons Corporation","$7,000","$0","$7,000","2017","20170703","safety-related offenses","workplace safety or health violation","","","federal","agency action","Occupational Safety & Health Administration","civil","","","","","","Pennsylvania","PHILADELPHIA","261 SOUTH 13TH STREET","19107","238130","238130: Framing Contractors","USA","California","employee-owned","","construction and engineering","construction & engineering","Extracted from a download of OSHA's Enforcment Data downloaded on 3/02/2022, available at https://enforcedata.dol.gov/views/data_catalogs.php",""
