"Company","Parent Company","Penalty Amount","Subtraction From Penalty","Penalty Amount Adjusted For Eliminating Multiple Counting","Penalty Year","Penalty Date","Offense Group","Primary Offense","Secondary Offense","Description","Level of Government","Action Type","Agency","Civil/Criminal","Prosecution Agreement","Court","Case ID","Private Litigation Case Title","Lawsuit Resolution","Facility State","City","Address","Zip","NAICS Code","NAICS Translation","HQ Country of Parent","HQ State of Parent","Ownership Structure","Parent Company Stock Ticker","Major Industry of Parent","Specific Industry of Parent","Info Source","Notes"
"Rockwell Automation Inc.","Rockwell Automation","$2,761,091","$0","$2,761,091","2011","20110503","competition-related offenses","Foreign Corrupt Practices Act","","","federal","agency action","Securities and Exchange Commission","civil","","","","","","","","","","","","USA","Wisconsin","publicly traded","ROK","industrial equipment","industrial equipment","https://www.sec.gov/litigation/admin/2011/34-64380.pdf",""
"Rockwell Automation Inc.","Rockwell Automation","$46,750","$0","$46,750","2005","20050311","competition-related offenses","export control violation","","","federal","agency action","Bureau of Industry and Security","civil","","","","","","","","","","","","USA","Wisconsin","publicly traded","ROK","industrial equipment","industrial equipment","FOIA220","Source document obtained through a Freedom of Information Act request to the agency."
"Rockwell Automation Industrial Company","Rockwell Automation","$37,500","$0","$37,500","2000","20001213","employment-related offenses","labor relations violation","","back pay award in unfair labor practices case","federal","agency action","National Labor Relations Board","civil","","","08-CA-31360-001","","","Ohio","Euclid","","44117","335110","335110: Electric Lamp Bulb and Part Manufacturing","USA","Wisconsin","publicly traded","ROK","industrial equipment","industrial equipment","Extracted from an NLRB dataset covering 1999-2011 downloaded at https://catalog.data.gov/dataset/nlrb-cats-final-c-case-data-bulk-19990101-20110930-in-xml",""
"Rockwell Automation, Inc.","Rockwell Automation","$180,000","$0","$180,000","2005","20050718","employment-related offenses","employment discrimination","","age","federal","agency action","Equal Employment Opportunity Commission","civil","","","","","","New York","","","","","","USA","Wisconsin","publicly traded","ROK","industrial equipment","industrial equipment","https://web.archive.org/web/20090813021801/http://eeoc.gov/litigation/settlements/settlement07-05.html",""
"ROCKWELL AUTOMATION, INC.","Rockwell Automation","$5,290","$0","$5,290","2016","20160720","safety-related offenses","workplace safety or health violation","","","federal","agency action","Occupational Safety & Health Administration","civil","","","","","","Wisconsin","MEQUON","6400 W. ENTERPRISE DRIVE","53092","335314","335314: Relay and Industrial Control Manufacturing","USA","Wisconsin","publicly traded","ROK","industrial equipment","industrial equipment","Extracted from a download of OSHA's Enforcment Data downloaded on 3/02/2022, available at https://enforcedata.dol.gov/views/data_catalogs.php",""
