"Company","Parent Company","Penalty Amount","Subtraction From Penalty","Penalty Amount Adjusted For Eliminating Multiple Counting","Penalty Year","Penalty Date","Offense Group","Primary Offense","Secondary Offense","Description","Level of Government","Action Type","Agency","Civil/Criminal","Prosecution Agreement","Court","Case ID","Private Litigation Case Title","Lawsuit Resolution","Facility State","City","Address","Zip","NAICS Code","NAICS Translation","HQ Country of Parent","HQ State of Parent","Ownership Structure","Parent Company Stock Ticker","Major Industry of Parent","Specific Industry of Parent","Info Source","Notes"
"Rogers Corporation","Rogers Corp.","$93,633","$0","$93,633","2005","20051117","employment-related offenses","labor relations violation","","back pay award in unfair labor practices case","federal","agency action","National Labor Relations Board","civil","","","34-CA-09117-001","","","Connecticut","Killingly","","06226","561720","561720: Janitorial Services","USA","Connecticut","publicly traded","ROG","miscellaneous manufacturing","engineered materials","Extracted from an NLRB dataset covering 1999-2011 downloaded at https://catalog.data.gov/dataset/nlrb-cats-final-c-case-data-bulk-19990101-20110930-in-xml",""
"ROGERS CORPORATION","Rogers Corp.","$5,473","$0","$5,473","2001","20010119","safety-related offenses","workplace safety or health violation","","","federal","agency action","Occupational Safety & Health Administration","civil","","","","","","Connecticut","MANCHESTER","24 MILL STREET","06040","000000","","USA","Connecticut","publicly traded","ROG","miscellaneous manufacturing","engineered materials","Extracted from a download of OSHA's Enforcment Data downloaded on 3/02/2022, available at https://enforcedata.dol.gov/views/data_catalogs.php",""
"DEWAL INDUSTRIES INC.","Rogers Corp.","$5,670","$0","$5,670","2013","20131218","safety-related offenses","workplace safety or health violation","","","federal","agency action","Occupational Safety & Health Administration","civil","","","","","","Rhode Island","NARRAGANSETT","15 RAY TRAINOR DRIVE","02882","322222","322222: Coated and Laminated Paper Manufacturing","USA","Connecticut","publicly traded","ROG","miscellaneous manufacturing","engineered materials","Extracted from a download of OSHA's Enforcment Data downloaded on 3/02/2022, available at https://enforcedata.dol.gov/views/data_catalogs.php",""
"ROGERS CORPORATION","Rogers Corp.","$8,193","$0","$8,193","2019","20191119","safety-related offenses","workplace safety or health violation","","","federal","agency action","Occupational Safety & Health Administration","civil","","","","","","Connecticut","WOODSTOCK","245 WOODSTOCK ROAD","06281","325211","325211: Plastics Material and Resin Manufacturing","USA","Connecticut","publicly traded","ROG","miscellaneous manufacturing","engineered materials","Extracted from a download of OSHA's Enforcment Data downloaded on 3/02/2022, available at https://enforcedata.dol.gov/views/data_catalogs.php",""
"ROGERS CORPORATION","Rogers Corp.","$214,418","$0","$214,418","2003","20030116","environment-related offenses","environmental violation","","","federal","agency action","Environmental Protection Agency","civil","","","01-1995-0015","","","","","","","","","USA","Connecticut","publicly traded","ROG","miscellaneous manufacturing","engineered materials","Extracted from a download of the EPA's Enforcement and Compliance History Online (ECHO) ICIS FE&C file downloaded on 3/02/2022, available at http://echo.epa.gov/tools/data-downloads#downloads",""
