"Company","Parent Company","Penalty Amount","Subtraction From Penalty","Penalty Amount Adjusted For Eliminating Multiple Counting","Penalty Year","Penalty Date","Offense Group","Primary Offense","Secondary Offense","Description","Level of Government","Action Type","Agency","Civil/Criminal","Prosecution Agreement","Court","Case ID","Private Litigation Case Title","Lawsuit Resolution","Facility State","City","Address","Zip","NAICS Code","NAICS Translation","HQ Country of Parent","HQ State of Parent","Ownership Structure","Parent Company Stock Ticker","Major Industry of Parent","Specific Industry of Parent","Info Source","Notes"
"Roper Scientific Inc.","Roper Technologies","$422,000","$0","$422,000","2004","20040408","competition-related offenses","export control violation","","","federal","agency action","Bureau of Industry and Security","civil","","","","","","","","","","","","USA","Florida","publicly traded","ROP","electrical and electronic equipment","electronic equipment","FOIA100","Source document obtained through a Freedom of Information Act request to the agency."
"Transcore ITS, LLC","Roper Technologies","$14,678","$0","$14,678","2013","20130224","employment-related offenses","wage and hour violation","Fair Labor Standards Act","","federal","agency action","Labor Department Wage and Hour Division","civil","","","1682735","","","Nevada","North Las Vegas","","89030","23821","23821: Electrical Contractors","USA","Florida","publicly traded","ROP","electrical and electronic equipment","electronic equipment","March 7, 2017 download of a dataset posted by the Wage and Hour Division at https://enforcedata.dol.gov/views/data_summary.php","Date and year are the Findings End Date in the dataset posted by the Wage and Hour Division, which does not provide case opening or closing dates. The company name is the Legal Name provided by the dataset unless that field is blank, in which case the Trade Name is used. The dataset provides only one address and does not indicate whether it is the company headquarters address or the establishment address. The penalty amount is the total of civil monetary penalties and mandated back wages. The original dataset provides a breakdown."
"CBORD Group, Inc.","Roper Technologies","$9,848","$0","$9,848","2013","20130716","financial offenses","tax violations","","failure to pay out-of-state business registration fee","state","agency action","Connecticut Attorney General","civil","","","","","","Connecticut","","","","","","USA","Florida","publicly traded","ROP","electrical and electronic equipment","electronic equipment","https://portal.ct.gov/AG/Press-Releases-Archived/2013-Press-Releases/Merrill--Jepsen-Collect-13-Million-in-Penalties-from-Companies-Transacting-Business-in-Connecticut-W",""
"Roper Pump Company","Roper Technologies","$6,000","$0","$6,000","2000","20000906","environment-related offenses","environmental violation","","Air Quality Act","state","agency action","Georgia Environmental Protection Division","civil","","","EPD-AQC-1643","","","Georgia","","","","","","USA","Florida","publicly traded","ROP","electrical and electronic equipment","electronic equipment","Contained in a spreadsheet obtained from the agency on October 7, 2020 in response to an open records request. The spreadsheet contains cases from the enforcement database accessible at https://enfo.gaepd.org/Orders/Search",""
"METRIX INSTRUMENT CO., L.P.","Roper Technologies","$5,411","$0","$5,411","2019","20190313","safety-related offenses","workplace safety or health violation","","","federal","agency action","Occupational Safety & Health Administration","civil","","","","","","Texas","HOUSTON","8824 FALLBROOK DRIVE","77064","334515","334515: Instrument Manufacturing for Measuring and Testing Electricity and Electrical Signals","USA","Florida","publicly traded","ROP","electrical and electronic equipment","electronic equipment","Extracted from a download of OSHA's Enforcment Data downloaded on 3/02/2022, available at https://enforcedata.dol.gov/views/data_catalogs.php",""
