"Company","Parent Company","Penalty Amount","Subtraction From Penalty","Penalty Amount Adjusted For Eliminating Multiple Counting","Penalty Year","Penalty Date","Offense Group","Primary Offense","Secondary Offense","Description","Level of Government","Action Type","Agency","Civil/Criminal","Prosecution Agreement","Court","Case ID","Private Litigation Case Title","Lawsuit Resolution","Facility State","City","Address","Zip","NAICS Code","NAICS Translation","HQ Country of Parent","HQ State of Parent","Ownership Structure","Parent Company Stock Ticker","Major Industry of Parent","Specific Industry of Parent","Info Source","Notes"
"Simon Property Group Inc.","Simon Property Group","$125,000","$0","$125,000","2011","20111108","employment-related offenses","employment discrimination","","National Origin","federal","agency action","Equal Employment Opportunity Commission","civil","","","","","","Nevada","","","","","","USA","Indiana","publicly traded","SPG","real estate","real estate","https://www.eeoc.gov/eeoc/newsroom/release/11-8-11c.cfm","Description field shows type of discrimination that EEOC had alleged."
"Simon Property Group","Simon Property Group","$440,000","$0","$440,000","2007","20070220","consumer-protection-related offenses","consumer protection violation","","gift card violation","state","agency action","New Hampshire Attorney General","civil","","","","","","New Hampshire","","","","","","USA","Indiana","publicly traded","SPG","real estate","real estate","https://web.archive.org/web/20081001113800/http://doj.nh.gov/publications/nreleases/022007.html",""
"Simon Property Group","Simon Property Group","$945,000","$0","$945,000","2017","20170821","competition-related offenses","price-fixing or anti-competitive practices","","","state","agency action","New York Attorney General","civil","","","","","","New York","","","","","","USA","Indiana","publicly traded","SPG","real estate","real estate","https://web.archive.org/web/20170925104613/https://ag.ny.gov/press-release/ag-schneiderman-announces-settlement-nations-largest-mall-operator-stop",""
"Simon Property Group Inc.","Simon Property Group","$125,000","$0","$125,000","2005","20050301","consumer-protection-related offenses","consumer protection violation","","","state","agency action","New York Attorney General","civil","","","","","","New York","","","","","","USA","Indiana","publicly traded","SPG","real estate","real estate","https://web.archive.org/web/20101113165037/http://www.ag.ny.gov/media_center/2005/mar/mar01a_05.html",""
"Simon Property Group, LCC and SPGGC, LLC","Simon Property Group","$308,736","$0","$308,736","2008","20081229","consumer-protection-related offenses","consumer protection violation","","Simon Property Group, LCC and SPGGC, LLC, the owners of the Crystal Mall in Waterford, agreed to pay $308,736 in restitution and costs in settlement of allegations they violated state regulations on gift cards by having inactivity fees.","state","agency action","Connecticut Attorney General","civil","","","","","","Connecticut","Waterford","","","","","USA","Indiana","publicly traded","SPG","real estate","real estate","https://web.archive.org/web/20091020130237/http://www.ct.gov/ag/cwp/view.asp?A=2795&Q=430626",""
"SIMON PROPERTY GROUP, L.P.","Simon Property Group","$8,873","$0","$8,873","2016","20161129","safety-related offenses","workplace safety or health violation","","","federal","agency action","Occupational Safety & Health Administration","civil","","","","","","Florida","SUNRISE","12801 WEST SUNRISE BLVD.","33323","453998","453998: All Other Miscellaneous Store Retailers (except Tobacco Stores)","USA","Indiana","publicly traded","SPG","real estate","real estate","Extracted from a download of OSHA's Enforcment Data downloaded on 3/02/2022, available at https://enforcedata.dol.gov/views/data_catalogs.php",""
