"Company","Parent Company","Penalty Amount","Subtraction From Penalty","Penalty Amount Adjusted For Eliminating Multiple Counting","Penalty Year","Penalty Date","Offense Group","Primary Offense","Secondary Offense","Description","Level of Government","Action Type","Agency","Civil/Criminal","Prosecution Agreement","Court","Case ID","Private Litigation Case Title","Lawsuit Resolution","Facility State","City","Address","Zip","NAICS Code","NAICS Translation","HQ Country of Parent","HQ State of Parent","Ownership Structure","Parent Company Stock Ticker","Major Industry of Parent","Specific Industry of Parent","Info Source","Notes"
"Total Environmental Solutions, Inc. (TESI) and Utility Services, LLC","South Louisiana Electric Cooperative","$1,300,000","$0","$1,300,000","2014","20140305","environment-related offenses","environmental violation","","The U.S. Environmental Protection Agency (EPA), U.S. Department of Justice and the Mississippi Department of Environmental Quality announced a proposed settlement today with Total Environmental Solutions, Inc. (TESI) and Utility Services, LLC to address violations of the Clean Water Act (CWA), including effluent violations and unauthorized overflows of untreated raw sewage. These companies have agreed to undertake a thorough assessment of, and implement extensive improvements to, 18 wastewater treatment facilities and wastewater collection and transmission systems located in Mississippi.","federal","agency action","Environmental Protection Agency","civil","","","","","","Mississippi","","","","","","USA","Louisiana","cooperative","","utilities and power generation","utilities","https://archive.epa.gov/epapages/newsroom_archive/newsreleases/3a4053c230ec49ec85257c9200696d4f.html",""
"TOTAL ENVIRONMENTAL SOLUTIONS INC.","South Louisiana Electric Cooperative","$9,750","$0","$9,750","2003","20030917","safety-related offenses","workplace safety or health violation","","","federal","agency action","Occupational Safety & Health Administration","civil","","","","","","Louisiana","BATON ROUGE","1824 RYDER DR","70808","221320","221320: Sewage Treatment Facilities","USA","Louisiana","cooperative","","utilities and power generation","utilities","Extracted from a download of OSHA's Enforcment Data downloaded on 3/02/2022, available at https://enforcedata.dol.gov/views/data_catalogs.php",""
"TOTAL ENVIRONMENTAL SOLUTIONS INC","South Louisiana Electric Cooperative","$6,720","$0","$6,720","2001","20011002","safety-related offenses","workplace safety or health violation","","","federal","agency action","Occupational Safety & Health Administration","civil","","","","","","Louisiana","SLIDELL","RIGOLETS ESTATES (HWY 90)","70458","000000","","USA","Louisiana","cooperative","","utilities and power generation","utilities","Extracted from a download of OSHA's Enforcment Data downloaded on 3/02/2022, available at https://enforcedata.dol.gov/views/data_catalogs.php",""
"TOTAL ENVIRONMENTAL SOLUTIONS INC","South Louisiana Electric Cooperative","$8,120","$0","$8,120","2001","20011002","safety-related offenses","workplace safety or health violation","","","federal","agency action","Occupational Safety & Health Administration","civil","","","","","","Louisiana","SLIDELL","RIGOLETS MARINA - HWY 90","70458","000000","","USA","Louisiana","cooperative","","utilities and power generation","utilities","Extracted from a download of OSHA's Enforcment Data downloaded on 3/02/2022, available at https://enforcedata.dol.gov/views/data_catalogs.php",""
"Total Environmental Solutions Inc.","South Louisiana Electric Cooperative","$57,000","$0","$57,000","2020","20200128","environment-related offenses","environmental violation","","","state","agency action","Louisiana Department of Environmental Quality","civil","","","","","","Louisiana","","","","","","USA","Louisiana","cooperative","","utilities and power generation","utilities","https://deq.louisiana.gov/assets/docs/General/Settlement_Agreements/2020/TESI0048_Final.pdf",""
"TOTAL ENVIRONMENTAL SOLUTIONS, INC.","South Louisiana Electric Cooperative","$10,392","$0","$10,392","2003","20031219","environment-related offenses","environmental violation","","","state","agency action","Louisiana Department of Environmental Quality","civil","","","WEP030890","","","Louisiana","","","","","","USA","Louisiana","cooperative","","utilities and power generation","utilities","https://deq.louisiana.gov/page/enforcement-actions",""
"Total Environmental Solutions Inc.","South Louisiana Electric Cooperative","$30,000","$0","$30,000","2011","20110217","environment-related offenses","environmental violation","","","state","agency action","Mississippi Department of Environmental Quality","civil","","","590811","","","Mississippi","Vicksburg ","","","","","USA","Louisiana","cooperative","","utilities and power generation","utilities","https://opc.deq.state.ms.us/ensearchonline/get_doc?datatype=order&id=727470",""
"Total Environmental Solutions, Inc.","South Louisiana Electric Cooperative","$5,600","$0","$5,600","2021","20211014","environment-related offenses","environmental violation","","","state","agency action","South Carolina Department of Health and Environmental Control","civil","","","","","","South Carolina","Westminster","","","","","USA","Louisiana","cooperative","","utilities and power generation","utilities","https://scdhec.gov/sites/default/files/media/document/EA_EnforcementReport_December2021.pdf",""
"TOTAL ENVIRONMENTAL SOLUTIONALS, INC. (TESI)","South Louisiana Electric Cooperative","$112,500","$112,500","$0","2014","20140501","environment-related offenses","environmental violation","","","federal","agency action","Environmental Protection Agency","civil","","","04-2010-9001","","","","","","","","","USA","Louisiana","cooperative","","utilities and power generation","utilities","Extracted from a download of the EPA's Enforcement and Compliance History Online (ECHO) ICIS FE&C file downloaded on 3/02/2022, available at http://echo.epa.gov/tools/data-downloads#downloads","Note: This penalty is a duplicate of an amount shown in another record (either because it applies to a multi-location settlement or because Violation Tracker contains an agency record and a settlement announcement for the same case)."
