"Company","Parent Company","Penalty Amount","Subtraction From Penalty","Penalty Amount Adjusted For Eliminating Multiple Counting","Penalty Year","Penalty Date","Offense Group","Primary Offense","Secondary Offense","Description","Level of Government","Action Type","Agency","Civil/Criminal","Prosecution Agreement","Court","Case ID","Private Litigation Case Title","Lawsuit Resolution","Facility State","City","Address","Zip","NAICS Code","NAICS Translation","HQ Country of Parent","HQ State of Parent","Ownership Structure","Parent Company Stock Ticker","Major Industry of Parent","Specific Industry of Parent","Info Source","Notes"
"Glazer Distribution","Southern Glazer's Wine & Spirits","$9,960","$0","$9,960","2008","20081222","employment-related offenses","labor relations violation","","back pay award in unfair labor practices case","federal","agency action","National Labor Relations Board","civil","","","09-CA-44685-001","","","Ohio","Columbus","","43213","312140","312140: Distilleries","USA","Florida","privately held","","wholesalers","wholesalers-beverages","Extracted from an NLRB dataset covering 1999-2011 downloaded at https://catalog.data.gov/dataset/nlrb-cats-final-c-case-data-bulk-19990101-20110930-in-xml",""
"Glazer's Distributors of Illinois, Inc.","Southern Glazer's Wine & Spirits","$225,000","$0","$225,000","2008","20080718","financial offenses","tax violations","excise tax violation","","federal","agency action","Alcohol and Tobacco Tax and Trade Bureau","civil","","","","","","Illinois","Chicago","","","","","USA","Florida","privately held","","wholesalers","wholesalers-beverages","https://www.ttb.gov/images/pdfs/fo-compromise/2008/glazers_distributers_of_illinois.pdf",""
"Southern Glazer's Wine and Spirits of Louisiana, LLC","Southern Glazer's Wine & Spirits","$175,000","$0","$175,000","2017","20170109","employment-related offenses","employment discrimination","","A routine investigation by the U.S. Department of Labor's Office of Federal Contract Compliance Programs found that Southern Glazer's Wine and Spirits of Louisiana LLC systemically discriminated against black applicants in its hiring practices at its St. Rose warehouse facility. The company entered into a consent decree and agreed to pay $175,000 in back pay and interest to the 467 affected class members and to extend 13 job offers.","federal","agency action","Office of Federal Contract Compliance Programs","civil","","","","","","Louisiana","St. Rose","","","","","USA","Florida","privately held","","wholesalers","wholesalers-beverages","https://www.dol.gov/newsroom/releases/ofccp/ofccp20170109",""
"SOUTHERN WINE & SPIRITS","Southern Glazer's Wine & Spirits","$8,580","$0","$8,580","2008","20080331","safety-related offenses","motor vehicle safety violation","","FL-2008-0100-US0485","federal","agency action","Federal Motor Carrier Safety Administration","civil","","","","","","Florida","MIRAMAR","","","","","USA","Florida","privately held","","wholesalers","wholesalers-beverages","https://www.fmcsa.dot.gov/regulations/enforcement/national-listing-enforcement-cases-subject-name-closed-fiscal-year-2008-pdf","Year is fiscal year. Date is closing date."
"Southern Wine & Spirits of Illinois, Inc.","Southern Glazer's Wine & Spirits","$225,000","$0","$225,000","2008","20080124","financial offenses","tax violations","excise tax violation","","federal","agency action","Alcohol and Tobacco Tax and Trade Bureau","civil","","","","","","Illinois","Bolinbrook","","","","","USA","Florida","privately held","","wholesalers","wholesalers-beverages","https://www.ttb.gov/images/pdfs/fo-compromise/2008/southern-wine-spirits.pdf",""
"SOUTHERN WINE AND SPIRITS OF AMERICA, INC.","Southern Glazer's Wine & Spirits","$5,908","$0","$5,908","2009","20090324","safety-related offenses","workplace safety or health violation","","","federal","agency action","Occupational Safety & Health Administration","civil","","","","","","Nevada","LAS VEGAS","8400 SOUTH JONES BLVD.","89139","424820","424820: Wine and Distilled Alcoholic Beverage Merchant Wholesalers","USA","Florida","privately held","","wholesalers","wholesalers-beverages","Extracted from a download of OSHA's Enforcment Data downloaded on 3/02/2022, available at https://enforcedata.dol.gov/views/data_catalogs.php",""
"SOUTHERN WINE & SPIRITS OF AMERICA INC","Southern Glazer's Wine & Spirits","$14,000","$0","$14,000","2011","20110105","safety-related offenses","workplace safety or health violation","","","federal","agency action","Occupational Safety & Health Administration","civil","","","","","","California","SANTA FE SPRINGS","13500 FOSTER RD","90670","424820","424820: Wine and Distilled Alcoholic Beverage Merchant Wholesalers","USA","Florida","privately held","","wholesalers","wholesalers-beverages","Extracted from a download of OSHA's Enforcment Data downloaded on 3/02/2022, available at https://enforcedata.dol.gov/views/data_catalogs.php",""
"SOUTHERN WINE & SPIRITS OF COLORADO","Southern Glazer's Wine & Spirits","$6,560","$0","$6,560","2006","20060428","safety-related offenses","workplace safety or health violation","","","federal","agency action","Occupational Safety & Health Administration","civil","","","","","","Colorado","DENVER","5270 FOX ST.","80216","424820","424820: Wine and Distilled Alcoholic Beverage Merchant Wholesalers","USA","Florida","privately held","","wholesalers","wholesalers-beverages","Extracted from a download of OSHA's Enforcment Data downloaded on 3/02/2022, available at https://enforcedata.dol.gov/views/data_catalogs.php",""
"Southern Wine and Spirits","Southern Glazer's Wine & Spirits","$3,500,000","$0","$3,500,000","2012","20121211","employment-related offenses","wage and hour violation","","","federal","private litigation","","civil","","Northern District of California","10-cv-4405","Gagner v. Southern Wine and Spirits of America, Inc.","settlement","","","","","","","USA","Florida","privately held","","wholesalers","wholesalers-beverages","https://www.law360.com/articles/357848/liquor-co-to-pay-3-5m-for-sales-reps-unpaid-expenses",""
"Southern Wine and Spirits","Southern Glazer's Wine & Spirits","$1,750,000","$0","$1,750,000","2012","20120206","employment-related offenses","wage and hour violation","","overtime violation","federal","private litigation","","civil","","Central District of California","11-cv-5849","Nicolas Gonzalez v. Southern Wine and Spirits of America Inc et al","settlement","","","","","","","USA","Florida","privately held","","wholesalers","wholesalers-beverages","https://www.law360.com/articles/287807/liquor-co-pays-1-8m-to-put-cork-in-ot-action",""
"Southern Wine and Spirits","Southern Glazer's Wine & Spirits","$1,000,000","$0","$1,000,000","2010","20100709","employment-related offenses","wage and hour violation","","meal/rest break violation","federal","private litigation","","civil","","Central District of California","09-cv-2599","James Jape v. Southern Wine And Spirits of America Inc","settlement","","","","","","","USA","Florida","privately held","","wholesalers","wholesalers-beverages","http://www.ackermanntilajef.com/prior-cases/",""
"Southern Wine & Spirits of New York, Inc.","Southern Glazer's Wine & Spirits","$200,000","$0","$200,000","2006","20060830","consumer-protection-related offenses","consumer protection violation","","The New York Attorney General announced that eight major liquor wholesalers would pay $1.6 million as part of the settlement of an investigation of illegal marketing practices. The announcement did not specify how the amount would be divided up among the eight. Here we assume it was split evenly among them.","state","agency action","New York Attorney General","civil","","","","","","New York","","","","","","USA","Florida","privately held","","wholesalers","wholesalers-beverages","https://web.archive.org/web/20101111170052/http://www.ag.ny.gov/media_center/2006/aug/aug30a_06.html",""
"Southern Wine and Spirits of Upstate New York, Inc.","Southern Glazer's Wine & Spirits","$200,000","$0","$200,000","2006","20060830","consumer-protection-related offenses","consumer protection violation","","The New York Attorney General announced that eight major liquor wholesalers would pay $1.6 million as part of the settlement of an investigation of illegal marketing practices. The announcement did not specify how the amount would be divided up among the eight. Here we assume it was split evenly among them.","state","agency action","New York Attorney General","civil","","","","","","New York","","","","","","USA","Florida","privately held","","wholesalers","wholesalers-beverages","https://web.archive.org/web/20101111170052/http://www.ag.ny.gov/media_center/2006/aug/aug30a_06.html",""
"Southern Glazer's Wine and Spirits of Pennsylvania, LLC","Southern Glazer's Wine & Spirits","$5,000,000","$0","$5,000,000","2017","20170727","competition-related offenses","kickbacks and bribery","","","federal","agency action","U.S. Attorney-Middle District of Pennsylvania","criminal","non-prosecution agreement","","","","","","","","","","","USA","Florida","privately held","","wholesalers","wholesalers-beverages","https://www.justice.gov/usao-mdpa/pr/four-vendors-pa-liquor-control-board-agree-pay-over-9-million-monetary-penalties",""
"Southern Glazer's Wine and Spirits of Texas, LLC","Southern Glazer's Wine & Spirits","$11,205","$0","$11,205","2018","20180503","employment-related offenses","labor relations violation","","","federal","agency action","National Labor Relations Board","civil","","","16-CA-199572","","","Texas","Houston","","","","","USA","Florida","privately held","","wholesalers","wholesalers-beverages","Extracted from a spreadsheet obtained from the NLRB through a Freedom of Information Act request fulfilled on 5/28/2020.",""
"SOUTHERN WINE & SPIRITS OF AMERICA INC","Southern Glazer's Wine & Spirits","$18,560","$0","$18,560","2013","20130215","safety-related offenses","workplace safety or health violation","","","federal","agency action","Occupational Safety & Health Administration","civil","","","","","","California","SANTA FE SPRINGS","13500 FOSTER RD","90670","424820","424820: Wine and Distilled Alcoholic Beverage Merchant Wholesalers","USA","Florida","privately held","","wholesalers","wholesalers-beverages","Extracted from a download of OSHA's Enforcment Data downloaded on 3/02/2022, available at https://enforcedata.dol.gov/views/data_catalogs.php",""
"SOUTHERN WINE & SPIRITS OF UPSTATE NEW YORK INC.","Southern Glazer's Wine & Spirits","$11,550","$0","$11,550","2013","20130116","safety-related offenses","workplace safety or health violation","","","federal","agency action","Occupational Safety & Health Administration","civil","","","","","","New York","SYRACUSE","3063 COURT STREET","13208","424820","424820: Wine and Distilled Alcoholic Beverage Merchant Wholesalers","USA","Florida","privately held","","wholesalers","wholesalers-beverages","Extracted from a download of OSHA's Enforcment Data downloaded on 3/02/2022, available at https://enforcedata.dol.gov/views/data_catalogs.php",""
"SOUTHERN WINE & SPIRITS OF HAWAII","Southern Glazer's Wine & Spirits","$18,234","$0","$18,234","2015","20150521","safety-related offenses","workplace safety or health violation","","","federal","agency action","Occupational Safety & Health Administration","civil","","","","","","Hawaii","KAMUELA","61-3785 MALUOKALANI PL #12","96743","424820","424820: Wine and Distilled Alcoholic Beverage Merchant Wholesalers","USA","Florida","privately held","","wholesalers","wholesalers-beverages","Extracted from a download of OSHA's Enforcment Data downloaded on 3/02/2022, available at https://enforcedata.dol.gov/views/data_catalogs.php",""
"SOUTHERN GLAZER'S WINE & SPIRITS OF UPSTATE NEW YORK","Southern Glazer's Wine & Spirits","$9,748","$0","$9,748","2017","20171004","safety-related offenses","workplace safety or health violation","","","federal","agency action","Occupational Safety & Health Administration","civil","","","","","","New York","SYRACUSE","3063 COURT STREET","13208","424820","424820: Wine and Distilled Alcoholic Beverage Merchant Wholesalers","USA","Florida","privately held","","wholesalers","wholesalers-beverages","Extracted from a download of OSHA's Enforcment Data downloaded on 3/02/2022, available at https://enforcedata.dol.gov/views/data_catalogs.php",""
"SOUTHERN GLAZERS WINE AND SPIRITS, LLC","Southern Glazer's Wine & Spirits","$7,760","$0","$7,760","2017","20171127","safety-related offenses","workplace safety or health violation","","","federal","agency action","Occupational Safety & Health Administration","civil","","","","","","Florida","LAKELAND","4440 OLD TAMPA HWY","33811","424820","424820: Wine and Distilled Alcoholic Beverage Merchant Wholesalers","USA","Florida","privately held","","wholesalers","wholesalers-beverages","Extracted from a download of OSHA's Enforcment Data downloaded on 3/02/2022, available at https://enforcedata.dol.gov/views/data_catalogs.php",""
"SOUTHERN GLAZER'S WINE & SPIRIT, LLC","Southern Glazer's Wine & Spirits","$22,815","$0","$22,815","2017","20171130","safety-related offenses","workplace safety or health violation","","","federal","agency action","Occupational Safety & Health Administration","civil","","","","","","Texas","HOUSTON","9350 EAST POINT DRIVE","77054","493110","493110: General Warehousing and Storage","USA","Florida","privately held","","wholesalers","wholesalers-beverages","Extracted from a download of OSHA's Enforcment Data downloaded on 3/02/2022, available at https://enforcedata.dol.gov/views/data_catalogs.php",""
