"Company","Parent Company","Penalty Amount","Subtraction From Penalty","Penalty Amount Adjusted For Eliminating Multiple Counting","Penalty Year","Penalty Date","Offense Group","Primary Offense","Secondary Offense","Description","Level of Government","Action Type","Agency","Civil/Criminal","Prosecution Agreement","Court","Case ID","Private Litigation Case Title","Lawsuit Resolution","Facility State","City","Address","Zip","NAICS Code","NAICS Translation","HQ Country of Parent","HQ State of Parent","Ownership Structure","Parent Company Stock Ticker","Major Industry of Parent","Specific Industry of Parent","Info Source","Notes"
"FCStone LLC","StoneX Group","$1,500,000","$0","$1,500,000","2013","20130529","financial offenses","investor protection violation","securities issuance or trading violation","","federal","agency action","Commodity Futures Trading Commission","civil","","","","","","","","","","","","USA","New York","publicly traded","SNEX","financial services","commodities brokerage","http://www.cftc.gov/PressRoom/PressReleases/pr6594-13",""
"FCStone, LLC","StoneX Group","$140,000","$0","$140,000","2015","20150501","financial offenses","investor protection violation","securities issuance or trading violation","","federal","agency action","Commodity Futures Trading Commission","civil","","","","","","","","","","","","USA","New York","publicly traded","SNEX","financial services","commodities brokerage","http://www.cftc.gov/PressRoom/PressReleases/pr7168-15",""
"FCStone, LLC and Commodity Operations Inc.","StoneX Group","$260,000","$0","$260,000","2012","20120313","financial offenses","investor protection violation","securities issuance or trading violation","","federal","agency action","Commodity Futures Trading Commission","civil","","","","","","","","","","","","USA","New York","publicly traded","SNEX","financial services","commodities brokerage","http://www.cftc.gov/PressRoom/PressReleases/pr6205-12",""
"INTL FCStone","StoneX Group","$150,000","$0","$150,000","2016","20160412","financial offenses","accounting fraud or deficiencies","","","federal","agency action","Securities and Exchange Commission","civil","","","","","","","","","","","","USA","New York","publicly traded","SNEX","financial services","commodities brokerage","https://www.sec.gov/litigation/admin/2016/34-77596.pdf",""
"INTL FCStone Markets, LLC","StoneX Group","$200,000","$0","$200,000","2015","20150819","financial offenses","investor protection violation","securities issuance or trading violation","","federal","agency action","Commodity Futures Trading Commission","civil","","","","","","","","","","","","USA","New York","publicly traded","SNEX","financial services","commodities brokerage","http://www.cftc.gov/PressRoom/PressReleases/pr7216-15",""
"INTL FCStone Financial Inc.","StoneX Group","$280,000","$0","$280,000","2017","20171114","financial offenses","investor protection violation","securities issuance or trading violation","The Commodity Futures Trading Commission issued an order filing and settling charges against FCStone Merchant Services LLC for entering into multiple noncompetitive trades and against INTL FCStone Financial Inc., a registered Futures Commission Merchant based in Chicago, for reporting non-bona fide prices to the Chicago Mercantile Exchange (CME) between December 2013 and March 2014.","federal","agency action","Commodity Futures Trading Commission","civil","","","","","","","","","","","","USA","New York","publicly traded","SNEX","financial services","commodities brokerage","http://www.cftc.gov/PressRoom/PressReleases/pr7644-17",""
