"Company","Parent Company","Penalty Amount","Subtraction From Penalty","Penalty Amount Adjusted For Eliminating Multiple Counting","Penalty Year","Penalty Date","Offense Group","Primary Offense","Secondary Offense","Description","Level of Government","Action Type","Agency","Civil/Criminal","Prosecution Agreement","Court","Case ID","Private Litigation Case Title","Lawsuit Resolution","Facility State","City","Address","Zip","NAICS Code","NAICS Translation","HQ Country of Parent","HQ State of Parent","Ownership Structure","Parent Company Stock Ticker","Major Industry of Parent","Specific Industry of Parent","Info Source","Notes"
"MONTAPLAST","Stulz","$8,935","$0","$8,935","2004","20041118","employment-related offenses","labor relations violation","","back pay award in unfair labor practices case","federal","agency action","National Labor Relations Board","civil","","","09-CA-41104-001","","","Kentucky","Frankfort","","40601","336311","336311: Carburetor, Piston, Piston Ring, and Valve Manufacturing","Germany","","privately held","","automotive parts","automotive parts; air conditioning systems","Extracted from an NLRB dataset covering 1999-2011 downloaded at https://catalog.data.gov/dataset/nlrb-cats-final-c-case-data-bulk-19990101-20110930-in-xml",""
"MONTAPLAST OF NORTH AMERICA, INC.","Stulz","$14,000","$0","$14,000","2016","20161017","safety-related offenses","workplace safety or health violation","","","federal","agency action","Occupational Safety & Health Administration","civil","","","","","","Kentucky","HATTON","2011 HOOVER BLVD","40601","326121","326121: Unlaminated Plastics Profile Shape Manufacturing","Germany","","privately held","","automotive parts","automotive parts; air conditioning systems","Extracted from a download of OSHA's Enforcment Data downloaded on 3/02/2022, available at https://enforcedata.dol.gov/views/data_catalogs.php",""
"MONTAPLAST OF NORTH AMERICA INC","Stulz","$7,000","$0","$7,000","2016","20161017","safety-related offenses","workplace safety or health violation","","","federal","agency action","Occupational Safety & Health Administration","civil","","","","","","Kentucky","HATTON","2011 HOOVER BLVD","40601","326121","326121: Unlaminated Plastics Profile Shape Manufacturing","Germany","","privately held","","automotive parts","automotive parts; air conditioning systems","Extracted from a download of OSHA's Enforcment Data downloaded on 3/02/2022, available at https://enforcedata.dol.gov/views/data_catalogs.php",""
"STULZ AIR TECHNOLOGY SYSTEMS, INC","Stulz","$47,600","$0","$47,600","2018","20180307","safety-related offenses","workplace safety or health violation","","","federal","agency action","Occupational Safety & Health Administration","civil","","","","","","Maryland","FREDERICK","1572 TILCO DRIVE","21704","333415","333415: Air-Conditioning and Warm Air Heating Equipment and Commercial and Industrial Refrigeration Equipmen","Germany","","privately held","","automotive parts","automotive parts; air conditioning systems","Extracted from a download of OSHA's Enforcment Data downloaded on 3/02/2022, available at https://enforcedata.dol.gov/views/data_catalogs.php",""
"MONTAPLAST OF NORTH AMERICA INC","Stulz","$5,950","$0","$5,950","2021","20210527","safety-related offenses","workplace safety or health violation","","","federal","agency action","Occupational Safety & Health Administration","civil","","","","","","Kentucky","HATTON","2011 HOOVER BLVD","40601","326121","326121: Unlaminated Plastics Profile Shape Manufacturing","Germany","","privately held","","automotive parts","automotive parts; air conditioning systems","Extracted from a download of OSHA's Enforcment Data downloaded on 3/02/2022, available at https://enforcedata.dol.gov/views/data_catalogs.php",""
