"Company","Parent Company","Penalty Amount","Subtraction From Penalty","Penalty Amount Adjusted For Eliminating Multiple Counting","Penalty Year","Penalty Date","Offense Group","Primary Offense","Secondary Offense","Description","Level of Government","Action Type","Agency","Civil/Criminal","Prosecution Agreement","Court","Case ID","Private Litigation Case Title","Lawsuit Resolution","Facility State","City","Address","Zip","NAICS Code","NAICS Translation","HQ Country of Parent","HQ State of Parent","Ownership Structure","Parent Company Stock Ticker","Major Industry of Parent","Specific Industry of Parent","Info Source","Notes"
"TAYLOR CORP, DBA, CORPORATE GRAPHICS","Taylor Corporation","$24,350","$0","$24,350","2006","20060414","safety-related offenses","workplace safety or health violation","","","federal","agency action","Occupational Safety & Health Administration","civil","","","","","","California","BALDWIN PARK","5160 RIVERGRADE RD","91706","323110","323110: Commercial Lithographic Printing","USA","Minnesota","privately held","","miscellaneous services","printing","Extracted from a download of OSHA's Enforcment Data downloaded on 3/02/2022, available at https://enforcedata.dol.gov/views/data_catalogs.php",""
"CORPORATE GRAPHICS INTERNATIONAL","Taylor Corporation","$6,075","$0","$6,075","2003","20030115","safety-related offenses","workplace safety or health violation","","","federal","agency action","Occupational Safety & Health Administration","civil","","","","","","New Jersey","PISCATAWAY","120 ETHEL RD.","08854","323110","323110: Commercial Lithographic Printing","USA","Minnesota","privately held","","miscellaneous services","printing","Extracted from a download of OSHA's Enforcment Data downloaded on 3/02/2022, available at https://enforcedata.dol.gov/views/data_catalogs.php",""
"SCHMIDT PRINTING","Taylor Corporation","$8,085","$0","$8,085","2000","20000119","safety-related offenses","workplace safety or health violation","","","federal","agency action","Occupational Safety & Health Administration","civil","","","","","","Minnesota","BYRON","1101 FRONTAGE RD NW","55920","000000","","USA","Minnesota","privately held","","miscellaneous services","printing","Extracted from a download of OSHA's Enforcment Data downloaded on 3/02/2022, available at https://enforcedata.dol.gov/views/data_catalogs.php",""
"Amsterdam Printing & Litho, Inc.","Taylor Corporation","$7,100","$0","$7,100","2013","20131209","environment-related offenses","environmental violation","","","state","agency action","New York Department of Environmental Conservation","civil","","","","","","New York","Amsterdam","","","","","USA","Minnesota","privately held","","miscellaneous services","printing","https://web.archive.org/web/20201124014006/https://www.dec.ny.gov/docs/regions_pdf/amsterdamprintinglitho.pdf",""
"CORPORATE GRAPHICS INTL EAST COAST DIV.","Taylor Corporation","$17,250","$0","$17,250","2011","20110119","safety-related offenses","workplace safety or health violation","","","federal","agency action","Occupational Safety & Health Administration","civil","","","","","","New Jersey","PISCATAWAY","120 ETHEL RD. W","08854","323110","323110: Commercial Lithographic Printing","USA","Minnesota","privately held","","miscellaneous services","printing","Extracted from a download of OSHA's Enforcment Data downloaded on 3/02/2022, available at https://enforcedata.dol.gov/views/data_catalogs.php",""
"AMSTERDAM PRINTING & LITHO","Taylor Corporation","$5,000","$0","$5,000","2000","20001025","environment-related offenses","environmental violation","","","federal","agency action","Environmental Protection Agency","civil","","","02-2001-4206","","","New York","AMSTERDAM","166 WALLINS CORNERS RD.","12010-9989","339999","339999: All Other Miscellaneous Manufacturing","USA","Minnesota","privately held","","miscellaneous services","printing","Extracted from a download of the EPA's Enforcement and Compliance History Online (ECHO) ICIS FE&C file downloaded on 3/02/2022, available at http://echo.epa.gov/tools/data-downloads#downloads",""
"Amsterdam Printing & Litho","Taylor Corporation","$21,330","$0","$21,330","2012","20120605","environment-related offenses","environmental violation","","","federal","agency action","Environmental Protection Agency","civil","","","02-2012-4105","","","New York","AMSTERDAM","166 WALLINS CORNERS RD","12010","339999","339999: All Other Miscellaneous Manufacturing","USA","Minnesota","privately held","","miscellaneous services","printing","Extracted from a download of the EPA's Enforcement and Compliance History Online (ECHO) ICIS FE&C file downloaded on 3/02/2022, available at http://echo.epa.gov/tools/data-downloads#downloads",""
