"Company","Parent Company","Penalty Amount","Subtraction From Penalty","Penalty Amount Adjusted For Eliminating Multiple Counting","Penalty Year","Penalty Date","Offense Group","Primary Offense","Secondary Offense","Description","Level of Government","Action Type","Agency","Civil/Criminal","Prosecution Agreement","Court","Case ID","Private Litigation Case Title","Lawsuit Resolution","Facility State","City","Address","Zip","NAICS Code","NAICS Translation","HQ Country of Parent","HQ State of Parent","Ownership Structure","Parent Company Stock Ticker","Major Industry of Parent","Specific Industry of Parent","Info Source","Notes"
"Barracuda Network, Inc. and Barracuda Networks, Ltd.","Thoma Bravo","$1,500,000","$0","$1,500,000","2015","20151123","competition-related offenses","export control violation","","","federal","agency action","Bureau of Industry and Security","civil","","","","","","","","","","","","USA","New York","privately held","","private equity (including portfolio companies)","private equity (including portfolio companies)","http://efoia.bis.doc.gov/index.php/component/docman/doc_download/1035-e2444?Itemid=",""
"Porter & Chester Institute","Thoma Bravo","$121,439","$0","$121,439","2010","20100713","employment-related offenses","wage and hour violation","Fair Labor Standards Act","","federal","agency action","Labor Department Wage and Hour Division","civil","","","1564412","","","Connecticut","Rocky Hill","","06067","9720","","USA","New York","privately held","","private equity (including portfolio companies)","private equity (including portfolio companies)","March 7, 2017 download of a dataset posted by the Wage and Hour Division at https://enforcedata.dol.gov/views/data_summary.php","Date and year are the Findings End Date in the dataset posted by the Wage and Hour Division, which does not provide case opening or closing dates. The company name is the Legal Name provided by the dataset unless that field is blank, in which case the Trade Name is used. The dataset provides only one address and does not indicate whether it is the company headquarters address or the establishment address. The penalty amount is the total of civil monetary penalties and mandated back wages. The original dataset provides a breakdown."
"Barracuda Networks, Inc.","Thoma Bravo","$38,930","$0","$38,930","2015","20151124","financial offenses","economic sanction violation","","","federal","agency action","Office of Foreign Assets Control","civil","","","","","","","","","","","","USA","New York","privately held","","private equity (including portfolio companies)","private equity (including portfolio companies)","https://www.treasury.gov/resource-center/sanctions/CivPen/Documents/20151124_Barracuda.pdf",""
"THE PORTER AND CHESTER INSTITUTE, INC.","Thoma Bravo","$24,000","$0","$24,000","2014","20140606","safety-related offenses","workplace safety or health violation","","","federal","agency action","Occupational Safety & Health Administration","civil","","","","","","Massachusetts","WOBURN","8 PRESIDENTAL WAY","01801","611519","611519: Other Technical and Trade Schools","USA","New York","privately held","","private equity (including portfolio companies)","private equity (including portfolio companies)","Extracted from a download of OSHA's Enforcment Data downloaded on 3/02/2022, available at https://enforcedata.dol.gov/views/data_catalogs.php",""
"THE PORTER AND CHESTER INSTITUTE, INC.","Thoma Bravo","$6,500","$0","$6,500","2014","20141114","safety-related offenses","workplace safety or health violation","","","federal","agency action","Occupational Safety & Health Administration","civil","","","","","","Massachusetts","CHICOPEE","1984 WESTOVER ROAD","01022","611519","611519: Other Technical and Trade Schools","USA","New York","privately held","","private equity (including portfolio companies)","private equity (including portfolio companies)","Extracted from a download of OSHA's Enforcment Data downloaded on 3/02/2022, available at https://enforcedata.dol.gov/views/data_catalogs.php",""
