"Company","Parent Company","Penalty Amount","Subtraction From Penalty","Penalty Amount Adjusted For Eliminating Multiple Counting","Penalty Year","Penalty Date","Offense Group","Primary Offense","Secondary Offense","Description","Level of Government","Action Type","Agency","Civil/Criminal","Prosecution Agreement","Court","Case ID","Private Litigation Case Title","Lawsuit Resolution","Facility State","City","Address","Zip","NAICS Code","NAICS Translation","HQ Country of Parent","HQ State of Parent","Ownership Structure","Parent Company Stock Ticker","Major Industry of Parent","Specific Industry of Parent","Info Source","Notes"
"North American Midway Entertainment Southeast","Townsquare Media","$80,617","$0","$80,617","2015","20150217","employment-related offenses","wage and hour violation","","minimum wage violation","state","agency action","Massachusetts Attorney General","civil","","","","","","Massachusetts","","","","","","USA","Connecticut","publicly traded","TSQ","media","media and entertainment","https://www.mass.gov/service-details/fair-labor-division-data",""
"North American Midway Entertainment Southeast","Townsquare Media","$13,596","$0","$13,596","2015","20150217","employment-related offenses","wage and hour violation","","","state","agency action","Massachusetts Attorney General","civil","","","","","","Massachusetts","","","","","","USA","Connecticut","publicly traded","TSQ","media","media and entertainment","https://www.mass.gov/service-details/fair-labor-division-data",""
"NORTH AMERICAN MIDWAY ENTERTAINMENT","Townsquare Media","$8,988","$0","$8,988","2010","20101011","safety-related offenses","workplace safety or health violation","","","federal","agency action","Occupational Safety & Health Administration","civil","","","","","","South Carolina","COLUMBIA","1200 ROSEWOOD DRIVE","29201","713990","713990: All Other Amusement and Recreation Industries","USA","Connecticut","publicly traded","TSQ","media","media and entertainment","Extracted from a download of OSHA's Enforcment Data downloaded on 3/02/2022, available at https://enforcedata.dol.gov/views/data_catalogs.php",""
"NORTH AMERICAN MIDWAY ENTERTAINMENT- SOUTHEAST, LLC","Townsquare Media","$6,338","$0","$6,338","2017","20170310","safety-related offenses","workplace safety or health violation","","","federal","agency action","Occupational Safety & Health Administration","civil","","","","","","Florida","MIAMI","10901 SW 24TH ST.","33165","713990","713990: All Other Amusement and Recreation Industries","USA","Connecticut","publicly traded","TSQ","media","media and entertainment","Extracted from a download of OSHA's Enforcment Data downloaded on 3/02/2022, available at https://enforcedata.dol.gov/views/data_catalogs.php",""
"NORTH AMERICAN MIDWAY ENTERTAINMENT-ASTRO AMUSEMENT, LLC","Townsquare Media","$13,970","$0","$13,970","2018","20180806","safety-related offenses","workplace safety or health violation","","","federal","agency action","Occupational Safety & Health Administration","civil","","","","","","Illinois","SPRINGFIELD","801 SANGAMON AVE","62702","713990","713990: All Other Amusement and Recreation Industries","USA","Connecticut","publicly traded","TSQ","media","media and entertainment","Extracted from a download of OSHA's Enforcment Data downloaded on 3/02/2022, available at https://enforcedata.dol.gov/views/data_catalogs.php",""
