"Company","Parent Company","Penalty Amount","Subtraction From Penalty","Penalty Amount Adjusted For Eliminating Multiple Counting","Penalty Year","Penalty Date","Offense Group","Primary Offense","Secondary Offense","Description","Level of Government","Action Type","Agency","Civil/Criminal","Prosecution Agreement","Court","Case ID","Private Litigation Case Title","Lawsuit Resolution","Facility State","City","Address","Zip","NAICS Code","NAICS Translation","HQ Country of Parent","HQ State of Parent","Ownership Structure","Parent Company Stock Ticker","Major Industry of Parent","Specific Industry of Parent","Info Source","Notes"
"YAMAHA MOTOR MANUFACTURING CORPORATION OF AMERICA","Yamaha Motor","$67,725","$0","$67,725","2002","20020603","safety-related offenses","workplace safety or health violation","","","federal","agency action","Occupational Safety & Health Administration","civil","","","","","","Georgia","NEWNAN","1000 GA HIGHWAY 34 EAST","30265","000000","","Japan","","publicly traded","","motor vehicles","motor vehicles","Extracted from a download of OSHA's Enforcment Data downloaded on 3/02/2022, available at https://enforcedata.dol.gov/views/data_catalogs.php",""
"Yamaha Motor Corporation, U.S.A.","Yamaha Motor","$8,625","$0","$8,625","2013","20130301","environment-related offenses","environmental violation","","air pollution violation","state","agency action","California Air Resources Board","civil","","","","","","California","","","","","","Japan","","publicly traded","","motor vehicles","motor vehicles","https://ww2.arb.ca.gov/yamaha-motor-corporation-usa-settlement-2013",""
"Yamaha Motor Corporation, U.S.A.","Yamaha Motor","$36,000","$0","$36,000","2013","20130201","environment-related offenses","environmental violation","","air pollution violation","state","agency action","California Air Resources Board","civil","","","","","","California","","","","","","Japan","","publicly traded","","motor vehicles","motor vehicles","https://ww2.arb.ca.gov/yamaha-motor-corporation-usa-settlement",""
"Yamaha Motor Company, USA & Yamaha Motor Company, Ltd.","Yamaha Motor","$1,950,000","$0","$1,950,000","2012","20121201","environment-related offenses","environmental violation","","air pollution violation","state","agency action","California Air Resources Board","civil","","","","","","California","","","","","","Japan","","publicly traded","","motor vehicles","motor vehicles","https://ww2.arb.ca.gov/yamaha-settlement-2012",""
"YAMAHA MARINE SYSTEMS COMPANY INC.","Yamaha Motor","$14,000","$0","$14,000","2021","20210701","safety-related offenses","workplace safety or health violation","","","federal","agency action","Occupational Safety & Health Administration","civil","","","","","","Wisconsin","MILWAUKEE","5625 WEST CLINTON AVENUE","53223","326199","326199: All Other Plastics Product Manufacturing","Japan","","publicly traded","","motor vehicles","motor vehicles","Extracted from a download of OSHA's Enforcment Data downloaded on 3/02/2022, available at https://enforcedata.dol.gov/views/data_catalogs.php",""
"Yamaha Motor Corp., USA","Yamaha Motor","$950,000","$0","$950,000","2015","20150914","environment-related offenses","environmental violation","","","federal","agency action","Environmental Protection Agency","civil","","","EF-2015-8146","","","California","CYPRESS","6555 KATELLA AVE","90630","","","Japan","","publicly traded","","motor vehicles","motor vehicles","Extracted from a download of the EPA's Enforcement and Compliance History Online (ECHO) ICIS FE&C file downloaded on 3/02/2022, available at http://echo.epa.gov/tools/data-downloads#downloads",""
