"Company","Parent Company","Penalty Amount","Subtraction From Penalty","Penalty Amount Adjusted For Eliminating Multiple Counting","Penalty Year","Penalty Date","Offense Group","Primary Offense","Secondary Offense","Description","Level of Government","Action Type","Agency","Civil/Criminal","Prosecution Agreement","Court","Case ID","Private Litigation Case Title","Lawsuit Resolution","Facility State","City","Address","Zip","NAICS Code","NAICS Translation","HQ Country of Parent","HQ State of Parent","Ownership Structure","Parent Company Stock Ticker","Major Industry of Parent","Specific Industry of Parent","Info Source","Notes"
"Zeon Chemicals L.P.","Zeon Corporation","$10,500,000","$0","$10,500,000","2005","20050112","competition-related offenses","price-fixing or anti-competitive practices","","Zeon Chemicals L.P., a Kentucky-based wholly owned subsidiary of Zeon Corporation of Tokyo, Japan, agreed to plead guilty and to pay a $10.5 million criminal fine for participating in a conspiracy to fix prices of synthetic rubber used to manufacture a variety of products including automotive parts.","federal","agency action","Justice Department Antitrust Division","criminal","","","","","","","","","","","","Japan","","publicly traded","","chemicals","chemicals","https://www.justice.gov/archive/atr/public/press_releases/2005/207142.htm",""
"ZEON CHEMICALS LIMITED PARTNERSHIP","Zeon Corporation","$6,300","$0","$6,300","2014","20140701","safety-related offenses","workplace safety or health violation","","","federal","agency action","Occupational Safety & Health Administration","civil","","","","","","Kentucky","LOUISVILLE","4100 BELLS LANE","40211","325212","325212: Synthetic Rubber Manufacturing","Japan","","publicly traded","","chemicals","chemicals","Extracted from a download of OSHA's Enforcment Data downloaded on 3/02/2022, available at https://enforcedata.dol.gov/views/data_catalogs.php",""
"ZEON CHEMICALS, L.P.","Zeon Corporation","$28,386","$0","$28,386","2005","20050301","environment-related offenses","environmental violation","","","federal","agency action","Environmental Protection Agency","civil","","","04-2005-1505","","","Kentucky","LOUISVILLE","4100 BELLS LANE","40211-2147","325212","325212: Synthetic Rubber Manufacturing","Japan","","publicly traded","","chemicals","chemicals","Extracted from a download of the EPA's Enforcement and Compliance History Online (ECHO) ICIS FE&C file downloaded on 3/02/2022, available at http://echo.epa.gov/tools/data-downloads#downloads",""
"ZEON CHEMICALS L.P.","Zeon Corporation","$15,553","$0","$15,553","2007","20070806","environment-related offenses","environmental violation","","","federal","agency action","Environmental Protection Agency","civil","","","04-2007-2037","","","Kentucky","LOUISVILLE","4100 BELLS LANE","40211","325212","325212: Synthetic Rubber Manufacturing","Japan","","publicly traded","","chemicals","chemicals","Extracted from a download of the EPA's Enforcement and Compliance History Online (ECHO) ICIS FE&C file downloaded on 3/02/2022, available at http://echo.epa.gov/tools/data-downloads#downloads",""
"ZEON CHEMICALS LP","Zeon Corporation","$67,055","$0","$67,055","2012","20120508","environment-related offenses","environmental violation","","","federal","agency action","Environmental Protection Agency","civil","","","04-2012-2034","","","Mississippi","HATTIESBURG","1301 W. 7TH ST.","39401-2800","325212","325212: Synthetic Rubber Manufacturing","Japan","","publicly traded","","chemicals","chemicals","Extracted from a download of the EPA's Enforcement and Compliance History Online (ECHO) ICIS FE&C file downloaded on 3/02/2022, available at http://echo.epa.gov/tools/data-downloads#downloads",""
